title,author,date,link,pdf_link,query,search_engine,nr_found,cite_count,doi
Processing merchant point-of-sale transactions using a mobile subscriber device,"D Benco, S Mahajan, B Sheen, S True - US Patent App. 11/280,550, 2007 - Google Patents",2007,https://patents.google.com/patent/US20070108269A1/en,No PDF available,,,1,50,No DOI available
System and Method for Facilitating Electronic Financial Transactions Using a Mobile Telecommunication Device,"G Leung, R Lee, K Cheng, P Chui… - US Patent App. 12 …, 2008 - Google Patents",2008,https://patents.google.com/patent/US20080288351A1/en,No PDF available,,,1,57,No DOI available
Dynamic windowing system in a transaction base network for a client to request transactions of transient programs at a server,"ML Brandt, JV DiCecco, JR Hansen, TJ O'keefe… - US Patent …, 1999 - Google Patents",1999,https://patents.google.com/patent/US5920696A/en,No PDF available,,,1,87,No DOI available
"Mobile commerce: Promises, challenges and research agenda","K Siau, EP Lim, Z Shen - Journal of Database Management (JDM), 2001 - igi-global.com",2001,https://www.igi-global.com/article/journal-database-management-jdm/3264,https://www.researchgate.net/profile/Keng_Siau/publication/220373657_Mobile_Commerce_Promises_Challenges_and_Research_Agenda/links/5984f30c0f7e9b6c852f50f1/Mobile-Commerce-Promises-Challenges-and-Research-Agenda.pdf,,,1,543,No DOI available
A comparison of some channel assignment strategies in large-scale mobile communications systems,"D Cox, D Reudink - IEEE Transactions on Communications, 1972 - ieeexplore.ieee.org",1972,https://ieeexplore.ieee.org/abstract/document/1091134/,No PDF available,,,1,148,No DOI available
"Stable flocking of mobile agents, Part I: Fixed topology","HG Tanner, A Jadbabaie… - Decision and Control …, 2003 - ieeexplore.ieee.org",2003,https://ieeexplore.ieee.org/abstract/document/1272910/,https://repository.upenn.edu/cgi/viewcontent.cgi?article=1109&context=ese_papers,,,1,904,No DOI available
The Bayou architecture: Support for data sharing among mobile users,"A Demers, K Petersen, M Spreitzer… - Mobile Computing …, 1994 - ieeexplore.ieee.org",1994,https://ieeexplore.ieee.org/abstract/document/4624416/,http://www.academia.edu/download/44572933/The_Bayou_Architecture_Support_for_Data_20160409-21644-1562oq8.pdf,,,1,434,No DOI available
"Development perspectives, firm strategies and applications in mobile commerce","F Buellingen, M Woerter - Journal of business Research, 2004 - Elsevier",2004,https://www.sciencedirect.com/science/article/pii/S0148296302004290,No PDF available,,,1,257,No DOI available
The PARCTAB mobile computing system,"BN Schilit, N Adams, R Gold, MM Tso… - … ., Fourth Workshop on, 1993 - ieeexplore.ieee.org",1993,https://ieeexplore.ieee.org/abstract/document/348175/,http://citeseerx.ist.psu.edu/viewdoc/download?doi=10.1.1.43.9880&rep=rep1&type=pdf,,,1,400,No DOI available
Influence of environmental buildings on UHF land mobile radio propagation,"S Kozono, K Watanabe - IEEE Transactions on …, 1977 - ieeexplore.ieee.org",1977,https://ieeexplore.ieee.org/abstract/document/1093736/,No PDF available,,,1,83,No DOI available
Location management for mobile commerce applications in wireless internet environment,"U Varshney - ACM Transactions on Internet Technology (TOIT), 2003 - dl.acm.org",2003,https://dl.acm.org/citation.cfm?id=857169,http://www.pitt.edu/~dtipper/3955/acm_paper.pdf,,,1,225,No DOI available
Spectral efficiency improvement by base station antenna pattern control for land mobile cellular systems,"T OHGANE - IEICE Transactions on Communications, 1994 - search.ieice.org",1994,https://search.ieice.org/bin/summary.php?id=e77-b_5_598,No PDF available,,,1,47,No DOI available
