title,author,date,link,pdf_link,query,search_engine,nr_found,cite_count,doi
A survey of mobile transactions,"P Serrano-Alvarado, C Roncancio, M Adiba - Distributed and Parallel …, 2004 - Springer",2004,https://link.springer.com/article/10.1023/B:DAPD.0000028552.69032.f9,https://hal.archives-ouvertes.fr/docs/00/41/56/04/PDF/PSerrano-Survey-Version_accepte_DAPD_2004_paperRev.pdf,,,1,129,No DOI available
Hicomo: High commit mobile transactions,"M Lee, S Helal - Distributed and Parallel Databases, 2002 - Springer",2002,https://link.springer.com/article/10.1023/A:1013381624108,http://citeseerx.ist.psu.edu/viewdoc/download?doi=10.1.1.4.9439&rep=rep1&type=pdf,,,1,52,No DOI available
Analyzing mobile transactions support for DBMS,"P Serrano-Alvarado, CL Roncancio… - Database and Expert …, 2001 - ieeexplore.ieee.org",2001,https://ieeexplore.ieee.org/abstract/document/953124/,http://www.cs.ucf.edu/~kienhua/classes/COP6730/Mobile2.pdf,,,1,43,No DOI available
Effects on correlation between two mobile radio base-station antennas,"WCY Lee - IEEE Transactions on Vehicular Technology, 1973 - ieeexplore.ieee.org",1973,https://ieeexplore.ieee.org/abstract/document/1622173/,No PDF available,,,1,431,No DOI available
A mobile transaction model that captures both the data and movement behavior,"MH Dunham, A Helal, S Balakrishnan - Mobile Networks and Applications, 1997 - Springer",1997,https://link.springer.com/article/10.1023/A:1013672431080,http://jotm.objectweb.org/related/p149-dunham.pdf,,,1,298,No DOI available
The performance enhancement of multibeam adaptive base-station antennas for cellular land mobile radio systems,"SC Swales, MA Beach, DJ Edwards… - IEEE Transactions on …, 1990 - ieeexplore.ieee.org",1990,https://ieeexplore.ieee.org/abstract/document/54956/,https://research-information.bristol.ac.uk/files/2990552/swales_IEEE_TransVT_Feb%201990.pdf,,,1,549,No DOI available
Base station polarization diversity reception for mobile radio,"S Kozono, T Tsuruhara… - IEEE Transactions on …, 1984 - ieeexplore.ieee.org",1984,https://ieeexplore.ieee.org/abstract/document/1623221/,No PDF available,,,1,220,No DOI available
System and method for mobile transactions using the bearer independent protocol,"S Goldthwaite, A Petrov, A Doudkine - US Patent 7,280,847, 2007 - Google Patents",2007,https://patents.google.com/patent/US7280847B2/en,No PDF available,,,1,115,No DOI available
Pro-motion: Management of mobile transactions,"GD Walborn, PK Chrysanthis - … of the 1997 ACM symposium on Applied …, 1997 - dl.acm.org",1997,https://dl.acm.org/citation.cfm?id=331718,https://www.ht.sfc.keio.ac.jp/~ume/Paper/2PhaseRecoveryTransaction/Pro-Motion%23ManagementOfMobileTransaction.pdf,,,1,62,No DOI available
Polarization diversity system for mobile radio,"WCY Lee, Y Yeh - IEEE Transactions on Communications, 1972 - ieeexplore.ieee.org",1972,https://ieeexplore.ieee.org/abstract/document/1091263/,No PDF available,,,1,384,No DOI available
Rendezvous design algorithms for wireless sensor networks with a mobile base station,"G Xing, T Wang, W Jia, M Li - … ACM international symposium on Mobile …, 2008 - dl.acm.org",2008,https://dl.acm.org/citation.cfm?id=1374650,http://citeseerx.ist.psu.edu/viewdoc/download?doi=10.1.1.437.6953&rep=rep1&type=pdf,,,1,332,No DOI available
Business models and transactions in mobile electronic commerce: requirements and properties,"A Tsalgatidou, E Pitoura - Computer Networks, 2001 - Elsevier",2001,https://www.sciencedirect.com/science/article/pii/S138912860100216X,http://www.cs.uoi.gr/~pitoura/distribution/computer-networks02.pdf,,,1,301,No DOI available
Empirical formula for propagation loss in land mobile radio services,"M Hata - IEEE transactions on Vehicular Technology, 1980 - ieeexplore.ieee.org",1980,https://ieeexplore.ieee.org/abstract/document/1622772/,No PDF available,,,1,3200,No DOI available
Mobile computing and databases: Anything new?,"MH Dunham, A Helal - Acm Sigmod Record, 1995 - dl.acm.org",1995,https://dl.acm.org/citation.cfm?id=219727,https://www.ime.usp.br/~weslley/cursos/redesMoveis/anythingnew.pdf,,,1,248,No DOI available
Mobile transactions using authorized tokens,"MA Calman - US Patent App. 13/553,511, 2014 - Google Patents",2014,https://patents.google.com/patent/US20140025581A1/en,No PDF available,,,1,62,No DOI available
Adaptive antennas at the mobile and base stations in an OFDM/TDMA system,"KK Wong, RSK Cheng, KB Letaief… - IEEE transactions on …, 2001 - ieeexplore.ieee.org",2001,https://ieeexplore.ieee.org/abstract/document/898262/,http://discovery.ucl.ac.uk/13261/1/13261.pdf,,,1,316,No DOI available
Diversity antennas for base and mobile stations in land mobile communication systems,"Y YAMADA, K KAGOSHIMA… - IEICE Transactions on …, 1991 - search.ieice.org",1991,https://search.ieice.org/bin/summary.php?id=e74-b_10_3202,No PDF available,,,1,78,No DOI available
Polarization diversity in mobile communications,"RG Vaughan - IEEE Transactions on Vehicular Technology, 1990 - ieeexplore.ieee.org",1990,https://ieeexplore.ieee.org/abstract/document/130998/,No PDF available,,,1,500,No DOI available
Method and system to enable mobile transactions,"S Al-Sarawi - US Patent 7,424,303, 2008 - Google Patents",2008,https://patents.google.com/patent/US7424303B2/en,No PDF available,,,1,56,No DOI available
Context aware mobile transactions,"P Serrano-Alvarado, C Roncancio, M Adiba, C Labbé - null, 2004 - computer.org",2004,https://www.computer.org/csdl/proceedings/mdm/2004/2070/00/20700167.pdf,https://www.computer.org/csdl/proceedings/mdm/2004/2070/00/20700167.pdf,,,1,11,No DOI available
Communication System And Method Using Visual Interfaces For Mobile Transactions,"E Helwin, T Kolly - US Patent App. 11/793,279, 2008 - Google Patents",2008,https://patents.google.com/patent/US20080091616A1/en,No PDF available,,,1,52,No DOI available
"Operating system having external media layer, workflow layer, internal media layer, and knowledge base for routing media events between transactions","CCM Beck, JM Berke, JA Johnstone… - US Patent …, 2000 - Google Patents",2000,https://patents.google.com/patent/US6108711A/en,No PDF available,,,1,374,No DOI available
Mobile propagation loss and delay spread characteristics with a low base station antenna on an urban road,"S Kozono, A Taguchi - … Transactions on vehicular technology, 1993 - ieeexplore.ieee.org",1993,https://ieeexplore.ieee.org/abstract/document/192393/,No PDF available,,,1,73,No DOI available
A timestamp-based optimistic concurrency control for handling mobile transactions,"HJ Choi, BS Jeong - … Conference on Computational Science and Its …, 2006 - Springer",2006,https://link.springer.com/10.1007%2F11751588_83,No PDF available,,,1,37,No DOI available
Examining trust in mobile banking transactions: The case of M-PESA in Kenya,"O Morawczynski, G Miscione - IFIP International Conference on Human …, 2008 - Springer",2008,https://link.springer.com/chapter/10.1007/978-0-387-84822-8_19,https://link.springer.com/content/pdf/10.1007/978-0-387-84822-8_19.pdf,,,1,119,No DOI available
A dynamic authentication scheme for mobile transactions,"B Sathish Babu, P Venkataram - International Journal of Netwok Security, 2009 - Citeseer",2009,http://citeseerx.ist.psu.edu/viewdoc/download?doi=10.1.1.155.4468&rep=rep1&type=pdf,http://citeseerx.ist.psu.edu/viewdoc/download?doi=10.1.1.155.4468&rep=rep1&type=pdf,,,1,37,No DOI available
Distributing authorized tokens to conduct mobile transactions,"MA Calman - US Patent App. 13/553,423, 2014 - Google Patents",2014,https://patents.google.com/patent/US20140025585A1/en,No PDF available,,,1,45,No DOI available
Interactive system for and method of performing financial transactions from a user base,"PH Nel - US Patent 6,363,364, 2002 - Google Patents",2002,https://patents.google.com/patent/US6363364B1/en,No PDF available,,,1,86,No DOI available
System and method of facilitating contactless payment transactions across different payment systems using a common mobile device acting as a stored value device,"P Staib, J Helm, T Renard - US Patent App. 10/940,939, 2005 - Google Patents",2005,https://patents.google.com/patent/US20050222961A1/en,No PDF available,,,1,338,No DOI available
Mobile communications and mobile services,"K Siau, Z Shen - International Journal of Mobile Communications, 2003 - researchgate.net",2003,https://www.researchgate.net/profile/Keng_Siau/publication/220474832_Mobile_Communications_and_Mobile_Services/links/5a94f14c0f7e9ba42970de1b/Mobile-Communications-and-Mobile-Services.pdf,https://www.researchgate.net/profile/Keng_Siau/publication/220474832_Mobile_Communications_and_Mobile_Services/links/5a94f14c0f7e9ba42970de1b/Mobile-Communications-and-Mobile-Services.pdf,,,1,319,No DOI available
Image base inquiry system for search engines for mobile telephones with integrated camera,"H Neven Sr - US Patent 8,421,872, 2013 - Google Patents",2013,https://patents.google.com/patent/US8421872B2/en,No PDF available,,,1,398,No DOI available
Traffic model and performance analysis for cellular mobile radio telephone systems with prioritized and nonprioritized handoff procedures,"D Hong, SS Rappaport - … transactions on Vehicular Technology, 1986 - ieeexplore.ieee.org",1986,https://ieeexplore.ieee.org/abstract/document/1623389/,https://ir.stonybrook.edu/xmlui/bitstream/handle/11401/65174/CEAS--773.pdf?sequence=1,,,1,2238,No DOI available
Base-station tracking in mobile communications using a switched parasitic antenna array,"SL Preston, DV Thiel, TA Smith… - IEEE Transactions on …, 1998 - ieeexplore.ieee.org",1998,https://ieeexplore.ieee.org/abstract/document/686771/,https://research-repository.griffith.edu.au/bitstream/handle/10072/12306/9239.pdf?sequence=1&isAllowed=y,,,1,163,No DOI available
"Operating system having external media layer, workflow layer, internal media layer, and knowledge base for routing media events between transactions","CCM Beck, JM Berke, JA Johnstone… - US Patent …, 2002 - Google Patents",2002,https://patents.google.com/patent/US6345305B1/en,No PDF available,,,1,240,No DOI available
Predicting consumer intention to use mobile service,"YS Wang, HH Lin, P Luarn - Information systems journal, 2006 - Wiley Online Library",2006,https://onlinelibrary.wiley.com/doi/abs/10.1111/j.1365-2575.2006.00213.x,No PDF available,,,1,654,No DOI available
"Mobile commerce: framework, applications and networking support","U Varshney, R Vetter - Mobile networks and Applications, 2002 - Springer",2002,https://link.springer.com/article/10.1023/A:1014570512129,https://pdfs.semanticscholar.org/3ca7/e7c66c3e7e239fecf60c5cd6daa4674df037.pdf,,,1,686,No DOI available
Mobile device base station,"S Forstall, GN Christie, RE Borchers, K Tiene - US Patent 8,463,238, 2013 - Google Patents",2013,https://patents.google.com/patent/US8463238B2/en,No PDF available,,,1,284,No DOI available
Point of sale for mobile transactions,"CF Baldwin, B Barnes, W Heinmiller, P Kenny… - US Patent …, 2015 - Google Patents",2015,https://patents.google.com/patent/US9129273B2/en,No PDF available,,,1,26,No DOI available
Studies of base-station antenna height effects on mobile radio,"WCY Lee - IEEE Transactions on Vehicular Technology, 1980 - ieeexplore.ieee.org",1980,https://ieeexplore.ieee.org/abstract/document/1622762/,No PDF available,,,1,42,No DOI available
Secure location verification with hidden and mobile base stations,"K Rasmussen, M Srivastava - IEEE Transactions on Mobile …, 2008 - ieeexplore.ieee.org",2008,https://ieeexplore.ieee.org/abstract/document/4384494/,http://www.cs.ox.ac.uk/files/6494/covert.pdf,,,1,135,No DOI available
System and method for facilitating electronic financial transactions using a mobile telecommunication device,"G Leung, R Lee, K Cheng, P Chui, A Mitchell… - US Patent …, 2008 - Google Patents",2008,https://patents.google.com/patent/US7379920B2/en,No PDF available,,,1,164,No DOI available
Device Method & System For Facilitating Mobile Transactions,"N Rubinstein - US Patent App. 11/759,957, 2008 - Google Patents",2008,https://patents.google.com/patent/US20080305769A1/en,No PDF available,,,1,22,No DOI available
Single tap transactions using an NFC enabled mobile device,"M Fisher - US Patent 8,332,272, 2012 - Google Patents",2012,https://patents.google.com/patent/US8332272B2/en,No PDF available,,,1,218,No DOI available
Method and system for securing transactions made through a mobile communication device,"M Fisher, R Guha - US Patent 8,290,433, 2012 - Google Patents",2012,https://patents.google.com/patent/US8290433B2/en,No PDF available,,,1,136,No DOI available
Payment for network-based commercial transactions using a mobile phone,"D Husemann, R Hermann, M Moser… - US Patent App. 09 …, 2001 - Google Patents",2001,https://patents.google.com/patent/US20010037264A1/en,No PDF available,,,1,190,No DOI available
The dangers of replication and a solution,"J Gray, P Helland, P O'Neil, D Shasha - ACM SIGMOD Record, 1996 - dl.acm.org",1996,https://dl.acm.org/citation.cfm?id=233330,http://db.cs.berkeley.edu/cs286/papers/dangers-sigmod1996.pdf,,,1,1649,No DOI available
"A survey of mobile cloud computing: architecture, applications, and approaches","HT Dinh, C Lee, D Niyato… - … and mobile computing, 2013 - Wiley Online Library",2013,https://onlinelibrary.wiley.com/doi/abs/10.1002/wcm.1203,https://onlinelibrary.wiley.com/doi/full/10.1002/wcm.1203,,,1,1825,No DOI available
Submission of transactions from mobile workstations in a cooperative multidatabase processing environment,"LH Yeo, A Zaslavsky - … Systems, 1994., Proceedings of the 14th …, 1994 - ieeexplore.ieee.org",1994,https://ieeexplore.ieee.org/abstract/document/302439/,http://lyle.smu.edu/~mhd/8391f01/mehta2.pdf,,,1,102,No DOI available
Improving data consistency in mobile computing using isolation-only transactions,"Q Lu, M Satyanarayanan - Hot Topics in Operating Systems …, 1995 - ieeexplore.ieee.org",1995,https://ieeexplore.ieee.org/abstract/document/513467/,http://www.dtic.mil/get-tr-doc/pdf?AD=ADA293110,,,1,91,No DOI available
Isolation-only transactions for mobile computing,"Q Lu, M Satyanaranyanan - ACM SIGOPS Operating Systems Review, 1994 - dl.acm.org",1994,https://dl.acm.org/citation.cfm?id=198164,http://www-2.cs.cmu.edu/afs/cs/project/coda-www/ResearchWebPages/docdir/osriot94.pdf,,,1,102,No DOI available
Mobile telephone system and method for carrying out financial transactions using a mobile telephone system,"HT Vatanen - US Patent 6,169,890, 2001 - Google Patents",2001,https://patents.google.com/patent/US6169890B1/en,No PDF available,,,1,128,No DOI available
Mobile computing and databases-a survey,"D Barbará - IEEE transactions on Knowledge and Data …, 1999 - ieeexplore.ieee.org",1999,https://ieeexplore.ieee.org/abstract/document/755619/,http://lsirwww.epfl.ch/courses/dis/2002ws/papers/barbara99mobile.pdf,,,1,603,No DOI available
Base station placement for in-building mobile communication systems to yield high capacity and efficiency,"KS Butterworth, KW Sowerby… - IEEE Transactions on …, 2000 - ieeexplore.ieee.org",2000,https://ieeexplore.ieee.org/abstract/document/843133/,No PDF available,,,1,88,No DOI available
Distributed power control in cellular radio systems,"SA Grandhi, R Vijayan… - IEEE Transactions on …, 1994 - ieeexplore.ieee.org",1994,https://ieeexplore.ieee.org/abstract/document/577019/,No PDF available,,,1,379,No DOI available
Location estimation and trajectory prediction for cellular networks with mobile base stations,"PN Pathirana, AV Savkin, S Jha - IEEE Transactions on Vehicular …, 2004 - researchgate.net",2004,https://www.researchgate.net/profile/Pubudu_Pathirana/publication/3155303_Location_Estimation_and_Trajectory_Prediction_for_Cellular_Networks_With_Mobile_Base_Stations/links/0deec51beeb720d390000000.pdf,https://www.researchgate.net/profile/Pubudu_Pathirana/publication/3155303_Location_Estimation_and_Trajectory_Prediction_for_Cellular_Networks_With_Mobile_Base_Stations/links/0deec51beeb720d390000000.pdf,,,1,79,No DOI available
Understanding dynamics between initial trust and usage intentions of mobile banking,"G Kim, BS Shin, HG Lee - Information Systems Journal, 2009 - Wiley Online Library",2009,https://onlinelibrary.wiley.com/doi/abs/10.1111/j.1365-2575.2007.00269.x,http://www.academia.edu/download/51114879/j.1365-2575.2007.00269.x20161229-29269-12pcac2.pdf,,,1,575,No DOI available
The performance of polarization diversity schemes at a base station in small/micro cells at 1800 MHz,"JJA Lempiainen… - IEEE Transactions on …, 1998 - ieeexplore.ieee.org",1998,https://ieeexplore.ieee.org/abstract/document/704863/,https://www.researchgate.net/profile/Jaana_Laiho/publication/3154144_'The_Performance_of_Polarization_Diversity_Schemes_at_a_Base-Station_in_SmallMicro_Cells_at_1800MHz'/links/5512adb90cf270fd7e33284d.pdf,,,1,108,No DOI available
Tcot-a timeout-based mobile transaction commitment protocol,"V Kumar, N Prabhu, MH Dunham… - IEEE Transactions on …, 2002 - ieeexplore.ieee.org",2002,https://ieeexplore.ieee.org/abstract/document/1039846/,https://pdfs.semanticscholar.org/ea61/e731c1fe8598cc6a238ad25f7d9cc4bc8464.pdf,,,1,128,No DOI available
Mobile-phone-based wagering game account transactions,"VK Agarwal, DR Buchholz, MC Pace - US Patent 8,430,745, 2013 - Google Patents",2013,https://patents.google.com/patent/US8430745B2/en,https://patentimages.storage.googleapis.com/b3/e9/cc/6e329f435d5564/US8430745.pdf,,,1,49,No DOI available
Advantages of CDMA and spread spectrum techniques over FDMA and TDMA in cellular mobile radio applications,"P Jung, PW Baier, A Steil - IEEE Transactions on Vehicular …, 1993 - ieeexplore.ieee.org",1993,https://ieeexplore.ieee.org/abstract/document/231889/,http://cs-www.cs.yale.edu/homes/yry/readings/wireless/wireless_readings/article7.pdf,,,1,303,No DOI available
"Past, present and future of mobile payments research: A literature review","T Dahlberg, N Mallat, J Ondrus, A Zmijewska - … commerce research and …, 2008 - Elsevier",2008,https://www.sciencedirect.com/science/article/pii/S1567422307000075,http://citeseerx.ist.psu.edu/viewdoc/download?doi=10.1.1.177.750&rep=rep1&type=pdf,,,1,689,No DOI available
Method and system for adapting a wireless mobile communication device for wireless transactions,"M Fisher - US Patent App. 11/933,321, 2008 - Google Patents",2008,https://patents.google.com/patent/US20080051059A1/en,No PDF available,,,1,144,No DOI available
Systems and methods to secure transactions via mobile devices,"R Hirson, M Niejadlik - US Patent 8,412,626, 2013 - Google Patents",2013,https://patents.google.com/patent/US8412626B2/en,No PDF available,,,1,141,No DOI available
Dependence of the occupational exposure to mobile phone base stations on the properties of the antenna and the human body,"MC Gosselin, A Christ, S Kühn… - IEEE Transactions on …, 2009 - ieeexplore.ieee.org",2009,https://ieeexplore.ieee.org/abstract/document/4806037/,No PDF available,,,1,37,No DOI available
Highly dynamic destination-sequenced distance-vector routing (DSDV) for mobile computers,"CE Perkins, P Bhagwat - ACM SIGCOMM computer communication …, 1994 - dl.acm.org",1994,https://dl.acm.org/citation.cfm?id=190336,https://courses.cs.washington.edu/courses/cse461/07wi/lectures/dsdv.pdf,,,1,10461,No DOI available
"Systems, methods and apparatus for facilitating transactions using a mobile device","B Dragt - US Patent 8,606,638, 2013 - Google Patents",2013,https://patents.google.com/patent/US8606638B2/en,No PDF available,,,1,134,No DOI available
Electronic payment schemes in a mobile environment for short-range transactions,"S Sovio, JE Ekberg, N Asokan, P Lahtinen - US Patent 7,194,438, 2007 - Google Patents",2007,https://patents.google.com/patent/US7194438B2/en,No PDF available,,,1,130,No DOI available
Security token for mobile near field communication transactions,"CF Baldwin, B Barnes, PJ Kenny, SI Khoshaba… - US Patent …, 2014 - Google Patents",2014,https://patents.google.com/patent/US8818867B2/en,No PDF available,,,1,92,No DOI available
(How) can mobile agents do secure electronic transactions on untrusted hosts? A survey of the security issues and the current solutions,"J Claessens, B Preneel, J Vandewalle - ACM Transactions on Internet …, 2003 - dl.acm.org",2003,https://dl.acm.org/citation.cfm?id=643479,No PDF available,,,1,108,No DOI available
A simple active damping control for compliant base manipulators,"JY Lew, SM Moon - IEEE/ASME Transactions on Mechatronics, 2001 - ieeexplore.ieee.org",2001,https://ieeexplore.ieee.org/abstract/document/951368/,No PDF available,,,1,60,No DOI available
System and process for remote payments and transactions in real time by mobile telephone,"M Brandes, JM Vega, P Hernandez, I Simon… - US Patent App. 11 …, 2007 - Google Patents",2007,https://patents.google.com/patent/US20070027803A1/en,No PDF available,,,1,89,No DOI available
System and method for authenticating transactions through a mobile device,"D Poon, S Law, R Burnison - US Patent 8,655,782, 2014 - Google Patents",2014,https://patents.google.com/patent/US8655782B2/en,http://patentimages.storage.googleapis.com/pdfs/US8655782.pdf,,,1,71,No DOI available
Method To Make Payment Or Charge Safe Transactions Using Programmable Mobile Telephones,"FB Bayod, JB Bayod, FB Bayod - US Patent App. 11/658,950, 2008 - Google Patents",2008,https://patents.google.com/patent/US20080091614A1/en,No PDF available,,,1,65,No DOI available
Near field communication transactions with user profile updates in a mobile environment,"US Patent App. 12/333,024, 2009 - Google Patents",2009,https://patents.google.com/patent/US20090157512A1/en,No PDF available,,,1,99,No DOI available
Secure and Authenticated Transactions with Mobile Devices,"J Sun, D Zhou - US Patent App. 13/868,844, 2013 - Google Patents",2013,https://patents.google.com/patent/US20130278622A1/en,https://patentimages.storage.googleapis.com/21/ba/e4/fe968cdb54307e/US20130278622A1.pdf,,,1,43,No DOI available
An approach for mobile agent security and fault tolerance using distributed transactions,"H Vogler, T Kunkelmann… - Parallel and Distributed …, 1997 - ieeexplore.ieee.org",1997,https://ieeexplore.ieee.org/abstract/document/652560/,http://www.vs.inf.ethz.ch/publ/papers/MaluApproachMobSec.pdf,,,1,75,No DOI available
Motet: Mobile transactions using electronic tickets,"D Quercia, S Hailes - Security and Privacy for Emerging Areas …, 2005 - ieeexplore.ieee.org",2005,https://ieeexplore.ieee.org/abstract/document/1607593/,No PDF available,,,1,19,No DOI available
Mobile agent-based transactions in open environments,"FM de Assis Silva… - IEICE Transactions on …, 2000 - search.ieice.org",2000,https://search.ieice.org/bin/summary.php?id=e83-b_5_973,http://www.lasid.ufba.br/publicacoes/teste/artigos/ieice2000.pdf,,,1,30,No DOI available
On the estimation of SAR and compliance distance related to RF exposure from mobile communication base station antennas,"BÖ Thors, ML Strydom, BÖ Hansson… - IEEE Transactions …, 2008 - ieeexplore.ieee.org",2008,https://ieeexplore.ieee.org/abstract/document/4667651/,No PDF available,,,1,30,No DOI available
Mobile-phone adapter for electronic transactions,"B Hejl - US Patent 9,794,392, 2017 - Google Patents",2017,https://patents.google.com/patent/US9794392B2/en,No PDF available,,,1,109,No DOI available
System and method for mobile payment transactions,"S Goldthwaite, W Graylin - US Patent App. 13/305,625, 2012 - Google Patents",2012,https://patents.google.com/patent/US20120072350A1/en,No PDF available,,,1,95,No DOI available
Mobile communication device near field communication (NFC) transactions,"M Fisher, R Guha - US Patent 9,378,493, 2016 - Google Patents",2016,https://patents.google.com/patent/US9378493B2/en,No PDF available,,,1,63,No DOI available
Power control for a spread spectrum cellular mobile radio system,"RW Nettleton, H Alavi - Vehicular Technology Conference …, 1983 - ieeexplore.ieee.org",1983,https://ieeexplore.ieee.org/abstract/document/1623141/,No PDF available,,,1,268,No DOI available
Mining cluster-based temporal mobile sequential patterns in location-based service environments,"EHC Lu, VS Tseng, SY Philip - … transactions on knowledge and …, 2011 - ieeexplore.ieee.org",2011,https://ieeexplore.ieee.org/abstract/document/5560659/,http://citeseerx.ist.psu.edu/viewdoc/download?doi=10.1.1.717.2363&rep=rep1&type=pdf,,,1,94,No DOI available
Distributed wireless channel allocation in networks with mobile base stations,"S Nesargi, R Prakash - … transactions on vehicular technology, 2002 - ieeexplore.ieee.org",2002,https://ieeexplore.ieee.org/abstract/document/1175196/,https://www.computer.org/csdl/proceedings/infcom/1999/5417/02/00751394.pdf,,,1,59,No DOI available
Explaining the adoption of transactional B2C mobile commerce,"M Khalifa, K Ning Shen - Journal of enterprise information …, 2008 - emeraldinsight.com",2008,https://www.emeraldinsight.com/doi/pdf/10.1108/17410390810851372,No PDF available,,,1,274,No DOI available
Base and mobile station antennas for land mobile radio systems,"Y Yamada, Y EBINE… - IEICE TRANSACTIONS on …, 1991 - search.ieice.org",1991,https://search.ieice.org/bin/summary.php?id=e74-b_6_1547,No PDF available,,,1,51,No DOI available
A power-spectral theory of propagation in the mobile-radio environment,"MJ Gans - IEEE Transactions on Vehicular Technology, 1972 - ieeexplore.ieee.org",1972,https://ieeexplore.ieee.org/abstract/document/1622098/,No PDF available,,,1,470,No DOI available
