title,author,date,link,pdf_link,query,search_engine,nr_found,cite_count,doi
An Inertial Sensor for Mechanical Compensation of the Vehicle Vertical Movement Impact on In-Vehicle Embedded Camera Orientation,"M Zayed, J Boonaert - Intelligent Transportation Systems …, 2007 - ieeexplore.ieee.org",2007,https://ieeexplore.ieee.org/abstract/document/4357675/,No PDF available,,,1,2,No DOI available
From compensation to integration: Effects of the pro-tactile movement on the sublexical structure of Tactile American Sign Language,"T Edwards - Journal of Pragmatics, 2014 - Elsevier",2014,https://www.sciencedirect.com/science/article/pii/S0378216614000885,http://www.academia.edu/download/34359325/Edwards_2014.pdf,,,1,15,No DOI available
Visual compensation in localization of a robot on a ceiling map,"T Matsumoto, T Takahashi, M Iwahashi… - Scientific Research …, 2011 - eprints.um.edu.my",2011,http://eprints.um.edu.my/6147/,http://eprints.um.edu.my/6147/1/Visual_compensation_in_localization_of_a_robot_on_a_ceiling_map.pdf,,,1,8,No DOI available
Motion detection and tracking for an AIBO robot using camera motion compensation and Kalman filtering,"J Ruiz-del-Solar, PA Vallejos - Robot Soccer World Cup, 2004 - Springer",2004,https://link.springer.com/chapter/10.1007/978-3-540-32256-6_59,http://citeseerx.ist.psu.edu/viewdoc/download?doi=10.1.1.452.600&rep=rep1&type=pdf,,,1,38,No DOI available
Iterative estimation and compensation of signal direction for moving sound source by mobile microphone array,"T Horiuchi, M Mizumachi… - IEICE TRANSACTIONS on …, 2004 - search.ieice.org",2004,https://search.ieice.org/bin/summary.php?id=e87-a_11_2950,No PDF available,,,1,4,No DOI available
Beyond the grand illusion: What change blindness really teaches us about vision,"A Noë, L Pessoa, E Thompson - Visual Cognition, 2000 - Taylor & Francis",2000,https://www.tandfonline.com/doi/abs/10.1080/135062800394702,http://lce.umd.edu/publications_files/Pessoa_VC_2000.pdf,,,1,243,No DOI available
Estimation of doppler shift compensation in a mobile communication system,"O Piirainen - US Patent 7,012,973, 2006 - Google Patents",2006,https://patents.google.com/patent/US7012973B1/en,No PDF available,,,1,6,No DOI available
Compensation of doppler shift in a mobile communication system,"O Piirainen - US Patent 6,614,860, 2003 - Google Patents",2003,https://patents.google.com/patent/US6614860B1/en,No PDF available,,,1,6,No DOI available
Feed forward compensation for fly height control in a disk drive,"JM Chue, TD Hugunin - US Patent 7,839,595, 2010 - Google Patents",2010,https://patents.google.com/patent/US7839595B1/en,No PDF available,,,1,129,No DOI available
Compensation method of natural head movement for gaze tracking system using an ultrasonic sensor for distance measurement,"D Jung, JM Lee, SY Gwon, W Pan, HC Lee, KR Park… - Sensors, 2016 - mdpi.com",2016,https://www.mdpi.com/1424-8220/16/1/110htm,https://www.mdpi.com/1424-8220/16/1/110htm,,,1,8,No DOI available
Mechanism design and system control for humanoid space robot movement using a simple gravity-compensation system,"Z Jiang, S Liu, H Li, Q Dong, X Chen… - … Journal of Advanced …, 2013 - journals.sagepub.com",2013,http://journals.sagepub.com/doi/abs/10.5772/56798,http://journals.sagepub.com/doi/pdf/10.5772/56798,,,1,6,No DOI available
Compensation of doppler shift in a mobile communication system,"J Pekkarinen - US Patent 6,553,007, 2003 - Google Patents",2003,https://patents.google.com/patent/US6553007B1/en,No PDF available,,,1,5,No DOI available
Research on an active heave compensation system for remotely operated vehicle,"W Yang, Z Zhang, A Zhang - … Computation Technology and …, 2008 - ieeexplore.ieee.org",2008,https://ieeexplore.ieee.org/abstract/document/4659793/,No PDF available,,,1,15,No DOI available
Fuzzy vector field orientation feedback control-based slip compensation for trajectory tracking control of a four track wheel skid-steered mobile robot,"XV Ha, C Ha, J Lee - International Journal of Advanced …, 2013 - journals.sagepub.com",2013,http://journals.sagepub.com/doi/abs/10.5772/56355,http://journals.sagepub.com/doi/pdf/10.5772/56355,,,1,7,No DOI available
Float arm V: hyper-redundant manipulator with wire-driven weight-compensation mechanism,"S Hirose, T Ishii, A Haishi - Robotics and Automation, 2003 …, 2003 - ieeexplore.ieee.org",2003,https://ieeexplore.ieee.org/abstract/document/1241623/,No PDF available,,,1,36,No DOI available
