title;author;date;link;pdf_link;query;search_engine;nr_found;cite_count;doi;take
Power management method and apparatus of wireless local area network module in computer system;HS Kim - US Patent 7,321,787, 2008 - Google Patents;2008;https://patents.google.com/patent/US7321787B2/en;No PDF available;wireless+data+networks+AND+disconnection+AND+(management+OR+handling)_GoogleScholar.csv;GoogleScholar;1;77;No DOI available;
Resource management in energy-limited, bandwidth-limited, transceiver-limited wireless networks for session-based multicasting;JE Wieselthier, GD Nguyen, A Ephremides - Computer Networks, 2002 - Elsevier;2002;https://www.sciencedirect.com/science/article/pii/S1389128601003036;http://www.dtic.mil/get-tr-doc/pdf?AD=ADA464765;wireless+data+networks+AND+disconnection+AND+(management+OR+handling)_GoogleScholar.csv;GoogleScholar;1;94;No DOI available;
Method and system for generic real time management of devices on computers connected to a network;E Werner, E Zucker, B Matzkel - US Patent 8,484,327, 2013 - Google Patents;2013;https://patents.google.com/patent/US8484327B2/en;No PDF available;wireless+data+networks+AND+disconnection+AND+(management+OR+handling)_GoogleScholar.csv;GoogleScholar;1;133;No DOI available;
Reliable broadcast in mobile wireless networks;S Alagar, S Venkatesan… - … , 1995. MILCOM'95 …, 1995 - ieeexplore.ieee.org;1995;https://ieeexplore.ieee.org/abstract/document/483305/;https://utd.edu/~venky/pubs/rel-bcast-milcom95.pdf;wireless+data+networks+AND+disconnection+AND+(management+OR+handling)_GoogleScholar.csv;GoogleScholar;1;84;No DOI available;
A survey of applications of wireless sensors and wireless sensor networks;T Arampatzis, J Lygeros… - Intelligent Control, 2005 …, 2005 - ieeexplore.ieee.org;2005;https://ieeexplore.ieee.org/abstract/document/1467103/;https://www.researchgate.net/profile/Stamatis_Manesis/publication/4156082_A_Survey_of_Applications_of_Wireless_Sensors_and_Wireless_Sensor_Networks/links/0a85e52d92d8100b85000000.pdf;wireless+data+networks+AND+disconnection+AND+(management+OR+handling)_GoogleScholar.csv;GoogleScholar;1;881;No DOI available;
System and method for re-establishing a disconnected telephone communication;PJ MeLampy, AD Ory - US Patent 5,566,236, 1996 - Google Patents;1996;https://patents.google.com/patent/US5566236A/en;No PDF available;wireless+data+networks+AND+disconnection+AND+(management+OR+handling)_GoogleScholar.csv;GoogleScholar;1;140;No DOI available;
Trickle: A self-regulating algorithm for code propagation and maintenance in wireless sensor networks;P Levis, N Patel, D Culler, S Shenker - Proc. of the 1st USENIX/ACM …, 2004 - usenix.org;2004;https://www.usenix.org/legacy/events/nsdi04/tech/levisTrickle/levisTrickle_html/;https://www.usenix.org/legacy/events/nsdi04/tech/levisTrickle/levisTrickle_html/;wireless+data+networks+AND+disconnection+AND+(management+OR+handling)_GoogleScholar.csv;GoogleScholar;1;1272;No DOI available;
Wireless sensor and actor☆ networks: research challenges;IF Akyildiz, IH Kasimoglu - Ad hoc networks, 2004 - Elsevier;2004;https://www.sciencedirect.com/science/article/pii/S1570870504000319;http://nslab.kaist.ac.kr/courses/2008/cs710/paperlist/%5B2%5D%20Wireless%20Sensor%20and%20Actor%20Network/Wireless%20sensor%20and%20actor%20networks%20-%20research%20challenges.pdf;wireless+data+networks+AND+disconnection+AND+(management+OR+handling)_GoogleScholar.csv;GoogleScholar;1;1919;No DOI available;
STEM: Topology management for energy efficient sensor networks;C Schurgers, V Tsiatsis… - … Proceedings, 2002. IEEE, 2002 - ieeexplore.ieee.org;2002;https://ieeexplore.ieee.org/abstract/document/1035239/;https://www.researchgate.net/profile/Mark_Jones35/publication/220457205_Tasking_Distributed_Sensor_Networks/links/573c817a08ae9f741b2eb353/Tasking-Distributed-Sensor-Networks.pdf#page=152;wireless+data+networks+AND+disconnection+AND+(management+OR+handling)_GoogleScholar.csv;GoogleScholar;1;375;No DOI available;
Methods and apparatus for scalable distributed management of wireless virtual private networks;B Dutertre - US Patent 7,246,232, 2007 - Google Patents;2007;https://patents.google.com/patent/US7246232B2/en;No PDF available;wireless+data+networks+AND+disconnection+AND+(management+OR+handling)_GoogleScholar.csv;GoogleScholar;1;84;No DOI available;
On data management in pervasive computing environments;F Perich, A Joshi, T Finin… - … on Knowledge and Data …, 2004 - ieeexplore.ieee.org;2004;https://ieeexplore.ieee.org/abstract/document/1277823/;https://ebiquity.umbc.edu/get/a/publication/3.pdf;wireless+data+networks+AND+disconnection+AND+(management+OR+handling)_GoogleScholar.csv;GoogleScholar;2;143;No DOI available;
Issues in wireless mobile computing;D Duchamp - … Systems, 1992. Proceedings., Third Workshop on, 1992 - ieeexplore.ieee.org;1992;https://ieeexplore.ieee.org/abstract/document/275698/;https://www.computer.org/csdl/proceedings/wwos/1992/2555/00/00275698.pdf;wireless+data+networks+AND+disconnection+AND+(management+OR+handling)_GoogleScholar.csv;GoogleScholar;1;119;No DOI available;
Session resumption in wireless packet data network;R Govindarajan, S McCutchen… - US Patent App. 09 …, 2002 - Google Patents;2002;https://patents.google.com/patent/US20020143971A1/en;No PDF available;wireless+data+networks+AND+disconnection+AND+(management+OR+handling)_GoogleScholar.csv;GoogleScholar;1;41;No DOI available;
Noise reduction techniques and apparatus for enhancing wireless data network telephony;D Kikinis - US Patent 6,078,566, 2000 - Google Patents;2000;https://patents.google.com/patent/US6078566A/en;No PDF available;wireless+data+networks+AND+disconnection+AND+(management+OR+handling)_GoogleScholar.csv;GoogleScholar;1;126;No DOI available;
Resource management for service providers in heterogeneous wireless networks;X Yang, J Bigham, L Cuthbert - … and Networking Conference …, 2005 - ieeexplore.ieee.org;2005;https://ieeexplore.ieee.org/abstract/document/1424705/;https://www.researchgate.net/profile/Xu_Yang37/publication/4140408_Resource_management_for_service_providers_in_heterogeneous_wireless_networks/links/5b18dadaa6fdcca67b62b350/Resource-management-for-service-providers-in-heterogeneous-wireless-networks.pdf;wireless+data+networks+AND+disconnection+AND+(management+OR+handling)_GoogleScholar.csv;GoogleScholar;1;48;No DOI available;
Wireless diabetes management devices and methods for using the same;P Moerman, D Scott, J McAleer - US Patent App. 10/399,939, 2004 - Google Patents;2004;https://patents.google.com/patent/US20040054263A1/en;No PDF available;wireless+data+networks+AND+disconnection+AND+(management+OR+handling)_GoogleScholar.csv;GoogleScholar;1;374;No DOI available;
Wireless data communications system for detecting a disabled condition and simulating a functioning mode in response to detection;Z Haas - US Patent 5,566,225, 1996 - Google Patents;1996;https://patents.google.com/patent/US5566225A/en;No PDF available;wireless+data+networks+AND+disconnection+AND+(management+OR+handling)_GoogleScholar.csv;GoogleScholar;1;126;No DOI available;
Multirate wireless data communication system;J Boer, WJ Diepstraten, A Kamerman… - US Patent …, 1998 - Google Patents;1998;https://patents.google.com/patent/US5706428A/en;No PDF available;wireless+data+networks+AND+disconnection+AND+(management+OR+handling)_GoogleScholar.csv;GoogleScholar;2;1049;No DOI available;
Sensor grid: Integration of wireless sensor networks and the grid;HB Lim, YM Teo, P Mukherjee, VT Lam… - … Computer Networks …, 2005 - ieeexplore.ieee.org;2005;https://ieeexplore.ieee.org/abstract/document/1550845/;http://www.academia.edu/download/35940463/SensorGrid_Vanina.pdf;wireless+data+networks+AND+disconnection+AND+(management+OR+handling)_GoogleScholar.csv;GoogleScholar;1;116;No DOI available;
System and method for wireless directory assistance;DA Hanson - US Patent 6,381,325, 2002 - Google Patents;2002;https://patents.google.com/patent/US6381325B1/en;No PDF available;wireless+data+networks+AND+disconnection+AND+(management+OR+handling)_GoogleScholar.csv;GoogleScholar;1;76;No DOI available;
Data mules: Modeling and analysis of a three-tier architecture for sparse sensor networks;RC Shah, S Roy, S Jain, W Brunette - Ad Hoc Networks, 2003 - Elsevier;2003;https://www.sciencedirect.com/science/article/pii/S1570870503000039;http://www2.ee.washington.edu/research/funlab/Publications/2003/2003_data_mules.pdf;wireless+data+networks+AND+disconnection+AND+(management+OR+handling)_GoogleScholar.csv;GoogleScholar;1;2320;No DOI available;
Switched circuit connection management over public data networks for wide area networks;AM Bentley, ME Fisher, BE Jongekryg… - US Patent …, 1996 - Google Patents;1996;https://patents.google.com/patent/US5537404A/en;No PDF available;wireless+data+networks+AND+disconnection+AND+(management+OR+handling)_GoogleScholar.csv;GoogleScholar;1;67;No DOI available;
Energy-efficient forwarding strategies for geographic routing in lossy wireless sensor networks;K Seada, M Zuniga, A Helmy… - Proceedings of the 2nd …, 2004 - dl.acm.org;2004;https://dl.acm.org/citation.cfm?id=1031509;http://www.academia.edu/download/45419322/Energy-efficient_forwarding_strategies_f20160506-27491-1amex3i.pdf;wireless+data+networks+AND+disconnection+AND+(management+OR+handling)_GoogleScholar.csv;GoogleScholar;1;525;No DOI available;
Mobile switching centre and method for handling a dropped connection between a mobile station and a basestation transceiver;H Lee, L Lewis - US Patent 6,246,872, 2001 - Google Patents;2001;https://patents.google.com/patent/US6246872B1/en;No PDF available;wireless+data+networks+AND+disconnection+AND+(management+OR+handling)_GoogleScholar.csv;GoogleScholar;1;59;No DOI available;y
A three-tier architecture for ubiquitous data access;S Helal, J Hammer, J Zhang… - Computer Systems and …, 2001 - ieeexplore.ieee.org;2001;https://ieeexplore.ieee.org/abstract/document/933971/;https://pdfs.semanticscholar.org/c62d/b86c522d88131bfac081c155abcfcf463866.pdf;wireless+data+networks+AND+disconnection+AND+(management+OR+handling)_GoogleScholar.csv;GoogleScholar;1;76;No DOI available;
MQTT-S—A publish/subscribe protocol for Wireless Sensor Networks;U Hunkeler, HL Truong… - … systems software and …, 2008 - ieeexplore.ieee.org;2008;https://ieeexplore.ieee.org/abstract/document/4554519/;No PDF available;wireless+data+networks+AND+disconnection+AND+(management+OR+handling)_GoogleScholar.csv;GoogleScholar;1;474;No DOI available;y
System and method to enable subscriber self-activation of wireless data terminals;B Nath, R Kushwaha - US Patent 8,559,947, 2013 - Google Patents;2013;https://patents.google.com/patent/US8559947B2/en;No PDF available;wireless+data+networks+AND+disconnection+AND+(management+OR+handling)_GoogleScholar.csv;GoogleScholar;1;172;No DOI available;
System for management of cacheable streaming content in a packet based communication network with mobile hosts;MMB Tariq, A Takeshita - US Patent 6,907,501, 2005 - Google Patents;2005;https://patents.google.com/patent/US6907501B2/en;No PDF available;wireless+data+networks+AND+disconnection+AND+(management+OR+handling)_GoogleScholar.csv;GoogleScholar;1;346;No DOI available;
Mobile computing in next generation wireless networks;P Agrawal, D Famolari - Proceedings of the 3rd international workshop …, 1999 - dl.acm.org;1999;https://dl.acm.org/citation.cfm?id=313277;http://195.113.26.193/~michael/Diplomka/clankyuni/p32-agrawal.pdf;wireless+data+networks+AND+disconnection+AND+(management+OR+handling)_GoogleScholar.csv;GoogleScholar;1;45;No DOI available;
Wireless communications: principles and practice;TS Rappaport - 1996 - academia.edu;1996;http://www.academia.edu/download/31129823/trunked_capacity.pdf;http://www.academia.edu/download/31129823/trunked_capacity.pdf;Mobile+transaction+models_GoogleScholar.csv;GoogleScholar;1;26963;No DOI available;
Traffic model and performance analysis for cellular mobile radio telephone systems with prioritized and nonprioritized handoff procedures;D Hong, SS Rappaport - … transactions on Vehicular Technology, 1986 - ieeexplore.ieee.org;1986;https://ieeexplore.ieee.org/abstract/document/1623389/;https://ir.stonybrook.edu/xmlui/bitstream/handle/11401/65174/CEAS--773.pdf?sequence=1;Mobile+transaction+models_GoogleScholar.csv;GoogleScholar;2;2238;No DOI available;
A model of consumer acceptance of mobile payment;L Chen - International Journal of Mobile Communications, 2008 - inderscienceonline.com;2008;https://www.inderscienceonline.com/doi/abs/10.1504/IJMC.2008.015997;No PDF available;Mobile+transaction+models_GoogleScholar.csv;GoogleScholar;1;396;No DOI available;
Understanding factors affecting trust in and satisfaction with mobile banking in Korea: A modified DeLone and McLean's model perspective;KC Lee, N Chung - Interacting with computers, 2009 - academic.oup.com;2009;https://academic.oup.com/iwc/article-abstract/21/5-6/385/754008;No PDF available;Mobile+transaction+models_GoogleScholar.csv;GoogleScholar;1;469;No DOI available;
Synthesis of extended transaction models using ACTA;PK Chrysanthis, K Ramamritham - … Transactions on Database Systems …, 1994 - dl.acm.org;1994;https://dl.acm.org/citation.cfm?id=185843;https://www.ht.sfc.keio.ac.jp/~ume/Paper/2PhaseRecoveryTransaction/ACM/SynthesisOfExtendedTransactionModelsUsingACTA.pdf;Mobile+transaction+models_GoogleScholar.csv;GoogleScholar;1;344;No DOI available;
The dangers of replication and a solution;J Gray, P Helland, P O'Neil, D Shasha - ACM SIGMOD Record, 1996 - dl.acm.org;1996;https://dl.acm.org/citation.cfm?id=233330;http://db.cs.berkeley.edu/cs286/papers/dangers-sigmod1996.pdf;Mobile+transaction+models_GoogleScholar.csv;GoogleScholar;2;1649;No DOI available;
Past, present and future of mobile payments research: A literature review;T Dahlberg, N Mallat, J Ondrus, A Zmijewska - … commerce research and …, 2008 - Elsevier;2008;https://www.sciencedirect.com/science/article/pii/S1567422307000075;http://citeseerx.ist.psu.edu/viewdoc/download?doi=10.1.1.177.750&rep=rep1&type=pdf;Mobile+transaction+models_GoogleScholar.csv;GoogleScholar;3;689;No DOI available;
Adoption of mobile technology in business: a fit-viability model;TP Liang, CW Huang, YH Yeh… - Industrial management & …, 2007 - emeraldinsight.com;2007;https://www.emeraldinsight.com/doi/abs/10.1108/02635570710822796;http://www.academia.edu/download/43424316/Use_of_tech_in_business__adoption_of_Mobile_technology.pdf;Mobile+transaction+models_GoogleScholar.csv;GoogleScholar;1;238;No DOI available;
Advanced transaction models and architectures;S Jajodia, L Kerschberg - 2012 - books.google.com;2012;https://books.google.de/books?hl=de&lr=&id=IV_mBwAAQBAJ&oi=fnd&pg=PR13&dq=Mobile+transaction+models&ots=qQYJMlnJ0U&sig=mHnkUUOVprzNjNI7QjRbtUw3KOk;No PDF available;Mobile+transaction+models_GoogleScholar.csv;GoogleScholar;1;194;No DOI available;
Predicting consumer intention to use mobile service;YS Wang, HH Lin, P Luarn - Information systems journal, 2006 - Wiley Online Library;2006;https://onlinelibrary.wiley.com/doi/abs/10.1111/j.1365-2575.2006.00213.x;No PDF available;Mobile+transaction+models_GoogleScholar.csv;GoogleScholar;2;654;No DOI available;
A statistical model for a land mobile satellite link;C Loo - IEEE transactions on vehicular technology, 1985 - ieeexplore.ieee.org;1985;https://ieeexplore.ieee.org/abstract/document/1623307/;https://www.csie.ntu.edu.tw/~b92b02053/printing/summer/Materials/channel%20model/CHN_A%20statistical%20model%20for%20a%20land%20mobile%20satellite%20link.pdf;Mobile+transaction+models_GoogleScholar.csv;GoogleScholar;1;785;No DOI available;
The land mobile satellite communication channel-recording, statistics, and channel model;E Lutz, D Cygan, M Dippold… - IEEE transactions on …, 1991 - ieeexplore.ieee.org;1991;https://ieeexplore.ieee.org/abstract/document/289418/;No PDF available;Mobile+transaction+models_GoogleScholar.csv;GoogleScholar;2;883;No DOI available;
An empirical investigation of mobile banking adoption: The effect of innovation attributes and knowledge-based trust;HF Lin - International journal of information management, 2011 - Elsevier;2011;https://www.sciencedirect.com/science/article/pii/S026840121000099X;No PDF available;Mobile+transaction+models_GoogleScholar.csv;GoogleScholar;1;501;No DOI available;
Understanding m-commerce: a consumer-centric model;C Coursaris, K Hassanein - Quarterly journal of electronic …, 2002 - researchgate.net;2002;https://www.researchgate.net/profile/Constantinos_Coursaris/publication/228936046_Understanding_m-commerce_A_consumer-centric_model/links/0912f5064668f9dd29000000/Understanding-m-commerce-A-consumer-centric-model.pdf;https://www.researchgate.net/profile/Constantinos_Coursaris/publication/228936046_Understanding_m-commerce_A_consumer-centric_model/links/0912f5064668f9dd29000000/Understanding-m-commerce-A-consumer-centric-model.pdf;Mobile+transaction+models_GoogleScholar.csv;GoogleScholar;1;257;No DOI available;
Factors affecting individuals to adopt mobile banking: Empirical evidence from the UTAUT model;CS Yu - Journal of Electronic Commerce Research, 2012 - pdfs.semanticscholar.org;2012;https://pdfs.semanticscholar.org/2a3e/4a3024bfc4df27db07a1d48f77a6f371b0c3.pdf;https://pdfs.semanticscholar.org/2a3e/4a3024bfc4df27db07a1d48f77a6f371b0c3.pdf;Mobile+transaction+models_GoogleScholar.csv;GoogleScholar;1;478;No DOI available;
A survey of various propagation models for mobile communication;TK Sarkar, Z Ji, K Kim, A Medouri… - IEEE Antennas and …, 2003 - ieeexplore.ieee.org;2003;https://ieeexplore.ieee.org/abstract/document/1232163/;http://conan.diei.unipg.it/webtlc/dispense/survey_propagation.pdf;Mobile+transaction+models_GoogleScholar.csv;GoogleScholar;1;881;No DOI available;
From E-government to M-government: Facing the Inevitable;I Kushchu, H Kuscu - the 3rd European Conference on e-Government, 2003 - Citeseer;2003;http://citeseerx.ist.psu.edu/viewdoc/download?doi=10.1.1.113.2448&rep=rep1&type=pdf;http://citeseerx.ist.psu.edu/viewdoc/download?doi=10.1.1.113.2448&rep=rep1&type=pdf;Mobile+transaction+models_GoogleScholar.csv;GoogleScholar;1;365;No DOI available;
Mobile banking services;N Mallat, M Rossi, VK Tuunainen - Communications of the ACM, 2004 - dl.acm.org;2004;https://dl.acm.org/citation.cfm?id=986236;https://www.researchgate.net/profile/Virpi_Tuunainen/publication/220425077_Mobile_Banking_Services/links/0c96053aa77d1c445c000000/Mobile-Banking-Services.pdf;Mobile+transaction+models_GoogleScholar.csv;GoogleScholar;2;378;No DOI available;
… of service quality and justice on customer satisfaction and the continuance intention of mobile value-added services: An empirical test of a multidimensional model;L Zhao, Y Lu, L Zhang, PYK Chau - Decision support systems, 2012 - Elsevier;2012;https://www.sciencedirect.com/science/article/pii/S0167923611002028;http://or.nsfc.gov.cn/bitstream/00001903-5/112444/1/1000003789023.pdf;Mobile+transaction+models_GoogleScholar.csv;GoogleScholar;1;252;No DOI available;
Consumer-based m-commerce: exploring consumer perception of mobile applications;P Mahatanankoon, HJ Wen, B Lim - Computer standards & interfaces, 2005 - Elsevier;2005;https://www.sciencedirect.com/science/article/pii/S0920548904001254;No PDF available;Mobile+transaction+models_GoogleScholar.csv;GoogleScholar;1;243;No DOI available;
A multidimensional and hierarchical model of mobile service quality;Y Lu, L Zhang, B Wang - Electronic Commerce Research and Applications, 2009 - Elsevier;2009;https://www.sciencedirect.com/science/article/pii/S1567422309000192;No PDF available;Mobile+transaction+models_GoogleScholar.csv;GoogleScholar;1;167;No DOI available;
Risk sharing and transactions costs: Evidence from Kenya's mobile money revolution;W Jack, T Suri - American Economic Review, 2014 - aeaweb.org;2014;https://www.aeaweb.org/articles?id=10.1257/aer.104.1.183;https://dspace.mit.edu/openaccess-disseminate/1721.1/88137;Mobile+transaction+models_GoogleScholar.csv;GoogleScholar;1;350;No DOI available;
Structural properties and classification of kinematic and dynamic models of wheeled mobile robots;G Campion, G Bastin… - IEEE transactions on …, 1996 - ieeexplore.ieee.org;1996;https://ieeexplore.ieee.org/abstract/document/481750/;http://perso.uclouvain.be/georges.bastin/paper37.pdf;Mobile+transaction+models_GoogleScholar.csv;GoogleScholar;1;1447;No DOI available;
Defining location data dependency, transaction mobility and commitment;V Kumar, MH Dunham - 1998 - Citeseer;1998;http://citeseerx.ist.psu.edu/viewdoc/summary?doi=10.1.1.7.8890;No PDF available;Mobile+transaction+models_GoogleScholar.csv;GoogleScholar;1;32;No DOI available;
Business Model Analysis Applied to Mobile Business.;G Camponovo, Y Pigneur - ICEIS (4), 2003 - academia.edu;2003;http://www.academia.edu/download/34318036/GC2003ICEIS.pdf;http://www.academia.edu/download/34318036/GC2003ICEIS.pdf;Mobile+transaction+models_GoogleScholar.csv;GoogleScholar;1;242;No DOI available;
P Pattnaik;PK Panda, S Swain, P Pattnaik - Int J Instrum. Control Autom.(IJICA), 2011;2011;/citations?user=O5ZbowUAAAAJ&hl=de&oi=sra;No PDF available;Mobile+transaction+models_GoogleScholar.csv;GoogleScholar;2;6;No DOI available;
A review for mobile commerce research and applications;EWT Ngai, A Gunasekaran - Decision support systems, 2007 - Elsevier;2007;https://www.sciencedirect.com/science/article/pii/S0167923605000692;http://www.academia.edu/download/46676464/A_review_for_mobile_commerce_research_an20160621-24679-1frte6o.pdf;Mobile+transaction+models_GoogleScholar.csv;GoogleScholar;2;638;No DOI available;
A physical mobile radio channel model;WR Braun, U Dersch - … transactions on Vehicular Technology, 1991 - ieeexplore.ieee.org;1991;https://ieeexplore.ieee.org/abstract/document/289429/;No PDF available;Mobile+transaction+models_GoogleScholar.csv;GoogleScholar;1;576;No DOI available;
Challenges and business models for mobile location-based services and advertising;S Dhar, U Varshney - Communications of the ACM, 2011 - dl.acm.org;2011;https://dl.acm.org/citation.cfm?id=1941515;https://m.cacm.acm.org/magazines/2011/5/107686-challenges-and-business-models-for-mobile-location-based-services-and-advertising/fulltext;Mobile+transaction+models_GoogleScholar.csv;GoogleScholar;1;344;No DOI available;
Control of a nonholomic mobile robot: Backstepping kinematics into dynamics;R Fierro, FL Lewis - Journal of Robotic Systems, 1997 - Wiley Online Library;1997;https://onlinelibrary.wiley.com/doi/abs/10.1002/(SICI)1097-4563(199703)14:3%3C149::AID-ROB1%3E3.0.CO2-R;https://pdfs.semanticscholar.org/bdd1/d20939d65f501ec95622cc4588fa7c309ff5.pdf;Mobile+transaction+models_GoogleScholar.csv;GoogleScholar;1;1030;No DOI available;
A transaction framework for mobile data sharing services;HN Le, M Nygård - Mobile Ubiquitous Computing, Systems …, 2008 - ieeexplore.ieee.org;2008;https://ieeexplore.ieee.org/abstract/document/4641321/;No PDF available;Mobile+transaction+models_GoogleScholar.csv;GoogleScholar;2;9;No DOI available;
Voice and data integration in the air-interface of a microcellular mobile communication system;NM Mitrou, GL Lyberopoulos… - IEEE Transactions on …, 1993 - ieeexplore.ieee.org;1993;https://ieeexplore.ieee.org/abstract/document/192381/;No PDF available;Mobile+transaction+models_GoogleScholar.csv;GoogleScholar;1;90;No DOI available;
A parametric model for the distribution of the angle of arrival and the associated correlation function and power spectrum at the mobile station;A Abdi, JA Barger, M Kaveh - IEEE Transactions on vehicular …, 2002 - ieeexplore.ieee.org;2002;https://ieeexplore.ieee.org/abstract/document/1002493/;http://citeseerx.ist.psu.edu/viewdoc/download?doi=10.1.1.380.4688&rep=rep1&type=pdf;Mobile+transaction+models_GoogleScholar.csv;GoogleScholar;1;467;No DOI available;
Stable flocking of mobile agents, Part I: Fixed topology;HG Tanner, A Jadbabaie… - Decision and Control …, 2003 - ieeexplore.ieee.org;2003;https://ieeexplore.ieee.org/abstract/document/1272910/;https://repository.upenn.edu/cgi/viewcontent.cgi?article=1109&context=ese_papers;Mobile+transaction+models_GoogleScholar.csv;GoogleScholar;2;904;No DOI available;
Mobile payments go viral: M-PESA in Kenya;I Mas, D Radcliffe - 2010 - elibrary.worldbank.org;2010;https://elibrary.worldbank.org/doi/pdf/10.1596/978-0-8213-8745-0#page=369;https://www.researchgate.net/profile/Daniel_Radcliffe/publication/227489474_Mobile_payments_go_viral_M-PESA_in_Kenya/links/54fd4c650cf20700c5eb02d8/Mobile-payments-go-viral-M-PESA-in-Kenya.pdf;Mobile+transaction+models_GoogleScholar.csv;GoogleScholar;1;283;No DOI available;
Dynamic modeling of household automobile transactions;A Mohammadian, EJ Miller - Transportation Research …, 2003 - journals.sagepub.com;2003;https://journals.sagepub.com/doi/abs/10.3141/1831-11;No PDF available;Mobile+transaction+models_GoogleScholar.csv;GoogleScholar;1;80;No DOI available;y
A statistical model of mobile-to-mobile land communication channel;AS Akki, F Haber - IEEE transactions on vehicular technology, 1986 - ieeexplore.ieee.org;1986;https://ieeexplore.ieee.org/abstract/document/1623375/;No PDF available;Mobile+transaction+models_GoogleScholar.csv;GoogleScholar;1;393;No DOI available;
