title;author;date;link;pdf_link;query;search_engine;nr_found;cite_count;doi;take
A power-aware technique to manage real-time database transactions in mobile ad-hoc networks;L Gruenwald, SM Banik - Database and Expert Systems …, 2001 - ieeexplore.ieee.org;2001;https://ieeexplore.ieee.org/abstract/document/953120/;http://db.cs.pitt.edu/idm/reports/2004/0312746.html;Disconnection+management+AND+(mobile+environments+OR+mobile+systems+OR+mobile+transactions)_GoogleScholar.csv;GoogleScholar;2;25;No DOI available;y
Apparatus and methods for providing coordinated and personalized application and data management for resource-limited mobile devices;L Peng - US Patent 6,816,944, 2004 - Google Patents;2004;https://patents.google.com/patent/US6816944B2/en;No PDF available;Disconnection+management+AND+(mobile+environments+OR+mobile+systems+OR+mobile+transactions)_GoogleScholar.csv;GoogleScholar;1;213;No DOI available;y
Digital rights management in a mobile environment;K Maharajh, T Walker, I Sandler, E Minka… - US Patent …, 2015 - Google Patents;2015;https://patents.google.com/patent/US9124650B2/en;No PDF available;Disconnection+management+AND+(mobile+environments+OR+mobile+systems+OR+mobile+transactions)_GoogleScholar.csv;GoogleScholar;2;492;No DOI available;
Mobile computing: Overview and current status;A Zaslavsky, Z Tari - Journal of Research and Practice in Information …, 1998 - diva-portal.org;1998;http://www.diva-portal.org/smash/record.jsf?pid=diva2:983587;https://www.diva-portal.org/smash/get/diva2:983587/FULLTEXT01.pdf;Disconnection+management+AND+(mobile+environments+OR+mobile+systems+OR+mobile+transactions)_GoogleScholar.csv;GoogleScholar;1;42;No DOI available;
Group management for mobile ad hoc networks: design, implementation and experiment;J Liu, D Sacchetti, F Sailhan, V Issarny - … on Mobile data management, 2005 - dl.acm.org;2005;https://dl.acm.org/citation.cfm?id=1071276;https://hal.inria.fr/inria-00414945/document;Disconnection+management+AND+(mobile+environments+OR+mobile+systems+OR+mobile+transactions)_GoogleScholar.csv;GoogleScholar;1;111;No DOI available;
Method for connecting a mobile computer to a computer network by using an address server;GW Seitz, SJ Findley, PW Beisel - US Patent 5,410,543, 1995 - Google Patents;1995;https://patents.google.com/patent/US5410543A/en;No PDF available;Disconnection+management+AND+(mobile+environments+OR+mobile+systems+OR+mobile+transactions)_GoogleScholar.csv;GoogleScholar;2;287;No DOI available;
Service composition for mobile environments;D Chakraborty, A Joshi, T Finin, Y Yesha - Mobile Networks and …, 2005 - dl.acm.org;2005;https://dl.acm.org/citation.cfm?id=1160168;https://ebiquity.umbc.edu/get/a/publication/96.pdf;Disconnection+management+AND+(mobile+environments+OR+mobile+systems+OR+mobile+transactions)_GoogleScholar.csv;GoogleScholar;1;184;No DOI available;
Mobile commerce applications and services: a design and development approach;AS Andreou, C Chrysostomou, C Leonidou… - … Conference on Mobile …, 2002 - Citeseer;2002;http://citeseerx.ist.psu.edu/viewdoc/download?doi=10.1.1.71.8094&rep=rep1&type=pdf;http://citeseerx.ist.psu.edu/viewdoc/download?doi=10.1.1.71.8094&rep=rep1&type=pdf;Disconnection+management+AND+(mobile+environments+OR+mobile+systems+OR+mobile+transactions)_GoogleScholar.csv;GoogleScholar;1;52;No DOI available;
Mobile agent security;W Jansen, T Karygiannis - 1998 - dtic.mil;1998;http://www.dtic.mil/docs/citations/ADA391526;http://www.dtic.mil/get-tr-doc/pdf?AD=ADA391526;Disconnection+management+AND+(mobile+environments+OR+mobile+systems+OR+mobile+transactions)_GoogleScholar.csv;GoogleScholar;1;487;No DOI available;
Wireless client/server computing for personal information services and applications;A Elmagarmid, J Jing, T Furukawa - ACM Sigmod Record, 1995 - dl.acm.org;1995;https://dl.acm.org/citation.cfm?id=219735;http://citeseerx.ist.psu.edu/viewdoc/download?doi=10.1.1.30.1083&rep=rep1&type=pdf;Disconnection+management+AND+(mobile+environments+OR+mobile+systems+OR+mobile+transactions)_GoogleScholar.csv;GoogleScholar;1;58;No DOI available;
Handover between fixed and mobile networks for dual mode phones;R Ostling - US Patent 6,327,470, 2001 - Google Patents;2001;https://patents.google.com/patent/US6327470B1/en;No PDF available;Disconnection+management+AND+(mobile+environments+OR+mobile+systems+OR+mobile+transactions)_GoogleScholar.csv;GoogleScholar;1;222;No DOI available;
Mobile agents for mobile computing;RS Gray, D Kotz, S Nog, D Rus, G Cybenko - 1996 - researchgate.net;1996;https://www.researchgate.net/profile/George_Cybenko/publication/2578331_Mobile_Agents_for_Mobile_Computing/links/0046352b9cdc1cf197000000.pdf;https://www.researchgate.net/profile/George_Cybenko/publication/2578331_Mobile_Agents_for_Mobile_Computing/links/0046352b9cdc1cf197000000.pdf;Disconnection+management+AND+(mobile+environments+OR+mobile+systems+OR+mobile+transactions)_GoogleScholar.csv;GoogleScholar;1;205;No DOI available;
Distributed mobility management for target tracking in mobile sensor networks;Y Zou, K Chakrabarty - IEEE Transactions on Mobile Computing, 2007 - computer.org;2007;https://www.computer.org/csdl/trans/tm/2007/08/04253569-abs.html;No PDF available;Disconnection+management+AND+(mobile+environments+OR+mobile+systems+OR+mobile+transactions)_GoogleScholar.csv;GoogleScholar;1;142;No DOI available;y
Database system issues in nomadic computing;R Alonso, HF Korth - ACM SIGMOD Record, 1993 - dl.acm.org;1993;https://dl.acm.org/citation.cfm?id=170092;https://pdfs.semanticscholar.org/c8ff/628044afd559c0ff116175ed5ba1b7cb76a0.pdf;Disconnection+management+AND+(mobile+environments+OR+mobile+systems+OR+mobile+transactions)_GoogleScholar.csv;GoogleScholar;2;327;No DOI available;y
Application-aware adaptation for mobile computing;M Satyanarayanan, B Noble, P Kumar… - … operating systems to …, 1994 - dl.acm.org;1994;https://dl.acm.org/citation.cfm?id=504392;http://www.dtic.mil/get-tr-doc/pdf?AD=ADA288366;Disconnection+management+AND+(mobile+environments+OR+mobile+systems+OR+mobile+transactions)_GoogleScholar.csv;GoogleScholar;1;118;No DOI available;l
A scalable low-latency cache invalidation strategy for mobile environments;G Cao - IEEE Transactions on Knowledge and Data …, 2003 - ieeexplore.ieee.org;2003;https://ieeexplore.ieee.org/abstract/document/1232276/;http://www.cs.columbia.edu/~danr/courses/6762/Summer03/week13/mobile-cache.pdf;Disconnection+management+AND+(mobile+environments+OR+mobile+systems+OR+mobile+transactions)_GoogleScholar.csv;GoogleScholar;1;324;No DOI available;y
Powerscope: A tool for profiling the energy usage of mobile applications;J Flinn, M Satyanarayanan - Mobile Computing Systems and …, 1999 - ieeexplore.ieee.org;1999;https://ieeexplore.ieee.org/abstract/document/749272/;https://www.cs.cmu.edu/~coda/docdir/pscope99.pdf;Disconnection+management+AND+(mobile+environments+OR+mobile+systems+OR+mobile+transactions)_GoogleScholar.csv;GoogleScholar;1;568;No DOI available;
Value creation in mobile commerce: Findings from a consumer survey;B Anckar, D D'incau - Journal of Information Technology Theory and …, 2002 - aisel.aisnet.org;2002;https://aisel.aisnet.org/cgi/viewcontent.cgi?article=1187&context=jitta;http://www.academia.edu/download/38419310/Value_Creation_in_Mobile_Commerce-_Findings_from_a_Consumer_Surve.pdf;Disconnection+management+AND+(mobile+environments+OR+mobile+systems+OR+mobile+transactions)_GoogleScholar.csv;GoogleScholar;1;658;No DOI available;
Reconsidering internet mobility;AC Snoeren, H Balakrishnan, MF Kaashoek - hotos, 2001 - computer.org;2001;https://www.computer.org/csdl/proceedings/hotos/2001/1040/00/10400041.pdf;https://www.cc.gatech.edu/systems/papers/HotOS8.pdf#page=41;Disconnection+handling+AND+mobility_GoogleScholar.csv;GoogleScholar;1;161;No DOI available;
Virtual port-based channel level mobility management middleware in heterogeneous wireless networks;JZ Sun, M Jurmu, J Riekki… - Pervasive Services, 2005 …, 2005 - ieeexplore.ieee.org;2005;https://ieeexplore.ieee.org/abstract/document/1506388/;https://www.researchgate.net/profile/Marko_Jurmu/publication/4173427_Virtual_port-based_channel_level_mobility_management_middleware_in_heterogeneous_wireless_networks/links/0fcfd50a4b6b800cf4000000/Virtual-port-based-channel-level-mobility-management-middleware-in-heterogeneous-wireless-networks.pdf;Disconnection+handling+AND+mobility_GoogleScholar.csv;GoogleScholar;2;815;No DOI available;y
Handling Network Roaming and Long Disconnections at Middleware Level;D Conan, S Chabridon, O Villin, G Bernard… - Proc. Workshop on …, 2002 - Citeseer;2002;http://citeseerx.ist.psu.edu/viewdoc/download?doi=10.1.1.562.4470&rep=rep1&type=pdf;http://citeseerx.ist.psu.edu/viewdoc/download?doi=10.1.1.562.4470&rep=rep1&type=pdf;Disconnection+handling+AND+mobility_GoogleScholar.csv;GoogleScholar;1;11;No DOI available;y
An adaptive mobility-aware MAC protocol for sensor networks (MS-MAC);H Pham, S Jha - Mobile Ad-hoc and Sensor Systems, 2004 …, 2004 - ieeexplore.ieee.org;2004;https://ieeexplore.ieee.org/abstract/document/1392207/;http://citeseerx.ist.psu.edu/viewdoc/download?doi=10.1.1.119.1156&rep=rep1&type=pdf;Disconnection+handling+AND+mobility_GoogleScholar.csv;GoogleScholar;1;169;No DOI available;y
Handling mobility in IoT applications using the MQTT protocol;JE Luzuriaga, JC Cano, C Calafate… - Internet …, 2015 - ieeexplore.ieee.org;2015;https://ieeexplore.ieee.org/abstract/document/7317403/;No PDF available;Disconnection+handling+AND+mobility_GoogleScholar.csv;GoogleScholar;1;30;No DOI available;y
Publisher mobility in distributed publish/subscribe systems;V Muthusamy, M Petrovic, D Gao… - … Workshops, 2005. 25th …, 2005 - ieeexplore.ieee.org;2005;https://ieeexplore.ieee.org/abstract/document/1437206/;https://pdfs.semanticscholar.org/586d/b143362c5ef232f265950989b60788700a70.pdf;Disconnection+handling+AND+mobility_GoogleScholar.csv;GoogleScholar;1;30;No DOI available;y
An agent-based middleware–a solution for terminal and user mobility;S Lipperts, ASB Park - Computer Networks, 1999 - Elsevier;1999;https://www.sciencedirect.com/science/article/pii/S1389128699000791;No PDF available;Disconnection+handling+AND+mobility_GoogleScholar.csv;GoogleScholar;1;42;No DOI available;y
The migrate approach to Internet mobility;AC Snoeren, H Balakrishnan, MF Kaashoek - Proc. of the Oxygen Student …, 2001 - Citeseer;2001;http://citeseerx.ist.psu.edu/viewdoc/download?doi=10.1.1.67.6563&rep=rep1&type=pdf;http://citeseerx.ist.psu.edu/viewdoc/download?doi=10.1.1.67.6563&rep=rep1&type=pdf;Disconnection+handling+AND+mobility_GoogleScholar.csv;GoogleScholar;1;19;No DOI available;
Enhanced communication service for predicting and handling communication interruption;SM Bellovin - US Patent 8,798,614, 2014 - Google Patents;2014;https://patents.google.com/patent/US8798614B2/en;No PDF available;Disconnection+handling+AND+mobility_GoogleScholar.csv;GoogleScholar;2;27;No DOI available;y
An efficient optimistic message logging scheme for recoverable mobile computing systems;T Park, N Woo, HY Yeom - IEEE Transactions on Mobile …, 2002 - ieeexplore.ieee.org;2002;https://ieeexplore.ieee.org/abstract/document/1175540/;http://citeseerx.ist.psu.edu/viewdoc/download?doi=10.1.1.6.7177&rep=rep1&type=pdf;Disconnection+handling+AND+mobility_GoogleScholar.csv;GoogleScholar;1;62;No DOI available;y
A session-based architecture for internet mobility;MAC Snoeren - 2002 - dspace.mit.edu;2002;https://dspace.mit.edu/handle/1721.1/8027;https://dspace.mit.edu/bitstream/handle/1721.1/8027/52700855-MIT.pdf?sequence=2;Disconnection+handling+AND+mobility_GoogleScholar.csv;GoogleScholar;1;39;No DOI available;y
Mobility-aware MAC protocol for delay-sensitive wireless sensor networks;SA Hameed, EM Shaaban, HM Faheem… - … & Workshops, 2009 …, 2009 - ieeexplore.ieee.org;2009;https://ieeexplore.ieee.org/abstract/document/5345591/;No PDF available;Disconnection+handling+AND+mobility_GoogleScholar.csv;GoogleScholar;1;25;No DOI available;y
Camera-integrated video recorder apparatus;K Kashimura - US Patent 5,381,179, 1995 - Google Patents;1995;https://patents.google.com/patent/US5381179A/en;No PDF available;Disconnection+handling+AND+mobility_GoogleScholar.csv;GoogleScholar;1;36;No DOI available;
Protocols for self-organization of a wireless sensor network;K Sohrabi, J Gao, V Ailawadhi… - IEEE personal …, 2000 - academia.edu;2000;http://www.academia.edu/download/22457394/10.1.1.85.4979.pdf;http://www.academia.edu/download/22457394/10.1.1.85.4979.pdf;Disconnection+handling+AND+mobility_GoogleScholar.csv;GoogleScholar;2;2919;No DOI available;
Performance comparison of AODV and OLSR in VANETs urban environments under realistic mobility patterns;J Haerri, F Filali, C Bonnet - … of the 5th IFIP mediterranean ad-hoc …, 2006 - academia.edu;2006;http://www.academia.edu/download/42015233/Performance_comparison_of_AODV_and_OLSR_20160203-30232-lvpvuu.pdf;http://www.academia.edu/download/42015233/Performance_comparison_of_AODV_and_OLSR_20160203-30232-lvpvuu.pdf;Disconnection+handling+AND+mobility_GoogleScholar.csv;GoogleScholar;1;243;No DOI available;
An end-to-end approach to host mobility;AC Snoeren, H Balakrishnan - Proceedings of the 6th annual …, 2000 - dl.acm.org;2000;https://dl.acm.org/citation.cfm?id=345938;http://www.cse.unsw.edu.au/~cs9336/TCP_migrate.pdf;Disconnection+handling+AND+mobility_GoogleScholar.csv;GoogleScholar;1;868;No DOI available;
Mobility support in wireless Internet;N Banerjee, W Wu, SK Das - IEEE Wireless Communications, 2003 - ieeexplore.ieee.org;2003;https://ieeexplore.ieee.org/abstract/document/1241101/;http://dlib.scu.ac.ir/bitstream/Hannan/422843/1/AL373413.pdf;Disconnection+handling+AND+mobility_GoogleScholar.csv;GoogleScholar;1;193;No DOI available;
Towards transport-layer mobility: Evolution of SCTP multihoming;R Ferrús, A Brunstrom, KJ Grinnemo, R Fracchia… - Computer …, 2008 - Elsevier;2008;https://www.sciencedirect.com/science/article/pii/S014036640700549X;http://www.cs.kau.se/cs/education/courses/dvad02/p2/seminar1/Papers/COMCOM3541.pdf;Disconnection+handling+AND+mobility_GoogleScholar.csv;GoogleScholar;1;57;No DOI available;
Peer-to-peer resource discovery in mobile grids;L dos S Lima, ATA Gomes, A Ziviani, M Endler… - Proceedings of the 3rd …, 2005 - dl.acm.org;2005;https://dl.acm.org/citation.cfm?id=1101510;http://www-di.inf.puc-rio.br/~endler/paperlinks/MGC2005-lslima.pdf;Disconnection+handling+AND+mobility_GoogleScholar.csv;GoogleScholar;1;47;No DOI available;
Predictive context aware mobility handling;S Herborn, H Petander, M Ott - Telecommunications, 2008. ICT …, 2008 - ieeexplore.ieee.org;2008;https://ieeexplore.ieee.org/abstract/document/4652647/;No PDF available;Disconnection+handling+AND+mobility_GoogleScholar.csv;GoogleScholar;1;18;No DOI available;
Survey and classification of transport layer mobility management schemes;M Atiquzzaman, AS Reaz - Personal, Indoor and Mobile Radio …, 2005 - ieeexplore.ieee.org;2005;https://ieeexplore.ieee.org/abstract/document/1651818/;http://cs.ou.edu/~netlab/TR/TLayerMobility-PIMRC-TNRL-05-111.pdf;Disconnection+handling+AND+mobility_GoogleScholar.csv;GoogleScholar;1;80;No DOI available;y
Design and implementation of a support platform for distributed mobile computing;A Schill, S Kummel - Distributed Systems Engineering, 1995 - iopscience.iop.org;1995;http://iopscience.iop.org/article/10.1088/0967-1846/2/3/001/meta;https://pdfs.semanticscholar.org/bdc4/ce4c9c5555e3b79a8b5c2a1bb6d8d2940532.pdf;Disconnection+handling+AND+mobility_GoogleScholar.csv;GoogleScholar;1;35;No DOI available;y
Lime: A middleware for physical and logical mobility;AL Murphy, GP Picco, GC Roman - … Computing Systems, 2001 …, 2001 - ieeexplore.ieee.org;2001;https://ieeexplore.ieee.org/abstract/document/918983/;https://pdfs.semanticscholar.org/9813/61190e20c84a33c9f9775f57920e8be9961a.pdf;Disconnection+handling+AND+mobility_GoogleScholar.csv;GoogleScholar;1;572;No DOI available;
Hand-off delay analysis in SIP-based mobility management in wireless networks;N Banerjee, K Basu, SK Das - Parallel and Distributed …, 2003 - ieeexplore.ieee.org;2003;https://ieeexplore.ieee.org/abstract/document/1213412/;https://www.researchgate.net/profile/Nilanjan_Banerjee2/publication/220951595_Hand-Off_Delay_Analysis_in_SIP-Based_Mobility_Management_in_Wireless_Networks/links/544754400cf22b3c14e0c41c.pdf;Disconnection+handling+AND+mobility_GoogleScholar.csv;GoogleScholar;2;75;No DOI available;y
Revisiting Distributed Protocols for Mobility at the Application Layer.;N Nouali, H Drias, A Doucet - WEC (5), 2005 - pdfs.semanticscholar.org;2005;https://pdfs.semanticscholar.org/b1cb/d94b8f767a834e82699d9679b301723593e0.pdf;https://pdfs.semanticscholar.org/b1cb/d94b8f767a834e82699d9679b301723593e0.pdf;Disconnection+handling+AND+mobility_GoogleScholar.csv;GoogleScholar;1;4;No DOI available;y
A transparent network handover for nomadic CORBA users;R Ruggaber, J Seitz - Distributed Computing Systems, 2001 …, 2001 - ieeexplore.ieee.org;2001;https://ieeexplore.ieee.org/abstract/document/918980/;No PDF available;Disconnection+handling+AND+mobility_GoogleScholar.csv;GoogleScholar;1;9;No DOI available;y
Disconnection tolerance for SIP-based real-time media sessions;J Ott, L Xiaojun - Proceedings of the 6th international conference on …, 2007 - dl.acm.org;2007;https://dl.acm.org/citation.cfm?id=1329471;http://www.netlab.tkk.fi/~jo/papers/2007-mum-dt-sip.pdf;Disconnection+handling+AND+mobility_GoogleScholar.csv;GoogleScholar;1;11;No DOI available;
Prototyping applications to handle connection disruptions in end-to-end Host Mobility;BYL Kimura, RS Yokoyama, RRF Lopes… - Wireless On-demand …, 2010 - ieeexplore.ieee.org;2010;https://ieeexplore.ieee.org/abstract/document/5437141/;No PDF available;Disconnection+handling+AND+mobility_GoogleScholar.csv;GoogleScholar;1;10;No DOI available;y
Addressing mobility in wireless sensor media access protocol;H Pham, S Jha - International Journal of Distributed Sensor …, 2005 - Taylor & Francis;2005;https://www.tandfonline.com/doi/abs/10.1080/15501320590966512;http://journals.sagepub.com/doi/pdf/10.1080/15501320590966512;Disconnection+handling+AND+mobility_GoogleScholar.csv;GoogleScholar;1;69;No DOI available;y
Disconnected operation in publish/subscribe middleware;I Burcea, HA Jacobsen, E De Lara, V Muthusamy… - null, 2004 - computer.org;2004;https://www.computer.org/csdl/proceedings/mdm/2004/2070/00/20700039.pdf;http://www.cs.toronto.edu/~delara/papers/mdm2004/pubsub.pdf;Disconnection+handling+AND+mobility_GoogleScholar.csv;GoogleScholar;1;101;No DOI available;y
Mobilityfirst: a robust and trustworthy mobility-centric architecture for the future internet;D Raychaudhuri, K Nagaraja… - ACM SIGMOBILE Mobile …, 2012 - dl.acm.org;2012;https://dl.acm.org/citation.cfm?id=2412098;http://citeseerx.ist.psu.edu/viewdoc/download?doi=10.1.1.440.2259&rep=rep1&type=pdf;Disconnection+handling+AND+mobility_GoogleScholar.csv;GoogleScholar;1;177;No DOI available;
Cross layer integrated approach for secured cluster selection in ad hoc networks;DN Goswami, A Chaturvedi - International Journal of Computer and …, 2012 - ijcce.org;2012;http://www.ijcce.org/papers/49-P010.pdf;http://www.ijcce.org/papers/49-P010.pdf;Disconnection+handling+AND+mobility_GoogleScholar.csv;GoogleScholar;1;10;No DOI available;
Software engineering for mobility: a roadmap;GC Roman, GP Picco, AL Murphy - … of the Conference on the Future of …, 2000 - dl.acm.org;2000;https://dl.acm.org/citation.cfm?id=336567;https://personal.cis.strath.ac.uk/sotirios.terzis/classes/52.504/se_mobility.pdf;Disconnection+handling+AND+mobility_GoogleScholar.csv;GoogleScholar;1;216;No DOI available;
Dealing with frequent aborts in minimum-process coordinated checkpointing algorithm for mobile distributed systems;P Kumar, P Gupta, AK Solanki - International Journal of …, 2010 - pdfs.semanticscholar.org;2010;https://pdfs.semanticscholar.org/2a36/3bb0474dd4aefaa83e2d822ff72cfeca1e46.pdf;https://pdfs.semanticscholar.org/2a36/3bb0474dd4aefaa83e2d822ff72cfeca1e46.pdf;Disconnection+handling+AND+mobility_GoogleScholar.csv;GoogleScholar;1;6;No DOI available;y
Low-cost checkpointing and failure recovery in mobile computing systems;R Prakash, M Singhal - IEEE Transactions on Parallel and …, 1996 - ieeexplore.ieee.org;1996;https://ieeexplore.ieee.org/abstract/document/539735/;http://www-di.inf.puc-rio.br/~endler/courses/Mobile/papers/prakash96.pdf;Disconnection+handling+AND+mobility_GoogleScholar.csv;GoogleScholar;1;304;No DOI available;y
Mobility and context-awareness in workflow systems;JO Nødtvedt, MH Nguyen - … for Computer and Information Science (IDI) …, 2004 - idi.ntnu.no;2004;http://www.idi.ntnu.no/grupper/su/fordypningsprosjekt-2003/fordypning2003-Jon-Ole-Noedtvedt.pdf;http://www.idi.ntnu.no/grupper/su/fordypningsprosjekt-2003/fordypning2003-Jon-Ole-Noedtvedt.pdf;Disconnection+handling+AND+mobility_GoogleScholar.csv;GoogleScholar;1;9;No DOI available;
A system-platform for mobile computing applications;N Diehl, D Grill, A Held, R Kroh - 5th IEEE International …, 1994 - ieeexplore.ieee.org;1994;https://ieeexplore.ieee.org/abstract/document/529473/;No PDF available;Disconnection+handling+AND+mobility_GoogleScholar.csv;GoogleScholar;1;4;No DOI available;
Middleware support for context-awareness in 4g environments;T Springer, K Kadner, F Steuer, M Yin - … on on World of Wireless, Mobile …, 2006 - dl.acm.org;2006;https://dl.acm.org/citation.cfm?id=1139407;No PDF available;Disconnection+handling+AND+mobility_GoogleScholar.csv;GoogleScholar;1;27;No DOI available;
Maintaining consistency of twin transaction model using mobility-enabled distributed file system environment;S Cuce, A Zaslavsky, B Hu, J Rambhia - null, 2002 - computer.org;2002;https://www.computer.org/csdl/proceedings/dexa/2002/1668/00/16680752.pdf;No PDF available;Disconnection+handling+AND+mobility_GoogleScholar.csv;GoogleScholar;1;4;No DOI available;y
A token-based group mutual exclusion algorithm for cellular wireless networks;A Swaroop, AK Singh - India Conference (INDICON), 2009 …, 2009 - ieeexplore.ieee.org;2009;https://ieeexplore.ieee.org/abstract/document/5409387/;https://www.researchgate.net/profile/Abhishek_Swaroop/publication/224112680_A_Token-Based_Group_Mutual_Exclusion_Algorithm_for_Cellular_Wireless_Networks/links/0046351828d8770ccb000000.pdf;Disconnection+handling+AND+mobility_GoogleScholar.csv;GoogleScholar;1;5;No DOI available;y
A Partitioning Model for Applications in Mobile Environments;A Schill, A Held, T Ziegert, T Springer - Mobile Agents, 1999 - dfki.de;1999;http://www.dfki.de/imedia/workshops/agents99/proceedings/mac3-workshop-notes.pdf#page=35;http://www.dfki.de/imedia/workshops/agents99/proceedings/mac3-workshop-notes.pdf#page=35;Disconnection+handling+AND+mobility_GoogleScholar.csv;GoogleScholar;1;4;No DOI available;
Emulating mobile ad-hoc networks of hand-held devices: the octopus virtual environment;F D'Aprano, M de Leoni, M Mecella - … of the 1st international workshop on …, 2007 - dl.acm.org;2007;https://dl.acm.org/citation.cfm?id=1247729;https://www.dis.uniroma1.it/~workpad/papers/Mobisys2007.pdf;Disconnection+handling+AND+mobility_GoogleScholar.csv;GoogleScholar;1;17;No DOI available;
Wireless ATM networks: Architecture, system design and prototyping;D Raychaudhuri - IEEE Personal Communications, 1996 - ieeexplore.ieee.org;1996;https://ieeexplore.ieee.org/abstract/document/536478/;No PDF available;Disconnection+handling+AND+mobility_GoogleScholar.csv;GoogleScholar;2;187;No DOI available;
Reliable clinical monitoring using wireless sensor networks: experiences in a step-down hospital unit;O Chipara, C Lu, TC Bailey, GC Roman - … of the 8th ACM conference on …, 2010 - dl.acm.org;2010;https://dl.acm.org/citation.cfm?id=1869999;https://www.cse.wustl.edu/~lu/papers/sensys10.pdf;Disconnection+handling+AND+mobility_GoogleScholar.csv;GoogleScholar;1;244;No DOI available;
Scalable group membership service for mobile Internet;B Kim, D Lee, D Nam - isvlsi, 2002 - computer.org;2002;https://www.computer.org/csdl/proceedings/words/2002/1576/00/15760295.pdf;https://pdfs.semanticscholar.org/cea0/43d0ed03de445d91aa60f2eb43cc76b64040.pdf;Disconnection+handling+AND+mobility_GoogleScholar.csv;GoogleScholar;1;4;No DOI available;
Two approaches for an adaptive multimedia transfer service for mobile environments;A Schill, S Kümmel, T Springer, T Ziegert - Computers & Graphics, 1999 - Elsevier;1999;https://www.sciencedirect.com/science/article/pii/S0097849399001156;No PDF available;Disconnection+handling+AND+mobility_GoogleScholar.csv;GoogleScholar;1;4;No DOI available;
Recovering from a disconnected phone call;N Kedem - US Patent 7,233,788, 2007 - Google Patents;2007;https://patents.google.com/patent/US7233788B2/en;No PDF available;Disconnection+handling+AND+mobility_GoogleScholar.csv;GoogleScholar;1;34;No DOI available;
Software Models for Mobile Wireless Computing;E Pitoura - Summer School on Data Management for …, 1998 - pdfs.semanticscholar.org;1998;https://pdfs.semanticscholar.org/0cca/80ffea76e37f291328399e3c3abe4849071b.pdf;https://pdfs.semanticscholar.org/0cca/80ffea76e37f291328399e3c3abe4849071b.pdf;Disconnection+handling+AND+mobility_GoogleScholar.csv;GoogleScholar;1;5;No DOI available;
System and method of handling emergency calls from roaming mobile stations in a radio telecommunications network;J Bugnon, B Nguyen - US Patent 6,240,284, 2001 - Google Patents;2001;https://patents.google.com/patent/US6240284B1/en;No PDF available;Disconnection+handling+AND+mobility_GoogleScholar.csv;GoogleScholar;1;36;No DOI available;
