title,author,date,link,pdf_link,query,search_engine,nr_found,cite_count,doi
An Efficient Cache Refreshing Policy to Improve QoS in MANET Through RAMP,"A. Vijay Vasanth,    K. Venkatachalapathy…",2018,https://link.springer.com/chapter/10.1007/978-981-10-8228-3_34,https://link.springer.com/content/pdf/10.1007%2F978-981-10-8228-3_34.pdf,,,1,No cite count available,https://doi.org/10.1007/978-981-10-8228-3_34
"Data Aggregation in Wireless Sensor Networks: Previous Research, Current Status and Future Directions","Sukhchandan Randhawa,    Sushma Jain",2017,https://link.springer.com/article/10.1007/s11277-017-4674-5,https://link.springer.com/content/pdf/10.1007%2Fs11277-017-4674-5.pdf,,,1,4,https://doi.org/10.1007/s11277-017-4674-5
Integrated Social and QoS Trust-Based Routing in Delay Tolerant Networks,"Ing-Ray Chen,    Fenye Bao,    MoonJeong Chang,    Jin-Hee Cho",2012,https://link.springer.com/article/10.1007/s11277-011-0351-2,https://link.springer.com/content/pdf/10.1007%2Fs11277-011-0351-2.pdf,,,1,9,https://doi.org/10.1007/s11277-011-0351-2
Random Graph Models and the Limits of Scalability in Ad Hoc and Sensor Networks,András Faragó,2008,https://link.springer.com/chapter/10.1007/978-0-387-77320-9_2,No PDF available,,,1,No cite count available,https://doi.org/10.1007/978-0-387-77320-9_2
MIXes in mobile communication systems: Location management with privacy,"Hannes Federrath,    Anja Jerichow,    Andreas Pfitzmann",1996,https://link.springer.com/chapter/10.1007/3-540-61996-8_36,https://link.springer.com/content/pdf/10.1007%2F3-540-61996-8_36.pdf,,,1,13,https://doi.org/10.1007/3-540-61996-8_36
"Editorial: Peer-to-Peer networking and applications, Volume 3, Issue 4","Xuemin (Sherman) Shen,    Heather Yu",2010,https://link.springer.com/article/10.1007/s12083-010-0091-1,https://link.springer.com/content/pdf/10.1007%2Fs12083-010-0091-1.pdf,,,1,No cite count available,https://doi.org/10.1007/s12083-010-0091-1
Gesture-Based Interface for Connection and Control of Multi-device in a Tabletop Display Environment,"Hyunglae Lee,    Heeseok Jeong,    Joongho Lee…",2009,https://link.springer.com/chapter/10.1007/978-3-642-02577-8_24,No PDF available,,,1,2,https://doi.org/10.1007/978-3-642-02577-8_24
Methanol as a Hydrogen and Energy Carrier,"Ludolf Plass,    Martin Bertau…",2014,https://link.springer.com/chapter/10.1007/978-3-642-39709-7_8,No PDF available,,,1,3,https://doi.org/10.1007/978-3-642-39709-7_8
"Association europeenne de chirurgie viscérale third international congress on new technology and advanced techniques in surgery joint meeting with the third annual congress of the European association for endoscopic surgery (E.A.E.S.) joint E.A.E.S. and SAGES postgraduate course third international symposium on thoracoscopy and video-assisted thoracic surgery Luxembourg, 11–17 June 1995 poster presentations",No author available,1995,https://link.springer.com/article/10.1007/BF00206855,https://link.springer.com/content/pdf/10.1007%2FBF00206855.pdf,,,1,No cite count available,https://doi.org/10.1007/BF00206855
"The Liberal Arts,the Campus, and the Biosphere (1990)",David W. Orr,2011,https://link.springer.com/chapter/10.5822/978-1-61091-017-0_28,No PDF available,,,1,No cite count available,https://doi.org/10.5822/978-1-61091-017-0_28
The role of monoamines and acetylcholine-containing neurons in the regulation of the sleep-waking cycle,Michel Jouvet,1972,https://link.springer.com/chapter/10.1007/3-540-05462-6_2,No PDF available,,,1,No cite count available,https://doi.org/10.1007/3-540-05462-6_2
US Foreign Relations and the Institutional Power of the Internet,Daniel R. McCarthy,2015,https://link.springer.com/chapter/10.1057/9781137306906_4,No PDF available,,,1,No cite count available,https://doi.org/10.1057/9781137306906_4
Electrolytes and Separators for Lithium Batteries,"Christian Julien,    Alain Mauger,    Ashok Vijh,    Karim Zaghib",2016,https://link.springer.com/chapter/10.1007/978-3-319-19108-9_11,https://link.springer.com/content/pdf/10.1007%2F978-3-319-19108-9_11.pdf,,,1,1,https://doi.org/10.1007/978-3-319-19108-9_11
Synecological Perspectives in Meiobenthology,No author available,2009,https://link.springer.com/chapter/10.1007/978-3-540-68661-3_9,No PDF available,,,1,No cite count available,https://doi.org/10.1007/978-3-540-68661-3_9
Gulf Perspectives on the Global Rebalancing,Kristian Coates Ulrichsen,2016,https://link.springer.com/chapter/10.1057/9781137385611_5,No PDF available,,,1,No cite count available,https://doi.org/10.1057/9781137385611_5
“Opportunity to Flourish”: Reconnecting Pedagogy for Youths Out-of-School and Out-of-Work,"Clarence Ng,    Brendan Bartlett,    Stephen N. Elliott",2018,https://link.springer.com/chapter/10.1007/978-3-319-94652-8_7,No PDF available,,,1,No cite count available,https://doi.org/10.1007/978-3-319-94652-8_7
Conclusion Cue the Sun,Robert Beuka,2004,https://link.springer.com/chapter/10.1007/978-1-349-73210-4_7,No PDF available,,,1,1,https://doi.org/10.1007/978-1-349-73210-4_7
Neonatal Bacterial and Fungal Infections,"Mauro Stronati,    Alessandro Borghesi",2012,https://link.springer.com/chapter/10.1007/978-88-470-1405-3_116,No PDF available,,,1,No cite count available,https://doi.org/10.1007/978-88-470-1405-3_116
Neonatal Bacterial and Fungal Infections,"Mauro Stronati,    Alessandro Borghesi",No year available,https://link.springer.com/referenceworkentry/10.1007/978-3-319-18159-2_254-1,No PDF available,,,1,No cite count available,https://doi.org/10.1007/978-3-319-18159-2_254-1
Poster session 3,No author available,1992,https://link.springer.com/article/10.1007/BF02291297,https://link.springer.com/content/pdf/10.1007%2FBF02291297.pdf,,,1,No cite count available,https://doi.org/10.1007/BF02291297
The Mystic,Robert Ziegler,2012,https://link.springer.com/chapter/10.1057/9781137006615_5,No PDF available,,,1,No cite count available,https://doi.org/10.1057/9781137006615_5
Toward Socially Responsible Clinical Practice Suited to the Needs of a Global Community,"Elena Mustakova-Possardt,    Julie Oxenberg",2014,https://link.springer.com/chapter/10.1007/978-1-4614-7391-6_4,No PDF available,,,1,No cite count available,https://doi.org/10.1007/978-1-4614-7391-6_4
"Audiences, Towards 2030: Drivers, Scenarios and Horizons of the Future","Lucia Vesnić-Alujević,    Gilda Seddighi,    Ranjana Das…",2018,https://link.springer.com/chapter/10.1007/978-3-319-75638-7_11,No PDF available,,,1,No cite count available,https://doi.org/10.1007/978-3-319-75638-7_11
Celebrity Worship and Fantasy Immersion,Meta Regis,2013,https://link.springer.com/chapter/10.1057/9781137300775_6,No PDF available,,,1,No cite count available,https://doi.org/10.1057/9781137300775_6
Designing Outdoor Mixed Reality Hardware Systems,"Benjamin Avery,    Ross T. Smith,    Wayne Piekarski…",2010,https://link.springer.com/chapter/10.1007/978-1-84882-733-2_11,No PDF available,,,1,2,https://doi.org/10.1007/978-1-84882-733-2_11
Anthropomorphism and the Critique of Liberal Rights in John Clare’s Enclosure Elegies,Katey Castellano,2013,https://link.springer.com/chapter/10.1057/9781137354204_7,No PDF available,,,1,No cite count available,https://doi.org/10.1057/9781137354204_7
"Materiality, Symbol, and Complexity in the Anthropology of Money","Taylor C. Nelms,    Bill Maurer",2014,https://link.springer.com/chapter/10.1007/978-1-4939-0959-9_3,No PDF available,,,1,1,https://doi.org/10.1007/978-1-4939-0959-9_3
“The Best Means of Retaining Health”: Self-Determined Health and Social Discipline in Early America,Maureen Tuthill,2016,https://link.springer.com/chapter/10.1057/978-1-137-59715-1_4,No PDF available,,,1,No cite count available,https://doi.org/10.1057/978-1-137-59715-1_4
Comparison of a high-intensity and a low-intensity lumbar extensor training program as minimal intervention treatment in low back pain: a randomized trial,"P. H. Helmhout,    C. C. Harts,    J. B. Staal,    M. J. J. M. Candel…",2004,https://link.springer.com/article/10.1007/s00586-004-0671-y,https://link.springer.com/content/pdf/10.1007%2Fs00586-004-0671-y.pdf,,,1,40,https://doi.org/10.1007/s00586-004-0671-y
Transnationalism,Reinhard Schunck,2014,https://link.springer.com/chapter/10.1007/978-3-319-03928-2_3,No PDF available,,,1,No cite count available,https://doi.org/10.1007/978-3-319-03928-2_3
Concepts and Theory: Political Sociology and European Studies,"Sophie Duchesne,    Elizabeth Frazer…",2013,https://link.springer.com/chapter/10.1057/9781137297266_2,No PDF available,,,1,No cite count available,https://doi.org/10.1057/9781137297266_2
Calcium Phosphate Bone Cements: Their Development and Clinical Applications,"Fangping Chen,    Xiaoyu Ma,    Yuanman Yu…",2018,https://link.springer.com/chapter/10.1007/978-981-10-5975-9_1,https://link.springer.com/content/pdf/10.1007%2F978-981-10-5975-9_1.pdf,,,1,No cite count available,https://doi.org/10.1007/978-981-10-5975-9_1
"Path-Clearing: Philosophy and History, Scientific Dependency, and Hountondji’s Turn to Endogenous Knowledge","Franziska Dübgen,    Stefan Skupien",2019,https://link.springer.com/chapter/10.1007/978-3-030-01995-2_4,No PDF available,,,1,No cite count available,https://doi.org/10.1007/978-3-030-01995-2_4
On Faithful Presence: Religion and Human Wholeness in Nigeria,Akintunde E. Akinade,2014,https://link.springer.com/chapter/10.1057/9781137430076_6,No PDF available,,,1,No cite count available,https://doi.org/10.1057/9781137430076_6
Mining subsidence and its impact on the environment: the example of the Nord/Pas-de-Calais coalfield,Daniel Ghouzi,1982,https://link.springer.com/article/10.1007/BF02086781,https://link.springer.com/content/pdf/10.1007%2FBF02086781.pdf,,,1,No cite count available,https://doi.org/10.1007/BF02086781
Data Management,"C. Bolchini,    F. A. Schreiber,    L. Tanca",2006,https://link.springer.com/chapter/10.1007/3-540-31008-8_6,No PDF available,,,1,1,https://doi.org/10.1007/3-540-31008-8_6
"“A Whole Way of Struggle?”: Western Marxisms, Social Movements, and Culture",Laurence Cox,2014,https://link.springer.com/chapter/10.1057/9781137385796_3,No PDF available,,,1,No cite count available,https://doi.org/10.1057/9781137385796_3
"Touching technologies, touching visions. The reclaiming of sensorial experience and the politics of speculative thinking",María Puig de la Bellacasa,2009,https://link.springer.com/article/10.1057/sub.2009.17,No PDF available,,,1,27,https://doi.org/10.1057/sub.2009.17
Governance of the Internet of Things,"Professor Dr. Rolf H. Weber,    Romana Weber",2010,https://link.springer.com/chapter/10.1007/978-3-642-11710-7_4,No PDF available,,,1,No cite count available,https://doi.org/10.1007/978-3-642-11710-7_4
Beneficial arthropod behavior mediated by airborne semiochemicals,"P. O. Zanen,    W. J. Lewis,    R. T. Cardé,    B. G. Mullinix",1989,https://link.springer.com/article/10.1007/BF02027780,https://link.springer.com/content/pdf/10.1007%2FBF02027780.pdf,,,1,14,https://doi.org/10.1007/BF02027780
Complication Avoidance and Management in Deep Brain Stimulation Surgery,"Philip A. Starr,    Karl Sillay",2008,https://link.springer.com/chapter/10.1007/978-1-59745-360-8_7,https://link.springer.com/content/pdf/10.1007%2F978-1-59745-360-8_7.pdf,,,1,3,https://doi.org/10.1007/978-1-59745-360-8_7
Photovoltaic Power Generation,"Martin Kaltschmitt,    Wolfgang Streicher,    Andreas Wiese",2007,https://link.springer.com/chapter/10.1007/3-540-70949-5_6,No PDF available,,,1,1,https://doi.org/10.1007/3-540-70949-5_6
"Frequency, Diagnosis, and Management of Occlusive and Mechanical PICC Complications",Lisa Dougherty,2014,https://link.springer.com/chapter/10.1007/978-88-470-5665-7_8,No PDF available,,,1,1,https://doi.org/10.1007/978-88-470-5665-7_8
Civil Society and Democracy in South Korea: A Reassessment,"Antonio Fiori,    Sunhyuk Kim",2018,https://link.springer.com/chapter/10.1007/978-3-319-57066-2_7,https://link.springer.com/content/pdf/10.1007%2F978-3-319-57066-2_7.pdf,,,1,No cite count available,https://doi.org/10.1007/978-3-319-57066-2_7
Source processes in the high-latitude ionosphere,"T.E. Moore,    R. Lundin,    D. Alcayde,    M. André,    S.B. Ganguli…",1999,https://link.springer.com/article/10.1023/A%3A1005299616446,https://link.springer.com/content/pdf/10.1023%2FA%3A1005299616446.pdf,,,1,47,https://doi.org/10.1023/A:1005299616446
"Abstract of the 7th Congress of the European Society of Neuroradiology Barcelona, September 8–10, 1977",No author available,1978,https://link.springer.com/article/10.1007/BF00327445,https://link.springer.com/content/pdf/10.1007%2FBF00327445.pdf,,,1,1,https://doi.org/10.1007/BF00327445
"The Social Construction of Twinship I: Family, Parents and Siblings",Elizabeth A. Stewart,2003,https://link.springer.com/chapter/10.1057/9781403914224_7,No PDF available,,,1,No cite count available,https://doi.org/10.1057/9781403914224_7
Strategic Innovation in Practice,"Taco C. R. van Someren,    Shuhua van Someren-Wang",2013,https://link.springer.com/chapter/10.1007/978-3-642-36237-8_5,No PDF available,,,1,No cite count available,https://doi.org/10.1007/978-3-642-36237-8_5
Essay on the State of Research and Innovation in France and the European Union,"Antoine Kornprobst,    Raphael Douady",2017,https://link.springer.com/chapter/10.1007/978-3-319-44287-7_17,No PDF available,,,1,No cite count available,https://doi.org/10.1007/978-3-319-44287-7_17
Socialism: Globalization as the Fulfilment of History,Rafal Soborski,2013,https://link.springer.com/chapter/10.1057/9781137317018_4,No PDF available,,,1,No cite count available,https://doi.org/10.1057/9781137317018_4
New Patterns of Industrial Relations and Political Action since the 1980s,Michel Lallement,2008,https://link.springer.com/chapter/10.1057/9780230584532_3,No PDF available,,,1,2,https://doi.org/10.1057/9780230584532_3
Narratives and critical literacy,"Argiris Archakis,    Villy Tsakona",2012,https://link.springer.com/chapter/10.1057/9781137264992_7,No PDF available,,,1,No cite count available,https://doi.org/10.1057/9781137264992_7
The principle of genome complementarity in the enhancement of plant adaptive capacities,"I. A. Tikhonovich,    E. E. Andronov,    A. Yu. Borisov…",2015,https://link.springer.com/article/10.1134/S1022795415090124,https://link.springer.com/content/pdf/10.1134%2FS1022795415090124.pdf,,,1,4,https://doi.org/10.1134/S1022795415090124
Source processes in the high-latitude ionosphere,"Bengt Hultqvist,    Marit Øieroset…",1999,https://link.springer.com/chapter/10.1007/978-94-011-4477-3_2,No PDF available,,,1,1,https://doi.org/10.1007/978-94-011-4477-3_2
Health Risks from the Environment: Challenges to Health Service Delivery,Denise M. Oleske,2010,https://link.springer.com/chapter/10.1007/978-1-4419-0164-4_8,No PDF available,,,1,No cite count available,https://doi.org/10.1007/978-1-4419-0164-4_8
"Total metal levels in crayfish Astacus leptodactylus (Eschscholtz, 1823), and surface sediments in Lake Terkos, Turkey","Aysegül Kurun,    Nuray Balkıs,    Melike Erkan…",2010,https://link.springer.com/article/10.1007/s10661-009-1181-5,https://link.springer.com/content/pdf/10.1007%2Fs10661-009-1181-5.pdf,,,1,13,https://doi.org/10.1007/s10661-009-1181-5
The Discourse of Deliberative Democracy,Florence Faucher-King,2005,https://link.springer.com/chapter/10.1057/9780230509887_8,No PDF available,,,1,No cite count available,https://doi.org/10.1057/9780230509887_8
"
The Winslow Boy: Let Right Be Done",John A. Bertolini,2016,https://link.springer.com/chapter/10.1007/978-3-319-40997-9_5,No PDF available,,,1,No cite count available,https://doi.org/10.1007/978-3-319-40997-9_5
Ritual Recognition of Abortion: Japanese Buddhist Practices and U.S. Jewish and Christian Proposals,June O’Connor,1995,https://link.springer.com/chapter/10.1007/978-94-015-8424-1_6,No PDF available,,,1,1,https://doi.org/10.1007/978-94-015-8424-1_6
Tissue Angiotensin Converting Enzyme,"Suzanne Oparil,    Qingcheng Meng,    Shuang-dan Sun,    Yiu-Fai Chen…",1996,https://link.springer.com/chapter/10.1007/978-1-4613-0355-8_15,No PDF available,,,1,2,https://doi.org/10.1007/978-1-4613-0355-8_15
Specific Language Dysfunctioning in Children: A Historical Overview,"Mahin Hassibi,    Harry Breuer Jr.",1980,https://link.springer.com/chapter/10.1007/978-1-4899-2186-4_3,No PDF available,,,1,No cite count available,https://doi.org/10.1007/978-1-4899-2186-4_3
The water supply of Rome: an “almost” unique case,"Pasquale Avino,    Geraldo Capannesi,    Alberto Rosada,    Matteo Vitali…",2016,https://link.springer.com/article/10.1007/s12210-015-0455-9,https://link.springer.com/content/pdf/10.1007%2Fs12210-015-0455-9.pdf,,,1,No cite count available,https://doi.org/10.1007/s12210-015-0455-9
Neuroendocrine Control in the Thermal Stress,Vojislav M. Petrović,1985,https://link.springer.com/chapter/10.1007/978-1-4684-8553-0_9,No PDF available,,,1,No cite count available,https://doi.org/10.1007/978-1-4684-8553-0_9
Distributed Routing on Ad Hoc Networks,"Carlos A. S. Oliveira,    Panos M. Pardalos",2011,https://link.springer.com/chapter/10.1007/978-1-4614-0311-1_11,No PDF available,,,1,No cite count available,https://doi.org/10.1007/978-1-4614-0311-1_11
Using mobile technology to deliver a cognitive behaviour therapy-informed intervention in early psychosis (Actissist): study protocol for a randomised controlled trial,"Sandra Bucci,    Christine Barrowclough,    John Ainsworth,    Rohan Morris…",2015,https://link.springer.com/article/10.1186/s13063-015-0943-3,https://link.springer.com/content/pdf/10.1186%2Fs13063-015-0943-3.pdf,,,1,14,https://doi.org/10.1186/s13063-015-0943-3
Afterword: Bootleg Mathematics,Peter Appelbaum,2008,https://link.springer.com/chapter/10.1007/978-0-387-75464-2_9,No PDF available,,,1,No cite count available,https://doi.org/10.1007/978-0-387-75464-2_9
Clinical evaluation of a novel occluder device (Occlutech®) for percutaneous transcatheter closure of patent foramen ovale (PFO),Dr. med. univ. Florian Krizanic…,2008,https://link.springer.com/article/10.1007/s00392-008-0699-9,https://link.springer.com/content/pdf/10.1007%2Fs00392-008-0699-9.pdf,,,1,18,https://doi.org/10.1007/s00392-008-0699-9
Virtual Coordinates with Backtracking for Void Traversal in Geographic Routing,"Ke Liu,    Nael Abu-Ghazaleh",2006,https://link.springer.com/chapter/10.1007/11814764_6,No PDF available,,,1,8,https://doi.org/10.1007/11814764_6
"Interpersonal Needs, Depressive Symptoms, and Suicide Ideation in a Sample of Portuguese Elderly Patients Recovering from Acute Medical Conditions","Rui C. Campos,    Sara Santos…",2018,https://link.springer.com/article/10.1007/s10880-017-9520-0,https://link.springer.com/content/pdf/10.1007%2Fs10880-017-9520-0.pdf,,,1,1,https://doi.org/10.1007/s10880-017-9520-0
Mathematics Education and Common Sense,"Christine Keitel,    Jeremy Kilpatrick",2005,https://link.springer.com/chapter/10.1007/0-387-24040-3_8,No PDF available,,,1,1,https://doi.org/10.1007/0-387-24040-3_8
Staged ‘intentional’ bridging vein ligation: a safe strategy in gaining wide access to skull base tumors,"Amey R. Savardekar,    Takeo Goto,    Takashi Nagata,    Kenichi Ishibashi…",2014,https://link.springer.com/article/10.1007/s00701-014-2028-6,https://link.springer.com/content/pdf/10.1007%2Fs00701-014-2028-6.pdf,,,1,6,https://doi.org/10.1007/s00701-014-2028-6
Liquefied Natural Gas,"G. G. Nasr,    N. E. Connor",2014,https://link.springer.com/chapter/10.1007/978-3-319-08948-5_3,No PDF available,,,1,No cite count available,https://doi.org/10.1007/978-3-319-08948-5_3
SECA on MIA-DTN: Tackling the Energy Issue in Monitor Incorporated Adaptive Delay Tolerant Network Using a Simplistic Energy Conscious Approach,"Priyanka Das,    Pratyush Nishantkar,    Tanmay De",2018,https://link.springer.com/article/10.1007/s10922-018-9461-4,https://link.springer.com/content/pdf/10.1007%2Fs10922-018-9461-4.pdf,,,1,No cite count available,https://doi.org/10.1007/s10922-018-9461-4
Sustainable Campus in a Historical Town: The “Ca’ Foscari University of Venice” Case Study,Fabio Pranovi,2017,https://link.springer.com/chapter/10.1007/978-3-319-47889-0_9,https://link.springer.com/content/pdf/10.1007%2F978-3-319-47889-0_9.pdf,,,1,No cite count available,https://doi.org/10.1007/978-3-319-47889-0_9
Deep-Sub-μm CMOS Circuits,No author available,2006,https://link.springer.com/chapter/10.1007/978-3-540-29614-0_9,No PDF available,,,1,No cite count available,https://doi.org/10.1007/978-3-540-29614-0_9
Elastomeric pumps for ambulatory patient controlled regional analgesia,"Sugantha Ganapathy,    Annunziato Amendola…",2000,https://link.springer.com/article/10.1007/BF03019672,https://link.springer.com/content/pdf/10.1007%2FBF03019672.pdf,,,1,52,https://doi.org/10.1007/BF03019672
Introduction,"Yu Wang,    Shiwen Mao,    R. Mark Nelms",2015,https://link.springer.com/chapter/10.1007/978-3-319-17133-3_1,https://link.springer.com/content/pdf/10.1007%2F978-3-319-17133-3_1.pdf,,,1,No cite count available,https://doi.org/10.1007/978-3-319-17133-3_1
Regulation of Saccharomyces cerevisiae DNA polymerase η transcript and protein,"Ritu Pabla,    Donald Rozario,    Wolfram Siede",2008,https://link.springer.com/article/10.1007/s00411-007-0132-1,https://link.springer.com/content/pdf/10.1007%2Fs00411-007-0132-1.pdf,,,1,10,https://doi.org/10.1007/s00411-007-0132-1
“They brought you back to the fact you’re not the same”: Sense of self after traumatic brain injury,Petra Mäkelä,2017,https://link.springer.com/article/10.1057/s41286-017-0036-8,No PDF available,,,1,1,https://doi.org/10.1057/s41286-017-0036-8
Southey’s West Country,Lynda Pratt,2010,https://link.springer.com/chapter/10.1057/9780230281455_11,No PDF available,,,1,No cite count available,https://doi.org/10.1057/9780230281455_11
What the Child Brings to Language,"William Kessen,    Katherine Nelson",1978,https://link.springer.com/chapter/10.1007/978-1-4684-2538-3_3,No PDF available,,,1,No cite count available,https://doi.org/10.1007/978-1-4684-2538-3_3
Dressing Corporate Subjectivities: Learning What to Wear to the Bank,"Kathryn Church,    Catherine Frazee,    Teresa (Tracy) Luciani…",2006,https://link.springer.com/chapter/10.1007/1-4020-5360-6_5,No PDF available,,,1,1,https://doi.org/10.1007/1-4020-5360-6_5
Hemispherectomy — 25 years later — findings and concepts,"Klaus-Joachim Zülch,    Edith Micheler",1978,https://link.springer.com/article/10.1007/BF01647461,https://link.springer.com/content/pdf/10.1007%2FBF01647461.pdf,,,1,8,https://doi.org/10.1007/BF01647461
Distributing the Future Evenly: English as the Lingua Franca in the Saudi Arabian Higher Education Sector,Andrys Onsman,2012,https://link.springer.com/article/10.1057/hep.2012.8,No PDF available,,,1,1,https://doi.org/10.1057/hep.2012.8
Don’t Forget About the Body: Exploring the Curricular Possibilities of Embodied Pedagogy,"David J. Nguyen,    Jay B. Larson",2015,https://link.springer.com/article/10.1007/s10755-015-9319-6,https://link.springer.com/content/pdf/10.1007%2Fs10755-015-9319-6.pdf,,,1,20,https://doi.org/10.1007/s10755-015-9319-6
An efficient technique for mitigating stealthy attacks using MNDA in MANET,"D. Muruganandam,    J. Martin Leo Manickam",2018,https://link.springer.com/article/10.1007/s00521-018-3634-7,https://link.springer.com/content/pdf/10.1007%2Fs00521-018-3634-7.pdf,,,1,No cite count available,https://doi.org/10.1007/s00521-018-3634-7
I,Seiichi Ishibashi,1987,https://link.springer.com/chapter/10.1007/978-1-4684-5433-8_9,No PDF available,,,1,No cite count available,https://doi.org/10.1007/978-1-4684-5433-8_9
Complexity in Health: An Introduction,"Joachim P. Sturmberg,    Carmel M. Martin",2013,https://link.springer.com/chapter/10.1007/978-1-4614-4998-0_1,No PDF available,,,1,4,https://doi.org/10.1007/978-1-4614-4998-0_1
Sensors in Disposable Bioreactors Status and Trends,"Anne Glindkamp,    Daniel Riechers,    Christoph Rehbock…",2010,https://link.springer.com/chapter/10.1007/10_2009_10,https://link.springer.com/content/pdf/10.1007%2F10_2009_10.pdf,,,1,19,https://doi.org/10.1007/10_2009_10
US Government-Sponsored Educational Exchange Programs,Katarzyna Pisarska,2016,https://link.springer.com/chapter/10.1057/978-1-137-54679-1_5,No PDF available,,,1,No cite count available,https://doi.org/10.1057/978-1-137-54679-1_5
New Management Methods for Feature and Preference Interactions,"Zohair Chentouf,    Soumaya Cherkaoui…",2003,https://link.springer.com/chapter/10.1007/978-3-540-39404-4_18,https://link.springer.com/content/pdf/10.1007%2F978-3-540-39404-4_18.pdf,,,1,1,https://doi.org/10.1007/978-3-540-39404-4_18
Individuality and Parentage,John C. Avise,1994,https://link.springer.com/chapter/10.1007/978-1-4615-2381-9_5,No PDF available,,,1,No cite count available,https://doi.org/10.1007/978-1-4615-2381-9_5
Pore Network Analysis of Resistivity Index for Water-Wet Porous Media,"Christos D. Tsakiroglou,    Marc Fleury",1999,https://link.springer.com/article/10.1023/A%3A1006586409963,https://link.springer.com/content/pdf/10.1023%2FA%3A1006586409963.pdf,,,1,31,https://doi.org/10.1023/A:1006586409963
The neuropathology of encephalitis lethargica,Paul Bernard Foley,2018,https://link.springer.com/chapter/10.1007/978-1-4939-0384-9_7,https://link.springer.com/content/pdf/10.1007%2F978-1-4939-0384-9_7.pdf,,,1,No cite count available,https://doi.org/10.1007/978-1-4939-0384-9_7
"Power, Politics and the State","Tony Bilton,    Kevin Bonnett,    Pip Jones,    David Skinner…",1996,https://link.springer.com/chapter/10.1007/978-1-349-24712-7_10,No PDF available,,,1,No cite count available,https://doi.org/10.1007/978-1-349-24712-7_10
Employer-based career education: A new alternative,Lawrence J. Barnett,1972,https://link.springer.com/article/10.1007/BF02336164,https://link.springer.com/content/pdf/10.1007%2FBF02336164.pdf,,,1,1,https://doi.org/10.1007/BF02336164
