title,author,date,link,pdf_link,query,search_engine,nr_found,cite_count,doi
Abstract withdrawn,No author available,2013,https://link.springer.com/article/10.1186/cc12288,https://link.springer.com/content/pdf/10.1186%2Fcc12288.pdf,,,1,No cite count available,https://doi.org/10.1186/cc12288
Peer-to-Peer Computing in Mobile Ad Hoc Networks,"Alexander Klemm,    Christoph Lindemann…",2004,https://link.springer.com/chapter/10.1007/978-3-540-24663-3_9,No PDF available,,,1,3,https://doi.org/10.1007/978-3-540-24663-3_9
A Proxy Based Efficient Checkpointing Scheme for Fault Recovery in Mobile Grid System,"Imran Rao,    Nomica Imran,    PilWoo Lee,    Eui-Nam Huh…",2006,https://link.springer.com/chapter/10.1007/11945918_44,No PDF available,,,1,5,https://doi.org/10.1007/11945918_44
An agent based application for personalized vehicular traffic management,"Alexander Schill,    Albert Held,    Wito Böhmak,    Thomas Springer…",1998,https://link.springer.com/chapter/10.1007/BFb0057651,No PDF available,,,1,1,https://doi.org/10.1007/BFb0057651
"Mobile Commerce: Framework, Applications and Networking Support","Upkar Varshney,    Ron Vetter",2002,https://link.springer.com/article/10.1023/A%3A1014570512129,https://link.springer.com/content/pdf/10.1023%2FA%3A1014570512129.pdf,,,1,201,https://doi.org/10.1023/A:1014570512129
Database System Architecture – A Walk Through Time: From Centralized Platform to Mobile Computing – Keynote Address,"Ali R. Hurson,    Yu Jiao",2005,https://link.springer.com/chapter/10.1007/11533962_1,https://link.springer.com/content/pdf/10.1007%2F11533962_1.pdf,,,1,1,https://doi.org/10.1007/11533962_1
"Implementation and Analysis of FMIPv6, an Enhancement of MIPv6","Johan Pieterse,    Riaan Wolhuter,    Nathalie Mitton",2013,https://link.springer.com/chapter/10.1007/978-3-642-36958-2_24,No PDF available,,,1,No cite count available,https://doi.org/10.1007/978-3-642-36958-2_24
Planetary System,"G. Burkhardt,    U. Esser,    H. Hefele,    I. Heinrich,    W. Hofmann…",1990,https://link.springer.com/chapter/10.1007/978-3-662-12370-6_12,No PDF available,,,1,No cite count available,https://doi.org/10.1007/978-3-662-12370-6_12
Common Complications of Haemodialysis,"Daljit K. Hothi MBBS, MRCPCH, MD,    Elizabeth Harvey MD, FRCPC",2012,https://link.springer.com/chapter/10.1007/978-1-4614-0721-8_21,No PDF available,,,1,No cite count available,https://doi.org/10.1007/978-1-4614-0721-8_21
Providing Transactional Properties for Migrating Workflows,"Andrzej Cichocki,    Marek Rusinkiewicz",2004,https://link.springer.com/article/10.1023/B%3AMONE.0000034701.73879.cf,https://link.springer.com/content/pdf/10.1023%2FB%3AMONE.0000034701.73879.cf.pdf,,,1,8,https://doi.org/10.1023/B:MONE.0000034701.73879.cf
Fault detection and recovery scheme for routing and lifetime enhancement in WSN,"M. Yuvaraja,    M. Sabrigiriraj",2017,https://link.springer.com/article/10.1007/s11276-015-1141-7,https://link.springer.com/content/pdf/10.1007%2Fs11276-015-1141-7.pdf,,,1,3,https://doi.org/10.1007/s11276-015-1141-7
An Agent-Based Collaborative Framework for Mobile P2P Applications,"Mengqiu Wang,    Heiko Wolf,    Martin Purvis,    Maryam Purvis",2006,https://link.springer.com/chapter/10.1007/11925941_11,No PDF available,,,1,No cite count available,https://doi.org/10.1007/11925941_11
A Smart Meter and Smart House Integrated to an IdM and Key-based Scheme for Providing Integral Security for a Smart Grid ICT,"Vilmar Abreu,    Altair Santin,    Alex Xavier,    Alison Lando…",2018,https://link.springer.com/article/10.1007/s11036-017-0960-4,https://link.springer.com/content/pdf/10.1007%2Fs11036-017-0960-4.pdf,,,1,No cite count available,https://doi.org/10.1007/s11036-017-0960-4
Middleware for Context Management Based on Context Domains,Ricardo Couto Antunes da Rocha…,2012,https://link.springer.com/chapter/10.1007/978-1-4471-4020-7_6,No PDF available,,,1,No cite count available,https://doi.org/10.1007/978-1-4471-4020-7_6
Prefix Delegation Based Route Optimisation in Cooperative Ad Hoc Interconnected Mobile Networks,"Rehan Qureshi,    Arek Dadej",2013,https://link.springer.com/chapter/10.1007/978-3-642-36958-2_21,No PDF available,,,1,No cite count available,https://doi.org/10.1007/978-3-642-36958-2_21
An MDE Approach to Develop Mobile-Agents Applications,"Tahar Gherbi,    Isabelle Borne,    Djamel Meslati",2013,https://link.springer.com/chapter/10.1007/978-3-642-54092-9_5,No PDF available,,,1,No cite count available,https://doi.org/10.1007/978-3-642-54092-9_5
A Hybrid Visual Dataflow Language for Coordination in Mobile Ad Hoc Networks,"Andoni Lombide Carreton,    Theo D’Hondt",2010,https://link.springer.com/chapter/10.1007/978-3-642-13414-2_6,https://link.springer.com/content/pdf/10.1007%2F978-3-642-13414-2_6.pdf,,,1,1,https://doi.org/10.1007/978-3-642-13414-2_6
Service Control Layer (SCL): Enabling Rule-based Control and Enrichment in Next-Generation Telecom Service Delivery,"Nilanjan Banerjee,    Seema Nagar…",2013,https://link.springer.com/article/10.1007/s10922-011-9223-z,https://link.springer.com/content/pdf/10.1007%2Fs10922-011-9223-z.pdf,,,1,1,https://doi.org/10.1007/s10922-011-9223-z
Supporting Generalized Context Interactions,"Gregory Hackmann,    Christine Julien,    Jamie Payton…",2005,https://link.springer.com/chapter/10.1007/11407386_8,https://link.springer.com/content/pdf/10.1007%2F11407386_8.pdf,,,1,1,https://doi.org/10.1007/11407386_8
FLASCHE – A Mechanism Providing Anonymity for Mobile Users,Alf Zugenmaier,2005,https://link.springer.com/chapter/10.1007/11423409_9,https://link.springer.com/content/pdf/10.1007%2F11423409_9.pdf,,,1,No cite count available,https://doi.org/10.1007/11423409_9
The Mortification of the Self: Erving Goffman’s Analysis of the Mental Hospital,Donald Capps,2016,https://link.springer.com/article/10.1007/s11089-015-0665-1,https://link.springer.com/content/pdf/10.1007%2Fs11089-015-0665-1.pdf,,,1,1,https://doi.org/10.1007/s11089-015-0665-1
A Method of Constructing Personal Network for Ubiquitous Personal Services,"Kazumasa Takami,    Hajime Kusu,    Akira Ikeda",2008,https://link.springer.com/chapter/10.1007/978-3-540-85500-2_29,No PDF available,,,1,No cite count available,https://doi.org/10.1007/978-3-540-85500-2_29
A similarity-based protocol for concurrency control in mobile distributed real-time database systems,"Kam-yiu Lam,    Tei-Wei Kuo,    Gary C. K. Law…",1999,https://link.springer.com/chapter/10.1007/BFb0097915,No PDF available,,,1,1,https://doi.org/10.1007/BFb0097915
"One Nation, disconnected party: The evocation of One Nation aimed to unite the nation, instead it highlighted the Labour party’s divisions",Dimitri Batrouni,2017,https://link.springer.com/article/10.1057/s41293-017-0054-8,No PDF available,,,1,No cite count available,https://doi.org/10.1057/s41293-017-0054-8
A Consistent Checkpointing-Recovery Protocol for Minimal Number of Nodes in Mobile Computing System,"Chandreyee Chowdhury,    Sarmistha Neogy",2007,https://link.springer.com/chapter/10.1007/978-3-540-77220-0_54,No PDF available,,,1,2,https://doi.org/10.1007/978-3-540-77220-0_54
Couples Dance/Movement Therapy: Bringing a Theoretical Framework into Practice,"Dee Wagner,    Stacey McGinn Hurst",2018,https://link.springer.com/article/10.1007/s10465-018-9271-y,https://link.springer.com/content/pdf/10.1007%2Fs10465-018-9271-y.pdf,,,1,No cite count available,https://doi.org/10.1007/s10465-018-9271-y
Epidemic Collaborative Geocast for Reliable Segmented File Sharing in Mobile Peer-to-Peer Devices,"Constandinos X. Mavromoustakis,    Helen D. Karatza",2005,https://link.springer.com/chapter/10.1007/11573036_20,https://link.springer.com/content/pdf/10.1007%2F11573036_20.pdf,,,1,No cite count available,https://doi.org/10.1007/11573036_20
Vehicular Networks and Applications,"Aline Senart,    Mélanie Bouroche,    Vinny Cahill…",2009,https://link.springer.com/chapter/10.1007/978-3-540-89707-1_17,No PDF available,,,1,6,https://doi.org/10.1007/978-3-540-89707-1_17
Mechanical Machine Components,"W. Beitz,    H. Mertens,    J. Ruge,    K.-A. Ebert…",1994,https://link.springer.com/chapter/10.1007/978-1-4471-3566-1_6,No PDF available,,,1,No cite count available,https://doi.org/10.1007/978-1-4471-3566-1_6
An Architectural Pattern for Mobile Groupware Platforms,"Andrés Neyem,    Sergio F. Ochoa,    José A. Pino…",2009,https://link.springer.com/chapter/10.1007/978-3-642-05290-3_52,No PDF available,,,1,1,https://doi.org/10.1007/978-3-642-05290-3_52
Abstract withdrawn,No author available,2001,https://link.springer.com/article/10.1186/cc3869,https://link.springer.com/content/pdf/10.1186%2Fcc3869.pdf,,,1,No cite count available,https://doi.org/10.1186/cc3869
Design for Low Power Systems,Abderazek Ben Abdallah,2010,https://link.springer.com/chapter/10.2991/978-94-91216-33-6_2,No PDF available,,,1,No cite count available,https://doi.org/10.2991/978-94-91216-33-6_2
Toward Efficient Packet Buffering and Congestion Control Approaches for Reliable Data Delivery in Mobile Ad Hoc Network,"Mohammad Mehedi Hassan,    Atif Alamri…",2013,https://link.springer.com/chapter/10.1007/978-3-642-41428-2_6,No PDF available,,,1,1,https://doi.org/10.1007/978-3-642-41428-2_6
Replication Requirements in Mobile Environments,"David Ratner,    Peter Reiher,    Gerald J. Popek…",2001,https://link.springer.com/article/10.1023/A%3A1011862121702,https://link.springer.com/content/pdf/10.1023%2FA%3A1011862121702.pdf,,,1,17,https://doi.org/10.1023/A:1011862121702
Distributed Object-Oriented Programming with RFID Technology,"Andoni Lombide Carreton,    Kevin Pinte…",2010,https://link.springer.com/chapter/10.1007/978-3-642-13645-0_5,https://link.springer.com/content/pdf/10.1007%2F978-3-642-13645-0_5.pdf,,,1,1,https://doi.org/10.1007/978-3-642-13645-0_5
Heterogeneous networking,"Amandeep Singh,    Gaston Ormazábal…",2014,https://link.springer.com/article/10.1007/s11623-014-0007-y,https://link.springer.com/content/pdf/10.1007%2Fs11623-014-0007-y.pdf,,,1,2,https://doi.org/10.1007/s11623-014-0007-y
The Dictionary,Stuart Sutherland,1991,https://link.springer.com/chapter/10.1007/978-1-349-12428-2_1,No PDF available,,,1,No cite count available,https://doi.org/10.1007/978-1-349-12428-2_1
Wireless ATM Technology: Present Status and Future Directions,Dipankar Raychaudhuri,1997,https://link.springer.com/chapter/10.1007/978-1-4757-2604-6_9,No PDF available,,,1,No cite count available,https://doi.org/10.1007/978-1-4757-2604-6_9
Various Injuries,"Sébastien Gnecchi,    François Moutet",2015,https://link.springer.com/chapter/10.1007/978-3-319-16790-9_3,No PDF available,,,1,No cite count available,https://doi.org/10.1007/978-3-319-16790-9_3
Minimizing Congestion in Mobile Ad hoc Network Using Adaptive Control Packet Frequency and Data Rate,"Navneet Kaur,    Rakesh Singhai",2019,https://link.springer.com/chapter/10.1007/978-981-13-1513-8_30,No PDF available,,,1,No cite count available,https://doi.org/10.1007/978-981-13-1513-8_30
PCSM: an efficient multihop proximity aware clustering scheme for mobile peer-to-peer systems,"Moufida Rahmani,    Mahfoud Benchaïba",2018,https://link.springer.com/article/10.1007/s12652-018-0808-1,https://link.springer.com/content/pdf/10.1007%2Fs12652-018-0808-1.pdf,,,1,No cite count available,https://doi.org/10.1007/s12652-018-0808-1
"‘Let’s Go for a Ride, Otis’: Serial Killers in the Highway Horror Film",Bernice M. Murphy,2014,https://link.springer.com/chapter/10.1057/9781137391209_4,No PDF available,,,1,No cite count available,https://doi.org/10.1057/9781137391209_4
Oral Presentations,No author available,2011,https://link.springer.com/article/10.1007/s00192-011-1434-z,https://link.springer.com/content/pdf/10.1007%2Fs00192-011-1434-z.pdf,,,1,No cite count available,https://doi.org/10.1007/s00192-011-1434-z
Location Service Protocol for Highly Mobile Ad Hoc Network,"Salim M. Zaki,    M. A. Ngadi,    Shukor Abd Razak",2014,https://link.springer.com/article/10.1007/s13369-013-0651-9,https://link.springer.com/content/pdf/10.1007%2Fs13369-013-0651-9.pdf,,,1,5,https://doi.org/10.1007/s13369-013-0651-9
Using OpenFlow to provide cut-through switching in MobilityFirst,"Adrian Lara,    Byrav Ramamurthy,    Kiran Nagaraja…",2014,https://link.springer.com/article/10.1007/s11107-014-0461-3,https://link.springer.com/content/pdf/10.1007%2Fs11107-014-0461-3.pdf,,,1,2,https://doi.org/10.1007/s11107-014-0461-3
"‘Let’s Go for a Ride, Otis’: Serial Killers in the Highway Horror Film",Bernice M. Murphy,2014,https://link.springer.com/chapter/10.1007/978-1-137-39120-9_4,No PDF available,,,1,No cite count available,https://doi.org/10.1007/978-1-137-39120-9_4
Staging Justice: Courtroom Semiotics and the Judicial Ideology in China,Biyu Du,2016,https://link.springer.com/article/10.1007/s11196-015-9444-7,https://link.springer.com/content/pdf/10.1007%2Fs11196-015-9444-7.pdf,,,1,2,https://doi.org/10.1007/s11196-015-9444-7
Pervasive Accounting of Resource Consumption for Wireless Services with Adaptive QoS,"Paolo Bellavista,    Antonio Corradi…",2003,https://link.springer.com/chapter/10.1007/978-3-540-39404-4_12,https://link.springer.com/content/pdf/10.1007%2F978-3-540-39404-4_12.pdf,,,1,No cite count available,https://doi.org/10.1007/978-3-540-39404-4_12
Treatment of Parkinson's disease,No author available,2003,https://link.springer.com/article/10.1007/s100720300068,https://link.springer.com/content/pdf/10.1007%2Fs100720300068.pdf,,,1,No cite count available,https://doi.org/10.1007/s100720300068
Complete computing,"Vipul Gupta,    Gabriel Montenegro…",1998,https://link.springer.com/chapter/10.1007/3-540-64216-1_48,No PDF available,,,1,1,https://doi.org/10.1007/3-540-64216-1_48
In-Depth Oral Presentations and Oral Communications,No author available,2012,https://link.springer.com/article/10.1007/s10195-012-0209-8,https://link.springer.com/content/pdf/10.1007%2Fs10195-012-0209-8.pdf,,,1,1,https://doi.org/10.1007/s10195-012-0209-8
An Efficient Handoff Mechanism with Reduced Latency in Hierarchical Mobile IPv6,"Jae-Myung Jang,    Dong-Hee Kwon,    Young-Joo Suh",2004,https://link.springer.com/chapter/10.1007/978-3-540-25978-7_19,No PDF available,,,1,No cite count available,https://doi.org/10.1007/978-3-540-25978-7_19
DAPHNE: A Disruption-Tolerant Application Proxy for e-Health Network Environments,Emmanouil G. Spanakis…,2013,https://link.springer.com/chapter/10.1007/978-3-642-37893-5_10,No PDF available,,,1,2,https://doi.org/10.1007/978-3-642-37893-5_10
"CIRSE ’99 Annual Meeting and Postgraduate Course of the Cardiovascular and Interventional Radiological Society of Europe and joint meeting with the European Society of Cardiac Radiology (ESCR) Prague, Czech Republic September 26–30, 1999",No author available,1999,https://link.springer.com/article/10.1007/BF03036417,https://link.springer.com/content/pdf/10.1007%2FBF03036417.pdf,,,1,No cite count available,https://doi.org/10.1007/BF03036417
Dynamic backoff scheduling of low data rate applications in wireless body area networks,"Nesae Mouzehkesh,    Tanveer Zia,    Saman Shafigh,    Lihong Zheng",2015,https://link.springer.com/article/10.1007/s11276-015-0929-9,https://link.springer.com/content/pdf/10.1007%2Fs11276-015-0929-9.pdf,,,1,6,https://doi.org/10.1007/s11276-015-0929-9
Design of Peer State Acquisition Mechanism for Efficient Dynamic HA Allocation at Diameter-Based AAA Server,"Hae Dong Lee,    Byung Gil Lee,    Hyung Gon Kim",2003,https://link.springer.com/chapter/10.1007/3-540-36555-9_42,No PDF available,,,1,No cite count available,https://doi.org/10.1007/3-540-36555-9_42
Artificial Intelligence Methods in Early Childhood Education,Jim Prentzas,2013,https://link.springer.com/chapter/10.1007/978-3-642-29694-9_8,No PDF available,,,1,1,https://doi.org/10.1007/978-3-642-29694-9_8
A Dual-Token-Based Fault Tolerant Mutual Exclusion Algorithm for MANETs,"Weigang Wu,    Jiannong Cao,    Michel Raynal",2007,https://link.springer.com/chapter/10.1007/978-3-540-77024-4_52,No PDF available,,,1,4,https://doi.org/10.1007/978-3-540-77024-4_52
Support for Real-Time Decision Making in Mobile Financial Applications,"Frada Burstein,    Julie Cowie,    Arkady Zaslavsky…",2008,https://link.springer.com/chapter/10.1007/978-3-540-48716-6_5,No PDF available,,,1,1,https://doi.org/10.1007/978-3-540-48716-6_5
A novel learning based solution for efficient data transport in heterogeneous wireless networks,"Venkataramana Badarla,    C. Siva Ram Murthy",2010,https://link.springer.com/article/10.1007/s11276-009-0228-4,https://link.springer.com/content/pdf/10.1007%2Fs11276-009-0228-4.pdf,,,1,No cite count available,https://doi.org/10.1007/s11276-009-0228-4
Psychoanalytic Approaches,Donald K. Fromme,2011,https://link.springer.com/chapter/10.1007/978-1-4419-7308-5_6,No PDF available,,,1,No cite count available,https://doi.org/10.1007/978-1-4419-7308-5_6
Chasing Fools Gold: African Americans and the Party of Lincoln,Louis G. Prisock,2018,https://link.springer.com/chapter/10.1007/978-3-319-89351-8_6,https://link.springer.com/content/pdf/10.1007%2F978-3-319-89351-8_6.pdf,,,1,No cite count available,https://doi.org/10.1007/978-3-319-89351-8_6
Advanced Semiconductor Processing Technology,"Tomonori Ishikawa,    Yoshifumi Katayama",1994,https://link.springer.com/chapter/10.1007/978-1-4615-2686-5_4,No PDF available,,,1,No cite count available,https://doi.org/10.1007/978-1-4615-2686-5_4
Mesh Design: Network Issues,"Parth H. Pathak,    Rudra Dutta",2013,https://link.springer.com/chapter/10.1007/978-1-4614-4627-9_4,No PDF available,,,1,No cite count available,https://doi.org/10.1007/978-1-4614-4627-9_4
A Distributed Architecture for Massively Multiplayer Online Services with Peer-to-Peer Support,"Keiichi Endo,    Minoru Kawahara…",2007,https://link.springer.com/chapter/10.1007/978-0-387-49690-0_12,https://link.springer.com/content/pdf/10.1007%2F978-0-387-49690-0_12.pdf,,,1,No cite count available,https://doi.org/10.1007/978-0-387-49690-0_12
Tomkins and Literature: A Hermeneutical Model,Duncan A. Lucas,2018,https://link.springer.com/chapter/10.1007/978-3-319-94863-8_2,No PDF available,,,1,No cite count available,https://doi.org/10.1007/978-3-319-94863-8_2
Integration of Immigrants: The Role of Ethnic Churches,Wing Yin Tsang,2015,https://link.springer.com/article/10.1007/s12134-014-0380-2,https://link.springer.com/content/pdf/10.1007%2Fs12134-014-0380-2.pdf,,,1,1,https://doi.org/10.1007/s12134-014-0380-2
Unorthodox Concepts,Hans W. Gschwind,1967,https://link.springer.com/chapter/10.1007/978-3-662-38101-4_9,No PDF available,,,1,No cite count available,https://doi.org/10.1007/978-3-662-38101-4_9
Security Aspects and Principles,Göran Schultz,2011,https://link.springer.com/chapter/10.1007/978-90-481-9346-2_6,No PDF available,,,1,1,https://doi.org/10.1007/978-90-481-9346-2_6
Unorthodox Concepts,Hans W. Gschwind,1967,https://link.springer.com/chapter/10.1007/978-3-7091-3369-9_9,No PDF available,,,1,No cite count available,https://doi.org/10.1007/978-3-7091-3369-9_9
Context-Aware Application System for Music Playing Services,"Jae-Woo Chang,    Yong-Ki Kim",2006,https://link.springer.com/chapter/10.1007/11893011_10,No PDF available,,,1,No cite count available,https://doi.org/10.1007/11893011_10
Network architecture and communication protocols for mobile computing,"Kevin Brown,    Suresh Singh",1996,https://link.springer.com/article/10.1007/BF02109337,https://link.springer.com/content/pdf/10.1007%2FBF02109337.pdf,,,1,No cite count available,https://doi.org/10.1007/BF02109337
Challenges in Ubiquitous Data Management,Michael J. Franklin,2001,https://link.springer.com/chapter/10.1007/3-540-44577-3_2,No PDF available,,,1,8,https://doi.org/10.1007/3-540-44577-3_2
Context-Aware Environments for the Internet of Things,"Valentin Cristea,    Ciprian Dobre,    Florin Pop",2013,https://link.springer.com/chapter/10.1007/978-3-642-34952-2_2,No PDF available,,,1,12,https://doi.org/10.1007/978-3-642-34952-2_2
Towards a cooperative security system for mobile-health applications,"Bruno M. C. Silva,    Joel J. P. C. Rodrigues,    Fábio Canelo…",2014,https://link.springer.com/article/10.1007/s10660-014-9154-3,https://link.springer.com/content/pdf/10.1007%2Fs10660-014-9154-3.pdf,,,1,No cite count available,https://doi.org/10.1007/s10660-014-9154-3
Towards a cooperative security system for mobile-health applications,"Bruno M. C. Silva,    Joel J. P. C. Rodrigues,    Fábio Canelo…",2014,https://link.springer.com/article/10.1007/s10660-014-9171-2,https://link.springer.com/content/pdf/10.1007%2Fs10660-014-9171-2.pdf,,,1,3,https://doi.org/10.1007/s10660-014-9171-2
E-Commerce Based on Agent Technology,Yu Zhang,2012,https://link.springer.com/chapter/10.1007/978-3-642-25437-6_92,No PDF available,,,1,No cite count available,https://doi.org/10.1007/978-3-642-25437-6_92
Security Architecture for Satellite Services over Cryptographically Heterogeneous Networks,"Yingli Sheng,    Haitham Cruickshank,    Martin Moseley…",2013,https://link.springer.com/chapter/10.1007/978-3-319-02762-3_9,No PDF available,,,1,No cite count available,https://doi.org/10.1007/978-3-319-02762-3_9
MoCoA: Customisable Middleware for Context-Aware Mobile Applications,"Aline Senart,    Raymond Cunningham…",2006,https://link.springer.com/chapter/10.1007/11914952_47,No PDF available,,,1,6,https://doi.org/10.1007/11914952_47
Energy Conservation,"Robin Kravets,    Cigdem Sengul",2005,https://link.springer.com/chapter/10.1007/0-387-22690-7_6,https://link.springer.com/content/pdf/10.1007%2F0-387-22690-7_6.pdf,,,1,No cite count available,https://doi.org/10.1007/0-387-22690-7_6
Service Discovery Protocol Interoperability in the Mobile Environment,"Yérom-David Bromberg,    Valérie Issarny",2005,https://link.springer.com/chapter/10.1007/11407386_6,https://link.springer.com/content/pdf/10.1007%2F11407386_6.pdf,,,1,1,https://doi.org/10.1007/11407386_6
Path Observation Based Physical Routing Protocol for Wireless Ad Hoc Networks,"M. Rajesh,    J. M. Gnanasekar",2017,https://link.springer.com/article/10.1007/s11277-017-4565-9,https://link.springer.com/content/pdf/10.1007%2Fs11277-017-4565-9.pdf,,,1,No cite count available,https://doi.org/10.1007/s11277-017-4565-9
An Active Database Framework for Adaptive Mobile Data Access,"Shiow-yang Wu,    Chun-Shun Chang",1999,https://link.springer.com/chapter/10.1007/978-3-540-49121-7_29,No PDF available,,,1,No cite count available,https://doi.org/10.1007/978-3-540-49121-7_29
Supporting autonomous work and reintegration in collaborative systems,"Michael Berger,    Alexander Schill…",1998,https://link.springer.com/chapter/10.1007/BFb0027106,No PDF available,,,1,No cite count available,https://doi.org/10.1007/BFb0027106
Mobile Cloud Media Computing Applications: A Survey,"S. Durga,    Mohan S.",2013,https://link.springer.com/chapter/10.1007/978-81-322-1000-9_57,No PDF available,,,1,1,https://doi.org/10.1007/978-81-322-1000-9_57
"E-Governance for Public Realm: Around Panniyankara Monorail Station, Kozhikode, Kerala","T.M. Vinod Kumar,    P. Bimal",2015,https://link.springer.com/chapter/10.1007/978-981-287-287-6_5,https://link.springer.com/content/pdf/10.1007%2F978-981-287-287-6_5.pdf,,,1,No cite count available,https://doi.org/10.1007/978-981-287-287-6_5
Performance assessment of fragmentation mechanisms for vehicular delay-tolerant networks,"João A. F. F. Dias,    Joel J. P. C. Rodrigues…",2011,https://link.springer.com/article/10.1186/1687-1499-2011-195,https://link.springer.com/content/pdf/10.1186%2F1687-1499-2011-195.pdf,,,1,5,https://doi.org/10.1186/1687-1499-2011-195
Vertical Handover Decision Algorithm for Multimedia Streaming in VANET,"Mustafa Ali Hassoune,    Zoulikha Mekkakia Maaza…",2017,https://link.springer.com/article/10.1007/s11277-017-4080-z,https://link.springer.com/content/pdf/10.1007%2Fs11277-017-4080-z.pdf,,,1,1,https://doi.org/10.1007/s11277-017-4080-z
Impacts of Plug-in Electric Vehicles Integration in Distribution Networks Under Different Charging Strategies,"Filipe J. Soares,    Pedro N. P. Barbeiro…",2015,https://link.springer.com/chapter/10.1007/978-981-287-317-0_4,https://link.springer.com/content/pdf/10.1007%2F978-981-287-317-0_4.pdf,,,1,No cite count available,https://doi.org/10.1007/978-981-287-317-0_4
Abstracts,No author available,2013,https://link.springer.com/article/10.1007/s12031-012-9923-1,https://link.springer.com/content/pdf/10.1007%2Fs12031-012-9923-1.pdf,,,1,1,https://doi.org/10.1007/s12031-012-9923-1
PERA: Priority-Based Energy-Efficient Routing Algorithm for WBANs,"Gulnaz Ahmed,    Zou Jianhua,    Mian Muhammad Sadiq Fareed",2017,https://link.springer.com/article/10.1007/s11277-017-4415-9,https://link.springer.com/content/pdf/10.1007%2Fs11277-017-4415-9.pdf,,,1,1,https://doi.org/10.1007/s11277-017-4415-9
A Caching Model for Real-Time Databases in Mobile Ad-Hoc Networks,"Yanhong Li,    Le Gruenwald",2005,https://link.springer.com/chapter/10.1007/11546924_19,https://link.springer.com/content/pdf/10.1007%2F11546924_19.pdf,,,1,3,https://doi.org/10.1007/11546924_19
"Pentecostalism, Prosperity, and Popular Cinema in Ghana",Birgit Meyer,2003,https://link.springer.com/chapter/10.1007/978-1-137-10034-4_7,No PDF available,,,1,No cite count available,https://doi.org/10.1007/978-1-137-10034-4_7
Agent Platform and Communication Architecture,"Heikki Helin,    Ahti Syreeni",2008,https://link.springer.com/chapter/10.1007/978-3-7643-8575-0_8,No PDF available,,,1,No cite count available,https://doi.org/10.1007/978-3-7643-8575-0_8
Cancer-Induced Bone Pain Management Through Buddhist Beliefs,Fung Kei Cheng,2017,https://link.springer.com/article/10.1007/s10943-017-0401-5,https://link.springer.com/content/pdf/10.1007%2Fs10943-017-0401-5.pdf,,,1,No cite count available,https://doi.org/10.1007/s10943-017-0401-5
