title,author,date,link,pdf_link,query,search_engine,nr_found,cite_count,doi
Secure Service Provision in Ad Hoc Networks,"Radu Handorean,    Gruia-Catalin Roman",2003,https://link.springer.com/chapter/10.1007/978-3-540-24593-3_25,No PDF available,,,1,No cite count available,https://doi.org/10.1007/978-3-540-24593-3_25
Internetworking between HIPERLAN/2 and UMTS,"Kwang-Cheng Chen,    Chun-Ying Wu",2003,https://link.springer.com/article/10.1023/A%3A1025578520231,https://link.springer.com/content/pdf/10.1023%2FA%3A1025578520231.pdf,,,1,6,https://doi.org/10.1023/A:1025578520231
Context-based wireless mesh networks: a case for network virtualization,"Ricardo Matos,    Susana Sargento,    Karin Anna Hummel,    Andrea Hess…",2012,https://link.springer.com/article/10.1007/s11235-011-9434-3,https://link.springer.com/content/pdf/10.1007%2Fs11235-011-9434-3.pdf,,,1,13,https://doi.org/10.1007/s11235-011-9434-3
Intersection-Based Routing Protocol for VANETs,"Li-Der Chou,    Jyun-Yan Yang,    Ying-Cheng Hsieh…",2011,https://link.springer.com/article/10.1007/s11277-011-0257-z,https://link.springer.com/content/pdf/10.1007%2Fs11277-011-0257-z.pdf,,,1,36,https://doi.org/10.1007/s11277-011-0257-z
A Multi-service and Multi-protocol Validation Platform – Experimentation Results,"Ana Cavalli,    Amel Mederreg,    Fatiha Zaïdi,    Pierre Combes…",2004,https://link.springer.com/chapter/10.1007/978-3-540-24704-3_2,https://link.springer.com/content/pdf/10.1007%2F978-3-540-24704-3_2.pdf,,,1,No cite count available,https://doi.org/10.1007/978-3-540-24704-3_2
Defining Scope of Query for Location-Dependent Information Services,"James Jayaputera,    David Taniar",2004,https://link.springer.com/chapter/10.1007/978-3-540-30121-9_35,No PDF available,,,1,No cite count available,https://doi.org/10.1007/978-3-540-30121-9_35
Efficient Binding Lifetime Determination Schemes in HMIPv6,"Sun Ok Yang,    SungSuk Kim,    Chong-Sun Hwang",2005,https://link.springer.com/chapter/10.1007/11604655_3,https://link.springer.com/content/pdf/10.1007%2F11604655_3.pdf,,,1,No cite count available,https://doi.org/10.1007/11604655_3
Autonomic communication services: a new challenge for software agents,"Raffaele Quitadamo,    Franco Zambonelli",2008,https://link.springer.com/article/10.1007/s10458-008-9054-9,https://link.springer.com/content/pdf/10.1007%2Fs10458-008-9054-9.pdf,,,1,12,https://doi.org/10.1007/s10458-008-9054-9
Advanced Collaborative Business Ict Infrastructures,Ricardo J. Rabelo,2008,https://link.springer.com/chapter/10.1007/978-0-387-79424-2_14,No PDF available,,,1,14,https://doi.org/10.1007/978-0-387-79424-2_14
"Protocol support for optimized, context sensitive request/response communication over connection oriented networks",Sascha Kümmel…,1997,https://link.springer.com/chapter/10.1007/978-0-387-35188-9_11,No PDF available,,,1,No cite count available,https://doi.org/10.1007/978-0-387-35188-9_11
Semantics for Delay-Tolerant Network (DTN),Priyanka Rathee,2018,https://link.springer.com/chapter/10.1007/978-981-13-0396-8_6,https://link.springer.com/content/pdf/10.1007%2F978-981-13-0396-8_6.pdf,,,1,No cite count available,https://doi.org/10.1007/978-981-13-0396-8_6
The role of interspace in sustaining identity,"Michael Hulme,    Anna Truch",2006,https://link.springer.com/article/10.1007/s12130-006-1014-6,https://link.springer.com/content/pdf/10.1007%2Fs12130-006-1014-6.pdf,,,1,4,https://doi.org/10.1007/s12130-006-1014-6
Supporting Generalized Context Interactions,"Gregory Hackmann,    Christine Julien,    Jamie Payton…",2005,https://link.springer.com/chapter/10.1007/11407386_8,https://link.springer.com/content/pdf/10.1007%2F11407386_8.pdf,,,1,1,https://doi.org/10.1007/11407386_8
Design and Emulation of Integration Framework for Heterogeneous Wireless PAN Networks,"In-Yeup Kong,    Won-Joo Hwang",2006,https://link.springer.com/chapter/10.1007/11890348_28,No PDF available,,,1,No cite count available,https://doi.org/10.1007/11890348_28
MobileJMS: une solution globale d’adaptation des applications nomades,"Mejdi Kaddour,    Laurent Pautet",2007,https://link.springer.com/article/10.1007/BF03253270,https://link.springer.com/content/pdf/10.1007%2FBF03253270.pdf,,,1,No cite count available,https://doi.org/10.1007/BF03253270
Network Swapping,"Emanuele Lattanzi,    Andrea Acquaviva…",2005,https://link.springer.com/chapter/10.1007/11419822_7,https://link.springer.com/content/pdf/10.1007%2F11419822_7.pdf,,,1,No cite count available,https://doi.org/10.1007/11419822_7
Cloud Computing Technology as an Auto Filtration System for Cost Reduction While Roaming,"S. Biswas,    A. Mukherjee,    M. Roy Chowdhury…",2017,https://link.springer.com/chapter/10.1007/978-981-10-3156-4_45,https://link.springer.com/content/pdf/10.1007%2F978-981-10-3156-4_45.pdf,,,1,No cite count available,https://doi.org/10.1007/978-981-10-3156-4_45
P,Dipl.-Ing. Vittorio Ferretti,2000,https://link.springer.com/chapter/10.1007/978-3-642-98090-9_16,No PDF available,,,1,No cite count available,https://doi.org/10.1007/978-3-642-98090-9_16
Mechanisms for environments in multi-agent systems: Survey and opportunities,"Eric Platon,    Marco Mamei,    Nicolas Sabouret…",2007,https://link.springer.com/article/10.1007/s10458-006-9000-7,https://link.springer.com/content/pdf/10.1007%2Fs10458-006-9000-7.pdf,,,1,21,https://doi.org/10.1007/s10458-006-9000-7
VANETs QoS-based routing protocols based on multi-constrained ability to support ITS infotainment services,"Michael Oche,    Abubakar Bello Tambuwal,    Christopher Chemebe…",2018,https://link.springer.com/article/10.1007/s11276-018-1860-7,https://link.springer.com/content/pdf/10.1007%2Fs11276-018-1860-7.pdf,,,1,No cite count available,https://doi.org/10.1007/s11276-018-1860-7
Exploiting Delay Patterns for User IPs Identification in Cellular Networks,"Vasile Claudiu Perta,    Marco Valerio Barbera…",2014,https://link.springer.com/chapter/10.1007/978-3-319-08506-7_12,No PDF available,,,1,2,https://doi.org/10.1007/978-3-319-08506-7_12
Partially Ordered Knowledge Sharing and Fractionated Systems in the Context of other Models for Distributed Computing,"Mark-Oliver Stehr,    Minyoung Kim,    Carolyn Talcott",2014,https://link.springer.com/chapter/10.1007/978-3-642-54624-2_20,No PDF available,,,1,4,https://doi.org/10.1007/978-3-642-54624-2_20
A Cognitive Self-Organising Clustering Algorithm for Urban Scenarios,"Victor Sucasas,    Firooz B. Saghezchi,    Ayman Radwan…",2016,https://link.springer.com/article/10.1007/s11277-016-3423-5,https://link.springer.com/content/pdf/10.1007%2Fs11277-016-3423-5.pdf,,,1,1,https://doi.org/10.1007/s11277-016-3423-5
Low Latency Handover Scheme Based on Optical Buffering at LMA in Proxy MIPv6 Networks,"Seungtak Oh,    Hyunseung Choo",2009,https://link.springer.com/chapter/10.1007/978-3-642-02457-3_41,No PDF available,,,1,4,https://doi.org/10.1007/978-3-642-02457-3_41
Dynamic Network Reconfiguration by Combination of Different Wireless LANs,"Yoshitaka Shibata,    Yosuke Sato,    Naoki Ogasawara…",2008,https://link.springer.com/chapter/10.1007/978-3-540-85693-1_5,No PDF available,,,1,No cite count available,https://doi.org/10.1007/978-3-540-85693-1_5
Manchester United Football Club: developing a Network Orchestration Model,Duncan R Shaw,2007,https://link.springer.com/article/10.1057/palgrave.ejis.3000702,No PDF available,,,1,11,https://doi.org/10.1057/palgrave.ejis.3000702
Parallel Concurrency Control Activity for Transaction Management in Real-time Database Systems,Subhash Bhalla,2004,https://link.springer.com/article/10.1023/B%3ASUPE.0000022104.97567.23,https://link.springer.com/content/pdf/10.1023%2FB%3ASUPE.0000022104.97567.23.pdf,,,1,4,https://doi.org/10.1023/B:SUPE.0000022104.97567.23
Towards Dynamic and Cooperative Multi-device Personal Computing,"Spyros Lalis,    Anthony Savidis,    Alexandros Karypidis…",2007,https://link.springer.com/chapter/10.1007/978-3-540-72727-9_9,No PDF available,,,1,No cite count available,https://doi.org/10.1007/978-3-540-72727-9_9
Data Replication,Bettina Kemme,2009,https://link.springer.com/referenceworkentry/10.1007/978-0-387-39940-9_110,https://link.springer.com/content/pdf/10.1007%2F978-0-387-39940-9_110.pdf,,,1,No cite count available,https://doi.org/10.1007/978-0-387-39940-9
Infrastructure Development in Nairobi: Widening the Path Towards a Smart City and Smart Economic Development,Dennis Mwaniki,2017,https://link.springer.com/chapter/10.1007/978-981-10-1610-3_25,https://link.springer.com/content/pdf/10.1007%2F978-981-10-1610-3_25.pdf,,,1,No cite count available,https://doi.org/10.1007/978-981-10-1610-3_25
Oasis: an architecture for simplified data management and disconnected operation,"Maya Rodrig,    Anthony LaMarca",2005,https://link.springer.com/article/10.1007/s00779-004-0315-6,https://link.springer.com/content/pdf/10.1007%2Fs00779-004-0315-6.pdf,,,1,1,https://doi.org/10.1007/s00779-004-0315-6
Policy Distribution Using the Publish/Subscribe Paradigm for Managing MANETs,"Vasilis Sourlas,    Paris Flegkas…",2008,https://link.springer.com/chapter/10.1007/978-3-540-87359-4_2,https://link.springer.com/content/pdf/10.1007%2F978-3-540-87359-4_2.pdf,,,1,2,https://doi.org/10.1007/978-3-540-87359-4_2
From Transit Systems to Models: Data Representation and Collection,"Klaus Noekel,    Guido Gentile…",2016,https://link.springer.com/chapter/10.1007/978-3-319-25082-3_5,https://link.springer.com/content/pdf/10.1007%2F978-3-319-25082-3_5.pdf,,,1,No cite count available,https://doi.org/10.1007/978-3-319-25082-3_5
Support for information sharing in CSCW based on causally and totally ordered group communication,Markus Kolland,1995,https://link.springer.com/chapter/10.1007/3-540-60042-6_5,https://link.springer.com/content/pdf/10.1007%2F3-540-60042-6_5.pdf,,,1,No cite count available,https://doi.org/10.1007/3-540-60042-6_5
Fault Tolerance Based on Neural Networks for the Intelligent Distributed Framework,"Michael Angelo G. Salvo,    Jaewan Lee,    Jung-sik Lee",2009,https://link.springer.com/chapter/10.1007/978-3-642-03156-4_9,No PDF available,,,1,No cite count available,https://doi.org/10.1007/978-3-642-03156-4_9
Is bigger better? The emergence of big data as a tool for international development policy,"Linnet Taylor,    Ralph Schroeder",2015,https://link.springer.com/article/10.1007/s10708-014-9603-5,https://link.springer.com/content/pdf/10.1007%2Fs10708-014-9603-5.pdf,,,1,17,https://doi.org/10.1007/s10708-014-9603-5
Data on air — What's in it for the database theorist,Tomasz Imielinski,1995,https://link.springer.com/chapter/10.1007/3-540-58907-4_1,https://link.springer.com/content/pdf/10.1007%2F3-540-58907-4_1.pdf,,,1,1,https://doi.org/10.1007/3-540-58907-4_1
Impact of ICT-enabled product and process innovations at the Bottom of the Pyramid: a market separations perspective,"Monideepa Tarafdar,    Ramendra Singh,    Prashanth Anekal",2013,https://link.springer.com/article/10.1057/jit.2013.21,No PDF available,,,1,7,https://doi.org/10.1057/jit.2013.21
Speech-Enabled Unified Communications: Overcoming the Multilingual Challenges of the European Market,"Detlev Artelt,    Hassan Sawaf",2013,https://link.springer.com/chapter/10.1007/978-1-4614-6934-6_4,No PDF available,,,1,No cite count available,https://doi.org/10.1007/978-1-4614-6934-6_4
Liberalisation of Telecommunications Services Markets and Regulation of Universal Service in the European Union,Olga Batura,2016,https://link.springer.com/chapter/10.1007/978-94-6265-081-7_4,No PDF available,,,1,No cite count available,https://doi.org/10.1007/978-94-6265-081-7_4
A survey and comparative study of QoS aware broadcasting techniques in VANET,"Abir Mchergui,    Tarek Moulahi,    Bechir Alaya,    Salem Nasri",2017,https://link.springer.com/article/10.1007/s11235-017-0280-9,https://link.springer.com/content/pdf/10.1007%2Fs11235-017-0280-9.pdf,,,1,1,https://doi.org/10.1007/s11235-017-0280-9
Pervasive Systems in Health Care,"Achilles Kameas,    Ioannis Calemis",2010,https://link.springer.com/chapter/10.1007/978-0-387-93808-0_12,No PDF available,,,1,6,https://doi.org/10.1007/978-0-387-93808-0_12
Editorial,No author available,2001,https://link.springer.com/article/10.1023/A%3A1016642920199,https://link.springer.com/content/pdf/10.1023%2FA%3A1016642920199.pdf,,,1,No cite count available,https://doi.org/10.1023/A:1016642920199
Storing and Accessing User Context,"Stéphanie Riché,    Gavin Brebner",2003,https://link.springer.com/chapter/10.1007/3-540-36389-0_1,No PDF available,,,1,2,https://doi.org/10.1007/3-540-36389-0_1
Broadcasting Information in Variably Dense Environment Using Connectionless Data Exchange (CoLDE),"Osama Abu Oun,    Wahabou Abdou,    Christelle Bloch…",2014,https://link.springer.com/chapter/10.1007/978-3-319-13174-0_22,No PDF available,,,1,1,https://doi.org/10.1007/978-3-319-13174-0_22
Integrated Social and QoS Trust-Based Routing in Delay Tolerant Networks,"Ing-Ray Chen,    Fenye Bao,    MoonJeong Chang,    Jin-Hee Cho",2012,https://link.springer.com/article/10.1007/s11277-011-0351-2,https://link.springer.com/content/pdf/10.1007%2Fs11277-011-0351-2.pdf,,,1,9,https://doi.org/10.1007/s11277-011-0351-2
Scientific Programme — Abstracts,No author available,2003,https://link.springer.com/article/10.1007/BF03323651,https://link.springer.com/content/pdf/10.1007%2FBF03323651.pdf,,,1,No cite count available,https://doi.org/10.1007/BF03323651
Survey on location information services for Vehicular Communication Networks,"Eghbal Heidari,    Alexander Gladisch,    Behzad Moshiri…",2014,https://link.springer.com/article/10.1007/s11276-013-0666-x,https://link.springer.com/content/pdf/10.1007%2Fs11276-013-0666-x.pdf,,,1,7,https://doi.org/10.1007/s11276-013-0666-x
Optimizing the End-to-End Performance of Reliable Flows over Wireless Links,"Reiner Ludwig,    Almudena Konrad,    Anthony D. Joseph,    Randy H. Katz",2002,https://link.springer.com/article/10.1023/A%3A1013750211660,https://link.springer.com/content/pdf/10.1023%2FA%3A1013750211660.pdf,,,1,14,https://doi.org/10.1023/A:1013750211660
"DDOR: Destination discovery oriented routing in highway/freeway VANETs+
","Pratap Kumar Sahu,    Eric Hsiao-Kuang Wu,    Jagruti Sahoo…",2012,https://link.springer.com/article/10.1007/s11235-010-9403-2,https://link.springer.com/content/pdf/10.1007%2Fs11235-010-9403-2.pdf,,,1,9,https://doi.org/10.1007/s11235-010-9403-2
Introducing consciousness in UWB networks by hybrid modelling of admission control,"Maria-Gabriella Di Benedetto,    Guerino Giancola…",2006,https://link.springer.com/article/10.1007/s11036-006-7198-x,https://link.springer.com/content/pdf/10.1007%2Fs11036-006-7198-x.pdf,,,1,3,https://doi.org/10.1007/s11036-006-7198-x
Efficient Agent Communication in Wireless Environments,"Heikki Helin,    Mikko Laukkanen",2005,https://link.springer.com/chapter/10.1007/3-7643-7348-2_13,No PDF available,,,1,No cite count available,https://doi.org/10.1007/3-7643-7348-2_13
Tele-care system by hoist-trolley robot arm from multi controllers and cellphone controller,"Akihiko Yagi,    M. Sakai,    K. Kashiwabara…",2007,https://link.springer.com/chapter/10.1007/978-3-540-36841-0_726,No PDF available,,,1,1,https://doi.org/10.1007/978-3-540-36841-0_726
Broadcasting and Prefetching Schemes for Location Dependent Information Services,"KwangJin Park,    MoonBae Song,    Chong-Sun Hwang",2005,https://link.springer.com/chapter/10.1007/11427865_3,https://link.springer.com/content/pdf/10.1007%2F11427865_3.pdf,,,1,No cite count available,https://doi.org/10.1007/11427865_3
Wireless Ad Hoc Multicast Routing with Mobility Prediction,"Sung-Ju Lee,    William Su,    Mario Gerla",2001,https://link.springer.com/article/10.1023/A%3A1011478628358,https://link.springer.com/content/pdf/10.1023%2FA%3A1011478628358.pdf,,,1,48,https://doi.org/10.1023/A:1011478628358
Collection and Object Synchronization Based on Context Information,"Sasu Tarkoma,    Tancred Lindholm…",2005,https://link.springer.com/chapter/10.1007/11569510_23,https://link.springer.com/content/pdf/10.1007%2F11569510_23.pdf,,,1,3,https://doi.org/10.1007/11569510_23
Adaptable Architectural Middleware for Programming-in-the-Small-and-Many,"Marija Mikic-Rakic,    Nenad Medvidovic",2003,https://link.springer.com/chapter/10.1007/3-540-44892-6_9,https://link.springer.com/content/pdf/10.1007%2F3-540-44892-6_9.pdf,,,1,2,https://doi.org/10.1007/3-540-44892-6_9
Interface of Industrial Policy and Competition Law in South Africa,Balthasar Strunz,2018,https://link.springer.com/chapter/10.1007/978-3-662-57627-4_6,No PDF available,,,1,No cite count available,https://doi.org/10.1007/978-3-662-57627-4_6
Information and Communications Technology,Hugh Compston,2006,https://link.springer.com/chapter/10.1057/9780230627437_2,No PDF available,,,1,No cite count available,https://doi.org/10.1057/9780230627437_2
We the people: The importance of employees in the process of building customer experience,Patrick Harris,2007,https://link.springer.com/article/10.1057/palgrave.bm.2550123,https://link.springer.com/content/pdf/10.1057%2Fpalgrave.bm.2550123.pdf,,,1,25,https://doi.org/10.1057/palgrave.bm.2550123
Power-Conserving Algorithms and Protocols in Ad Hoc Networks,"Hung Q. Ngo,    Dazhen Pan,    Vikas P. Verma",2004,https://link.springer.com/chapter/10.1007/978-1-4613-0223-0_11,No PDF available,,,1,1,https://doi.org/10.1007/978-1-4613-0223-0_11
Agent Substitution Mechanism for Dataflow Networks: Case Study and Implementation in Smart-M3,"Ilya Paramonov,    Andrey Vasilev,    Denis Laure…",2013,https://link.springer.com/chapter/10.1007/978-3-642-40316-3_6,No PDF available,,,1,5,https://doi.org/10.1007/978-3-642-40316-3_6
Introduction,"K. G. Srinivasa,    Anil Kumar Muppalla",2015,https://link.springer.com/chapter/10.1007/978-3-319-13497-0_1,https://link.springer.com/content/pdf/10.1007%2F978-3-319-13497-0_1.pdf,,,1,No cite count available,https://doi.org/10.1007/978-3-319-13497-0_1
An Infrastructure for CORBA Component Replication,"Vania Marangozova,    Daniel Hagimont",2002,https://link.springer.com/chapter/10.1007/3-540-45440-3_16,https://link.springer.com/content/pdf/10.1007%2F3-540-45440-3_16.pdf,,,1,2,https://doi.org/10.1007/3-540-45440-3_16
Designing Information Appliances Using a Resource Replication Model,"Mário J. Silva,    Ana Paula Afonso",1999,https://link.springer.com/chapter/10.1007/3-540-48157-5_15,No PDF available,,,1,No cite count available,https://doi.org/10.1007/3-540-48157-5_15
Social-based autonomic routing in opportunistic networks,"Chiara Boldrini,    Marco Conti,    Andrea Passarella",2009,https://link.springer.com/chapter/10.1007/978-0-387-09753-4_2,No PDF available,,,1,4,https://doi.org/10.1007/978-0-387-09753-4_2
Guest Editorial,"Panos K. Chrysanthis,    Evaggelia Pitoura",2004,https://link.springer.com/article/10.1023/B%3AWINE.0000044053.04438.6f,https://link.springer.com/content/pdf/10.1023%2FB%3AWINE.0000044053.04438.6f.pdf,,,1,No cite count available,https://doi.org/10.1023/B:WINE.0000044053.04438.6f
Modeling Moving Objects for Location Based Services,"Ouri Wolfson,    Sam Chamberlain…",2002,https://link.springer.com/chapter/10.1007/3-540-36257-6_5,No PDF available,,,1,5,https://doi.org/10.1007/3-540-36257-6_5
Data Replication,Bettina Kemme,No year available,https://link.springer.com/referenceworkentry/10.1007/978-1-4899-7993-3_110-2,No PDF available,,,1,No cite count available,https://doi.org/10.1007/978-1-4899-7993-3
Data Replication,Bettina Kemme,2018,https://link.springer.com/referenceworkentry/10.1007/978-1-4614-8265-9_110,https://link.springer.com/content/pdf/10.1007%2F978-1-4614-8265-9_110.pdf,,,1,No cite count available,https://doi.org/10.1007/978-1-4614-8265-9
Application Protocols,No author available,2008,https://link.springer.com/chapter/10.1007/978-3-540-77541-6_11,No PDF available,,,1,No cite count available,https://doi.org/10.1007/978-3-540-77541-6_11
The Soft Bound Admission Control Algorithm for Vertical Handover in Ubiquitous Environment,"Ok Sik Yang,    Jong Min Lee,    Jun Kyun Choi…",2006,https://link.springer.com/chapter/10.1007/11876601_12,No PDF available,,,1,No cite count available,https://doi.org/10.1007/11876601_12
Querying the uncertain position of moving objects,"A. Prasad Sistla,    Ouri Wolfson…",1998,https://link.springer.com/chapter/10.1007/BFb0053708,No PDF available,,,1,31,https://doi.org/10.1007/BFb0053708
"Analysis of Security Threats, Requirements, Technologies and Standards in Wireless Sensor Networks","Javier Lopez,    Rodrigo Roman…",2009,https://link.springer.com/chapter/10.1007/978-3-642-03829-7_10,No PDF available,,,1,30,https://doi.org/10.1007/978-3-642-03829-7_10
A survey on position-based routing for vehicular ad hoc networks,"Jianqi Liu,    Jiafu Wan,    Qinruo Wang,    Pan Deng,    Keliang Zhou…",2016,https://link.springer.com/article/10.1007/s11235-015-9979-7,https://link.springer.com/content/pdf/10.1007%2Fs11235-015-9979-7.pdf,,,1,63,https://doi.org/10.1007/s11235-015-9979-7
Editorial for QShine 2008,No author available,2009,https://link.springer.com/article/10.1007/s11036-008-0148-z,https://link.springer.com/content/pdf/10.1007%2Fs11036-008-0148-z.pdf,,,1,No cite count available,https://doi.org/10.1007/s11036-008-0148-z
Switching and Signalling,"A. Nejat Ince,    Dag Wilhelmsen,    Bülent Sankur",1995,https://link.springer.com/chapter/10.1007/978-1-4615-2233-1_5,No PDF available,,,1,No cite count available,https://doi.org/10.1007/978-1-4615-2233-1_5
Design and Implementation of a VANET Testbed: Performance Evaluation Considering DTN Transmission over VANETs,"Shogo Nakasaki,    Yu Yoshino,    Makoto Ikeda…",2019,https://link.springer.com/chapter/10.1007/978-3-319-93554-6_73,No PDF available,,,1,No cite count available,https://doi.org/10.1007/978-3-319-93554-6_73
CIRSE 2009,No author available,2009,https://link.springer.com/article/10.1007/s00270-009-9650-3,https://link.springer.com/content/pdf/10.1007%2Fs00270-009-9650-3.pdf,,,1,No cite count available,https://doi.org/10.1007/s00270-009-9650-3
"Intrusion Detection in Wireless Sensor Networks: Issues, Challenges and Approaches","Amrita Ghosal,    Subir Halder",2013,https://link.springer.com/chapter/10.1007/978-3-642-36169-2_10,No PDF available,,,1,2,https://doi.org/10.1007/978-3-642-36169-2_10
Reliable Transport in Delay Tolerant Networks,"Arshad Ali,    Manoj Panda,    Lucile Sassatelli…",2013,https://link.springer.com/chapter/10.1007/978-1-4614-3514-3_10,No PDF available,,,1,No cite count available,https://doi.org/10.1007/978-1-4614-3514-3_10
S,"Charles A. Scudder,    Lawrence Mays,    Gunnar Tobin…",2009,https://link.springer.com/referenceworkentry/10.1007/978-3-540-29678-2_19,https://link.springer.com/content/pdf/10.1007%2F978-3-540-29678-2_19.pdf,,,1,No cite count available,https://doi.org/10.1007/978-3-540-29678-2
Middleware Infrastructures for Self-organising Pervasive Computing Systems,"Matteo Casadei,    Marco Mamei,    Cynthia Villalba,    Mirko Viroli…",2011,https://link.springer.com/chapter/10.1007/978-3-642-17348-6_13,No PDF available,,,1,No cite count available,https://doi.org/10.1007/978-3-642-17348-6_13
Mobility Prediction Handover Using User Mobility Pattern and Guard Channel Assignment Scheme,"Jae-il Jung,    Jaeyeol Kim,    Younggap You",2004,https://link.springer.com/chapter/10.1007/978-3-540-30197-4_16,No PDF available,,,1,No cite count available,https://doi.org/10.1007/978-3-540-30197-4_16
On interpretation of loss from unauthorized transactions in China’s e-banking business,Siqi Li,2009,https://link.springer.com/article/10.1007/s11463-009-0007-2,No PDF available,,,1,No cite count available,https://doi.org/10.1007/s11463-009-0007-2
Freeze TCPv2: An Enhancement of Freeze TCP for Efficient Handoff in Heterogeneous Networks,"Minu Park,    Jaehyung Lee,    Jahwan Koo…",2009,https://link.springer.com/chapter/10.1007/978-3-642-02559-4_49,No PDF available,,,1,No cite count available,https://doi.org/10.1007/978-3-642-02559-4_49
Spatiotemporal Data Mining,"M. Nanni,    B. Kuijpers,    C. Körner,    M. May,    D. Pedreschi",2008,https://link.springer.com/chapter/10.1007/978-3-540-75177-9_11,No PDF available,,,1,11,https://doi.org/10.1007/978-3-540-75177-9_11
Available Bandwidth Estimation with Mobility Management in Ad Hoc Networks,"Redouane Belbachir,    Zoulikha Mekkakia Maaza…",2011,https://link.springer.com/chapter/10.1007/978-3-642-21153-9_28,No PDF available,,,1,1,https://doi.org/10.1007/978-3-642-21153-9_28
Tri-service model: a concept of service quality,"Indu Uprety,    Amit Chaudhary",2017,https://link.springer.com/article/10.1007/s13198-016-0530-3,https://link.springer.com/content/pdf/10.1007%2Fs13198-016-0530-3.pdf,,,1,No cite count available,https://doi.org/10.1007/s13198-016-0530-3
Independence of Net Transformations and Token Firing in Reconfigurable Place/Transition Systems,"Hartmut Ehrig,    Kathrin Hoffmann…",2007,https://link.springer.com/chapter/10.1007/978-3-540-73094-1_9,No PDF available,,,1,4,https://doi.org/10.1007/978-3-540-73094-1_9
Cross-Layering Approaches in Wireless Ad Hoc Networks,Liljana Gavrilovska,2006,https://link.springer.com/article/10.1007/s11277-006-9071-4,https://link.springer.com/content/pdf/10.1007%2Fs11277-006-9071-4.pdf,,,1,11,https://doi.org/10.1007/s11277-006-9071-4
Modeling and Simulation of ATM Systems and Networks,"M. S. Obaidat,    N. Boudriga",2003,https://link.springer.com/chapter/10.1007/978-1-4419-9218-5_5,No PDF available,,,1,1,https://doi.org/10.1007/978-1-4419-9218-5_5
Composing Components and Services Using a Planning-Based Adaptation Middleware,"Romain Rouvoy,    Frank Eliassen,    Jacqueline Floch,    Svein Hallsteinsen…",2008,https://link.springer.com/chapter/10.1007/978-3-540-78789-1_4,No PDF available,,,1,15,https://doi.org/10.1007/978-3-540-78789-1_4
