title,author,date,link,pdf_link,query,search_engine,nr_found,cite_count,doi
Mobile Agents for Clustering and Routing in Mobile Ad Hoc Networks,"Mieso K. Denko,    Qusay H. Mahmoud",2003,https://link.springer.com/chapter/10.1007/978-3-540-39611-6_24,No PDF available,,,1,No cite count available,https://doi.org/10.1007/978-3-540-39611-6_24
MONET Special Issue on Mobile and Pervasive Commerce,"Ravi Jain,    Hui Lei,    Marisa Viveros",2004,https://link.springer.com/article/10.1023/B%3AMONE.0000042503.25134.a7,https://link.springer.com/content/pdf/10.1023%2FB%3AMONE.0000042503.25134.a7.pdf,,,1,No cite count available,https://doi.org/10.1023/B:MONE.0000042503.25134.a7
An agent based application for personalized vehicular traffic management,"Alexander Schill,    Albert Held,    Wito Böhmak,    Thomas Springer…",1998,https://link.springer.com/chapter/10.1007/BFb0057651,No PDF available,,,1,1,https://doi.org/10.1007/BFb0057651
"Context management for m-commerce applications: determinants, methodology and the role of marketing","Poulcheria Benou,    Costas Vassilakis…",2012,https://link.springer.com/article/10.1007/s10799-012-0120-2,https://link.springer.com/content/pdf/10.1007%2Fs10799-012-0120-2.pdf,,,1,4,https://doi.org/10.1007/s10799-012-0120-2
Handover Trigger Based on Frame Retransmission Trend in Mobile IPv6,"Joanne Mun-Yee Lim,    Chee-Onn Chow,    Hiroshi Ishii",2013,https://link.springer.com/article/10.1007/s11277-012-0677-4,https://link.springer.com/content/pdf/10.1007%2Fs11277-012-0677-4.pdf,,,1,1,https://doi.org/10.1007/s11277-012-0677-4
A Comparison of Protocols for Updating Location Information,"Alexander Leonhardi,    Kurt Rothermel",2001,https://link.springer.com/article/10.1023/A%3A1011872831932,https://link.springer.com/content/pdf/10.1023%2FA%3A1011872831932.pdf,,,1,22,https://doi.org/10.1023/A:1011872831932
Multimedia Service Composition for Context-Aware Mobile Computing,"Eunjeong Park,    Heonshik Shin",2006,https://link.springer.com/chapter/10.1007/978-3-540-69429-8_12,No PDF available,,,1,1,https://doi.org/10.1007/978-3-540-69429-8_12
Secure Communication in Adverse Mobile Ad Hoc Networks,"Panagiotis Papadimitratos,    Zygmunt J. Haas",2004,https://link.springer.com/chapter/10.1007/978-1-4613-0223-0_12,No PDF available,,,1,2,https://doi.org/10.1007/978-1-4613-0223-0_12
Protocols for Updating Highly Accurate Location Information,"Alexander Leonhardi,    Kurt Rothermel",2002,https://link.springer.com/chapter/10.1007/0-306-47573-1_5,No PDF available,,,1,2,https://doi.org/10.1007/0-306-47573-1_5
Node Discovery and Replacement Using Mobile Robot,"Kalypso Magklara,    Dimitrios Zorbas,    Tahiry Razafindralambo",2013,https://link.springer.com/chapter/10.1007/978-3-642-36958-2_5,No PDF available,,,1,2,https://doi.org/10.1007/978-3-642-36958-2_5
A Mobile Agent Enabled Fully Distributed Mutual Exclusion Algorithm,"Jiannong Cao,    Xianbing Wang,    Jie Wu",2002,https://link.springer.com/chapter/10.1007/3-540-36112-X_10,No PDF available,,,1,1,https://doi.org/10.1007/3-540-36112-X_10
A CORBA-Based Work .ow Management System for Wireless Communication Environments,Leonardo Hartleben Reinehr…,2002,https://link.springer.com/chapter/10.1007/3-540-36124-3_55,No PDF available,,,1,No cite count available,https://doi.org/10.1007/3-540-36124-3_55
Location of Mobile Devices Using Networked Surfaces,"Frank Hoffmann,    James Scott",2002,https://link.springer.com/chapter/10.1007/3-540-45809-3_22,No PDF available,,,1,1,https://doi.org/10.1007/3-540-45809-3_22
Mobility and Battery Power Prediction Based Job Scheduling in Mobile Grid Environment,"S. Stephen Vaithiya,    S. Mary Saira Bhanu",2011,https://link.springer.com/chapter/10.1007/978-3-642-24037-9_31,No PDF available,,,1,2,https://doi.org/10.1007/978-3-642-24037-9_31
Performance Models for Multi-agent Systems and Mobile Agent Network,"Mario Kusek,    Kresimir Jurasovic…",2010,https://link.springer.com/chapter/10.1007/978-3-642-13526-2_1,No PDF available,,,1,No cite count available,https://doi.org/10.1007/978-3-642-13526-2_1
An Active Database Framework for Adaptive Mobile Data Access,"Shiow-yang Wu,    Chun-Shun Chang",1999,https://link.springer.com/chapter/10.1007/978-3-540-49121-7_29,No PDF available,,,1,No cite count available,https://doi.org/10.1007/978-3-540-49121-7_29
A Termination Detection Protocol for Use in Mobile Ad Hoc Networks,"Gruia-Catalin Roman,    Jamie Payton",2005,https://link.springer.com/article/10.1023/B%3AAUSE.0000049209.28933.b3,https://link.springer.com/content/pdf/10.1023%2FB%3AAUSE.0000049209.28933.b3.pdf,,,1,3,https://doi.org/10.1023/B:AUSE.0000049209.28933.b3
Review of Some Checkpointing Algorithms for Distributed and Mobile Systems,"Sunil Kumar Gupta,    Parveen Kumar",2011,https://link.springer.com/chapter/10.1007/978-3-642-22540-6_17,No PDF available,,,1,No cite count available,https://doi.org/10.1007/978-3-642-22540-6_17
Posters,No author available,2009,https://link.springer.com/article/10.1007/s12603-009-0095-9,https://link.springer.com/content/pdf/10.1007%2Fs12603-009-0095-9.pdf,,,1,1,https://doi.org/10.1007/s12603-009-0095-9
Developing Load Balancing System for RFID Middlewares Using Mobile Agent Technology,"Jian Feng Cui,    Heung Seok Chae",2007,https://link.springer.com/chapter/10.1007/978-3-540-72830-6_79,No PDF available,,,1,2,https://doi.org/10.1007/978-3-540-72830-6_79
Stochastic event capturing with a single mobile robot in rectangular perimeters,"Xiannuan Liang,    Yang Xiao,    Jingyuan Zhang,    Hongmei Deng…",2013,https://link.springer.com/article/10.1007/s11235-011-9570-9,https://link.springer.com/content/pdf/10.1007%2Fs11235-011-9570-9.pdf,,,1,6,https://doi.org/10.1007/s11235-011-9570-9
Usability in IT Systems for Mobile Work,"Niklas Johansson,    Torbjörn Lind,    Bengt Sandblad",2006,https://link.springer.com/chapter/10.1007/3-540-28365-X_8,No PDF available,,,1,1,https://doi.org/10.1007/3-540-28365-X_8
A Secure and Reliable Mobile Banking Framework,"Shaik Shakeel Ahamad,    V. N. Sastry…",2014,https://link.springer.com/chapter/10.1007/978-3-319-03095-1_80,No PDF available,,,1,No cite count available,https://doi.org/10.1007/978-3-319-03095-1_80
Log Based Recovery with Low Overhead for Mobile Computing Systems,"Awadhesh Kumar Singh,    Parmeet Kaur",2011,https://link.springer.com/chapter/10.1007/978-3-642-19542-6_125,No PDF available,,,1,No cite count available,https://doi.org/10.1007/978-3-642-19542-6_125
Mobile and remote operation for M2M application in upcoming u-manufacturing,"Kim Dong-Hoon,    Song Jun-Yeob",2008,https://link.springer.com/article/10.1007/s12206-007-1002-0,https://link.springer.com/content/pdf/10.1007%2Fs12206-007-1002-0.pdf,,,1,8,https://doi.org/10.1007/s12206-007-1002-0
Survey of Research Issues In LEO/MEO Based Global Mobile Communication Systems,Bezalel Gavish,1999,https://link.springer.com/chapter/10.1007/978-1-4615-5087-7_12,No PDF available,,,1,3,https://doi.org/10.1007/978-1-4615-5087-7_12
Smart Card Reader and Mobile APIs,"Damien Sauveron,    Raja Naeem Akram…",2017,https://link.springer.com/chapter/10.1007/978-3-319-50500-8_12,https://link.springer.com/content/pdf/10.1007%2F978-3-319-50500-8_12.pdf,,,1,No cite count available,https://doi.org/10.1007/978-3-319-50500-8_12
Extending Network Tree Lifetime with Mobile and Rechargeable Nodes,"Dimitrios Zorbas,    Tahiry Razafindralambo",2014,https://link.springer.com/chapter/10.1007/978-3-319-07425-2_17,No PDF available,,,1,No cite count available,https://doi.org/10.1007/978-3-319-07425-2_17
Conclusions,"Evaggelia Pitoura,    George Samaras",1998,https://link.springer.com/chapter/10.1007/978-1-4615-5527-8_7,No PDF available,,,1,No cite count available,https://doi.org/10.1007/978-1-4615-5527-8_7
Distributed cooperative coverage of mobile robots with consensus-based connectivity estimation,"Xiao-li Li 李晓丽,    Shu-guang Zhao 赵曙光…",2014,https://link.springer.com/article/10.1007/s12204-014-1500-z,https://link.springer.com/content/pdf/10.1007%2Fs12204-014-1500-z.pdf,,,1,No cite count available,https://doi.org/10.1007/s12204-014-1500-z
Middleware for Mobile Applications Beyond 3G,Kimmo Raatikainen,2002,https://link.springer.com/chapter/10.1007/978-0-387-35584-9_1,https://link.springer.com/content/pdf/10.1007%2F978-0-387-35584-9_1.pdf,,,1,2,https://doi.org/10.1007/978-0-387-35584-9_1
Experiments in Composing Proxy Audio Services for Mobile Users,"Philip K. McKinley,    Udiyan I. Padmanabhan,    Nandagopal Ancha",2001,https://link.springer.com/chapter/10.1007/3-540-45518-3_6,https://link.springer.com/content/pdf/10.1007%2F3-540-45518-3_6.pdf,,,1,4,https://doi.org/10.1007/3-540-45518-3_6
Map-Based Support for Effective Collaboration in Micro-mobile Virtual Teams,"Guido te Brake,    Rick van der Kleij",2010,https://link.springer.com/chapter/10.1007/978-3-642-11688-9_7,No PDF available,,,1,No cite count available,https://doi.org/10.1007/978-3-642-11688-9_7
A Multi-version Data Model and Semantic-Based Transaction Processing Protocol,Alexander Yakovlev,2005,https://link.springer.com/chapter/10.1007/11547686_7,https://link.springer.com/content/pdf/10.1007%2F11547686_7.pdf,,,1,No cite count available,https://doi.org/10.1007/11547686_7
SyD: A Middleware Testbed for Collaborative Applications over Small Heterogeneous Devices and Data Stores,"Sushil K. Prasad,    Vijay Madisetti,    Shamkant B. Navathe,    Raj Sunderraman…",2004,https://link.springer.com/chapter/10.1007/978-3-540-30229-2_19,https://link.springer.com/content/pdf/10.1007%2F978-3-540-30229-2_19.pdf,,,1,No cite count available,https://doi.org/10.1007/978-3-540-30229-2_19
Adaptive Access Control in Coordination-Based Mobile Agent Systems,"Christine Julien,    Jamie Payton…",2005,https://link.springer.com/chapter/10.1007/978-3-540-31846-0_15,https://link.springer.com/content/pdf/10.1007%2F978-3-540-31846-0_15.pdf,,,1,2,https://doi.org/10.1007/978-3-540-31846-0_15
GENERIC FAULT-TOLERANT LAYER SUPPORTING PUBLISH/SUBSCRIBE MESSAGING IN MOBILE AGENT SYSTEMS,"Milovan Tosic,    Arkady Zaslavsky",2006,https://link.springer.com/chapter/10.1007/978-1-4020-5347-4_23,No PDF available,,,1,1,https://doi.org/10.1007/978-1-4020-5347-4_23
Security Technologies to Guarantee Safe Business Processes in Smart Organizations,István Mezgár,2005,https://link.springer.com/chapter/10.1007/978-1-4020-7829-3_9,No PDF available,,,1,No cite count available,https://doi.org/10.1007/978-1-4020-7829-3_9
Invalidation for CORBA Caching in Wireless Devices,"James Jayaputera,    David Taniar",2004,https://link.springer.com/chapter/10.1007/978-3-540-30121-9_44,No PDF available,,,1,No cite count available,https://doi.org/10.1007/978-3-540-30121-9_44
Reliable Timeout Based Commit Protocol,"Bharati Harsoor,    S. Ramachandram",2010,https://link.springer.com/chapter/10.1007/978-3-642-14478-3_41,No PDF available,,,1,1,https://doi.org/10.1007/978-3-642-14478-3_41
"Using Mobile Telephone as an Operator Independent, Secure Micro-Payment Tool","Hasan AMCA,    Erbug CELEBİ",2008,https://link.springer.com/chapter/10.1007/978-1-4020-8737-0_66,No PDF available,,,1,No cite count available,https://doi.org/10.1007/978-1-4020-8737-0_66
Mobile Solutions for Direct Store Delivery,"Wesley Mukai,    Yuri Natchetoi,    Serhan Dagtas",2009,https://link.springer.com/chapter/10.1007/978-3-540-77213-2_16,No PDF available,,,1,No cite count available,https://doi.org/10.1007/978-3-540-77213-2_16
Rumor: Mobile Data Access Through Optimistic Peer-to-Peer Replication,"Richard Guy,    Peter Reiher,    David Ratner…",1999,https://link.springer.com/chapter/10.1007/978-3-540-49121-7_22,No PDF available,,,1,No cite count available,https://doi.org/10.1007/978-3-540-49121-7_22
Places to stay on the move: Software architectures for mobile user interfaces,"Alan Dix,    Devina Ramduny,    Tom Rodden,    Nigel Davies",2000,https://link.springer.com/article/10.1007/BF01324124,https://link.springer.com/content/pdf/10.1007%2FBF01324124.pdf,,,1,No cite count available,https://doi.org/10.1007/BF01324124
Domino: Exploring Mobile Collaborative Software Adaptation,"Marek Bell,    Malcolm Hall,    Matthew Chalmers,    Phil Gray,    Barry Brown",2006,https://link.springer.com/chapter/10.1007/11748625_10,No PDF available,,,1,4,https://doi.org/10.1007/11748625_10
Engineering infrastructures for mobile organizations,"Giacomo Cabri,    Letizia Leonardi,    Marco Mamei…",2001,https://link.springer.com/chapter/10.1007/3-540-45584-1_4,No PDF available,,,1,1,https://doi.org/10.1007/3-540-45584-1_4
An Intelligent Mobile Commerce System with Dynamic Contents Builder and Mobile Products Browser,"Sera Jang,    1Eunseok Lee",2002,https://link.springer.com/chapter/10.1007/3-540-45675-9_30,No PDF available,,,1,No cite count available,https://doi.org/10.1007/3-540-45675-9_30
Mobile Multicast,"Elias C. Efstathiou,    George C. Polyzos",2003,https://link.springer.com/chapter/10.1007/978-1-4615-0225-8_9,No PDF available,,,1,No cite count available,https://doi.org/10.1007/978-1-4615-0225-8_9
Fair and Secure Mobile Billing Systems,"Shiqun Li,    Guilin Wang,    Jianying Zhou,    Kefei Chen",2009,https://link.springer.com/article/10.1007/s11277-008-9602-2,https://link.springer.com/content/pdf/10.1007%2Fs11277-008-9602-2.pdf,,,1,2,https://doi.org/10.1007/s11277-008-9602-2
Resilience in Mobile Networks: A Need and a Challenge,"Alberto Avritzer,    Luca Berardinelli…",2012,https://link.springer.com/chapter/10.1007/978-3-642-29032-9_2,No PDF available,,,1,No cite count available,https://doi.org/10.1007/978-3-642-29032-9_2
Mobile Agent Enabled Application Mobility for Pervasive Computing,"Ping Yu,    Jiannong Cao,    Weidong Wen,    Jian Lu",2006,https://link.springer.com/chapter/10.1007/11833529_66,No PDF available,,,1,13,https://doi.org/10.1007/11833529_66
Quality of Service in Mobile and Wireless Networks: The Need for Proactive and Adaptive Applications,"Marc Bechler,    Hartmut Ritter,    Jochen H. Schiller",2001,https://link.springer.com/article/10.1023/A%3A1016755906275,https://link.springer.com/content/pdf/10.1023%2FA%3A1016755906275.pdf,,,1,3,https://doi.org/10.1023/A:1016755906275
Updated Data Dissemination in Ad Hoc Networks,"Hideki Hayashi,    Takahiro Hara…",2005,https://link.springer.com/chapter/10.1007/978-3-540-30188-2_3,https://link.springer.com/content/pdf/10.1007%2F978-3-540-30188-2_3.pdf,,,1,1,https://doi.org/10.1007/978-3-540-30188-2_3
Architectural issues of database systems in advanced computer networks,"Shojiro Nishio,    Masahiko Tsukamoto",1997,https://link.springer.com/chapter/10.1007/3-540-63343-X_51,No PDF available,,,1,No cite count available,https://doi.org/10.1007/3-540-63343-X_51
HLA Simulation Using Data Compensation Model,"Tainchi Lu,    Chinghao Hsu,    Mingchi Fu",2005,https://link.springer.com/chapter/10.1007/978-3-540-30585-9_41,https://link.springer.com/content/pdf/10.1007%2F978-3-540-30585-9_41.pdf,,,1,1,https://doi.org/10.1007/978-3-540-30585-9_41
Designing a Service Platform for Sharing Internet Resources in MANETs,Gabriel Guerrero-Contreras…,2013,https://link.springer.com/chapter/10.1007/978-3-642-45364-9_27,No PDF available,,,1,1,https://doi.org/10.1007/978-3-642-45364-9_27
Towards Distributed Workflow Enactment with Itineraries and Mobile Agent Management,"Seng Wai Loke,    Arkady Zaslavsky",2001,https://link.springer.com/chapter/10.1007/3-540-45370-9_17,No PDF available,,,1,5,https://doi.org/10.1007/3-540-45370-9_17
A Survey of Energy Efficient Network Protocols for Wireless Networks,"Christine E. Jones,    Krishna M. Sivalingam,    Prathima Agrawal…",2001,https://link.springer.com/article/10.1023/A%3A1016627727877,https://link.springer.com/content/pdf/10.1023%2FA%3A1016627727877.pdf,,,1,448,https://doi.org/10.1023/A:1016627727877
An autonomous educational mobile robot mediator,"Ruben Mitnik,    Miguel Nussbaum,    Alvaro Soto",2008,https://link.springer.com/article/10.1007/s10514-008-9101-z,https://link.springer.com/content/pdf/10.1007%2Fs10514-008-9101-z.pdf,,,1,34,https://doi.org/10.1007/s10514-008-9101-z
Providing Reliability for Transactional Mobile Agents,"Linda Zeghache,    Michel Hurfin,    Izabela Moise…",2013,https://link.springer.com/chapter/10.1007/978-3-642-38227-7_21,No PDF available,,,1,No cite count available,https://doi.org/10.1007/978-3-642-38227-7_21
Performance Analysis of Mobile Agents for Filtering Data Streams on Wireless Networks,"David Kotz,    George Cybenko,    Robert S. Gray…",2002,https://link.springer.com/article/10.1023/A%3A1013778922814,https://link.springer.com/content/pdf/10.1023%2FA%3A1013778922814.pdf,,,1,11,https://doi.org/10.1023/A:1013778922814
Channel Assignment and Multiple Access in Trunking Radio Systems [1],"Peter Stavroulakis,    Kostas Ioannou…",2007,https://link.springer.com/chapter/10.1007/3-540-71192-9_4,No PDF available,,,1,1,https://doi.org/10.1007/3-540-71192-9_4
"Panel Session: Mobile Code, Internet Security, and E-Commerce","Refik Molva,    Francoise Baude",2000,https://link.springer.com/chapter/10.1007/3-540-44555-2_19,No PDF available,,,1,No cite count available,https://doi.org/10.1007/3-540-44555-2_19
Stigmergic Service Composition and Adaptation in Mobile Environments,"Andrei Palade,    Christian Cabrera,    Gary White,    Siobhán Clarke",2018,https://link.springer.com/chapter/10.1007/978-3-030-03596-9_45,https://link.springer.com/content/pdf/10.1007%2F978-3-030-03596-9_45.pdf,,,1,No cite count available,https://doi.org/10.1007/978-3-030-03596-9_45
A Location Dependent Semantic Cache Replacement Strategy in Mobile Environment,"Kahkashan Tabassum,    Mahmood Quadri Syed…",2012,https://link.springer.com/chapter/10.1007/978-3-642-27299-8_23,No PDF available,,,1,No cite count available,https://doi.org/10.1007/978-3-642-27299-8_23
Checking the Integrity Constraints of Mobile Databases with Three-Level Model,"Hamidah Ibrahim,    Zarina Dzolkhifli…",2008,https://link.springer.com/chapter/10.1007/978-3-540-70504-8_18,No PDF available,,,1,No cite count available,https://doi.org/10.1007/978-3-540-70504-8_18
Change of geographic information service model in mobile context,"Ren Fu Ph.D. candidate,    Du Qingyun",2005,https://link.springer.com/article/10.1007/BF02838661,No PDF available,,,1,No cite count available,https://doi.org/10.1007/BF02838661
Reducing Sub-transaction Aborts and Blocking Time Within Atomic Commit Protocols,"Stefan Böttcher,    Le Gruenwald…",2006,https://link.springer.com/chapter/10.1007/11788911_5,No PDF available,,,1,2,https://doi.org/10.1007/11788911_5
What is new in computers?,L. M. Patnaik,1998,https://link.springer.com/article/10.1007/BF02838842,https://link.springer.com/content/pdf/10.1007%2FBF02838842.pdf,,,1,No cite count available,https://doi.org/10.1007/BF02838842
Efficient Cooperative Caching Schemes for Data Access in Mobile Ad Hoc Networks,"Cheng-Ru Young,    Ge-Ming Chiu,    Fu-Lan Wu",2005,https://link.springer.com/chapter/10.1007/11596356_69,https://link.springer.com/content/pdf/10.1007%2F11596356_69.pdf,,,1,No cite count available,https://doi.org/10.1007/11596356_69
Design and Analysis of an Efficient Communication Strategy for Hierarchical and Highly Changing Ad-hoc Mobile Networks,"Ioannis Chatzigiannakis,    Sotiris Nikoletseas",2004,https://link.springer.com/article/10.1023/B%3AMONE.0000031591.74793.52,https://link.springer.com/content/pdf/10.1023%2FB%3AMONE.0000031591.74793.52.pdf,,,1,4,https://doi.org/10.1023/B:MONE.0000031591.74793.52
Survey on Monitoring and Quality Controlling of the Mobile Biosignal Delivery,"Pravin A. Pawar,    Damodar R. Edla…",2017,https://link.springer.com/article/10.1007/s12539-017-0263-2,https://link.springer.com/content/pdf/10.1007%2Fs12539-017-0263-2.pdf,,,1,No cite count available,https://doi.org/10.1007/s12539-017-0263-2
A Mobile Agent-Based Framework for Configurable Sensor Networks,"Takeshi Umezawa,    Ichiro Satoh…",2002,https://link.springer.com/chapter/10.1007/3-540-36086-7_12,No PDF available,,,1,5,https://doi.org/10.1007/3-540-36086-7_12
Efficient Color-theory-based Dynamic Localization for Mobile Wireless Sensor Networks,"Shen-Hai Shee,    Tzu-Chien Chang,    Kuochen Wang…",2011,https://link.springer.com/article/10.1007/s11277-010-9923-9,https://link.springer.com/content/pdf/10.1007%2Fs11277-010-9923-9.pdf,,,1,8,https://doi.org/10.1007/s11277-010-9923-9
FLASCHE – A Mechanism Providing Anonymity for Mobile Users,Alf Zugenmaier,2005,https://link.springer.com/chapter/10.1007/11423409_9,https://link.springer.com/content/pdf/10.1007%2F11423409_9.pdf,,,1,No cite count available,https://doi.org/10.1007/11423409_9
Ubiquitous Data Management in Public Transport,"Carmelo R. García,    Gabino Padrón…",2012,https://link.springer.com/chapter/10.1007/978-3-642-35377-2_48,No PDF available,,,1,No cite count available,https://doi.org/10.1007/978-3-642-35377-2_48
Techniques for Building Effective Digital Business Models,Mark Skilton,2015,https://link.springer.com/chapter/10.1057/9781137477729_4,No PDF available,,,1,No cite count available,https://doi.org/10.1057/9781137477729_4
Policy-Driven Binding to Information Resources in Mobility-Enabled Scenarios,"Paolo Bellavista,    Antonio Corradi,    Rebecca Montanari…",2003,https://link.springer.com/chapter/10.1007/3-540-36389-0_15,No PDF available,,,1,2,https://doi.org/10.1007/3-540-36389-0_15
The Case for Wireless Overlay Networks,"Randy H. Katz,    Eric A. Brewer",1996,https://link.springer.com/chapter/10.1007/978-0-585-29603-6_23,No PDF available,,,1,11,https://doi.org/10.1007/978-0-585-29603-6_23
Reconciling Cloud and Mobile Computing Using Activity-Based Predictive Caching,"Dawud Gordon,    Sven Frauen,    Michael Beigl",2014,https://link.springer.com/chapter/10.1007/978-3-319-05452-0_11,No PDF available,,,1,No cite count available,https://doi.org/10.1007/978-3-319-05452-0_11
Development of a scale to measure the quality of mobile location-based services,"Jun-Yeon Heo,    Kwang-Jae Kim",2017,https://link.springer.com/article/10.1007/s11628-016-0305-6,https://link.springer.com/content/pdf/10.1007%2Fs11628-016-0305-6.pdf,,,1,2,https://doi.org/10.1007/s11628-016-0305-6
A context management architecture for m-commerce applications,"Benou Poulcheria,    Vassilakis Costas",2012,https://link.springer.com/article/10.2478/s13537-012-0010-z,No PDF available,,,1,1,https://doi.org/10.2478/s13537-012-0010-z
Mobility Support for Replicated Real-Time Applications,Jörg Roth,2002,https://link.springer.com/chapter/10.1007/3-540-48080-3_16,No PDF available,,,1,No cite count available,https://doi.org/10.1007/3-540-48080-3_16
A Context System for a Mobile Service Platform,"Fritz Hohl,    Lars Mehrmann,    Amen Hamdan",2002,https://link.springer.com/chapter/10.1007/3-540-45997-9_4,No PDF available,,,1,2,https://doi.org/10.1007/3-540-45997-9_4
A location-based mobile health care facility search system for senior citizens,"Jun-Ho Huh,    Tae-Jung Kim",2018,https://link.springer.com/article/10.1007/s11227-018-2342-5,https://link.springer.com/content/pdf/10.1007%2Fs11227-018-2342-5.pdf,,,1,2,https://doi.org/10.1007/s11227-018-2342-5
Replica Allocation Methods in Ad Hoc Networks with Data Update,Takahiro Hara,2003,https://link.springer.com/article/10.1023/A%3A1024523411884,https://link.springer.com/content/pdf/10.1023%2FA%3A1024523411884.pdf,,,1,67,https://doi.org/10.1023/A:1024523411884
Overlay construction for mobile peer-to-peer video broadcasting,"Bo Zhang,    S.-H. Gary Chan",2016,https://link.springer.com/article/10.1007/s12083-015-0388-1,https://link.springer.com/content/pdf/10.1007%2Fs12083-015-0388-1.pdf,,,1,1,https://doi.org/10.1007/s12083-015-0388-1
Index Based Ordered Broadcast with Status (IOBS) Algorithm for Consistent Data Broadcast,"K. Chitra,    K. Senthamarai Kannan,    S. Abirami",2011,https://link.springer.com/chapter/10.1007/978-3-642-24043-0_28,No PDF available,,,1,1,https://doi.org/10.1007/978-3-642-24043-0_28
A Chaos Based Secure Communication Scheme for Hybrid Message Logging and Asynchronous Checkpointing for Mobile Computing,"Santo Banerjee,    S. Mukhopadhyay",2011,https://link.springer.com/chapter/10.1007/978-3-642-21922-1_10,No PDF available,,,1,1,https://doi.org/10.1007/978-3-642-21922-1_10
Security via Trusted Communications,Zheng Yan,2010,https://link.springer.com/chapter/10.1007/978-3-642-04117-4_33,No PDF available,,,1,6,https://doi.org/10.1007/978-3-642-04117-4_33
Constraint Solving-Based Itineraries for Mobile Agents,Ichiro Satoh,2016,https://link.springer.com/chapter/10.1007/978-3-319-40162-1_13,https://link.springer.com/content/pdf/10.1007%2F978-3-319-40162-1_13.pdf,,,1,No cite count available,https://doi.org/10.1007/978-3-319-40162-1_13
An Adaptive Component Model for Autonomous Mobile Robots,"Jinhui Zhu,    Huaqing Min,    Yingju Liang,    Mingjie Liang,    Chang’an Yi…",2011,https://link.springer.com/chapter/10.1007/978-3-642-23147-6_2,No PDF available,,,1,No cite count available,https://doi.org/10.1007/978-3-642-23147-6_2
CooS: Coordination Support for Mobile Collaborative Applications,Mario Henrique Cruz Torres…,2013,https://link.springer.com/chapter/10.1007/978-3-642-40238-8_13,No PDF available,,,1,1,https://doi.org/10.1007/978-3-642-40238-8_13
Minimizing the Handoff Latency in Ad-Hoc Networks When Streaming Media to Mobile Devices,Kevin Curran,2001,https://link.springer.com/article/10.1023/A%3A1012383032186,https://link.springer.com/content/pdf/10.1023%2FA%3A1012383032186.pdf,,,1,No cite count available,https://doi.org/10.1023/A:1012383032186
MARE: A Fault-Tolerant Mobile Agent System,"Kyeongmo Park,    Arun Sood",2004,https://link.springer.com/chapter/10.1007/978-3-540-25978-7_104,No PDF available,,,1,No cite count available,https://doi.org/10.1007/978-3-540-25978-7_104
