title,author,date,link,pdf_link,query,search_engine,nr_found,cite_count,doi
Nursing Management,…,1981,https://link.springer.com/chapter/10.1007/978-1-4613-8087-0_8,No PDF available,,,1,No cite count available,https://doi.org/10.1007/978-1-4613-8087-0_8
Signalling protocols,"Daniel Hardy,    Guy Malléus,    Jean-Noël Méreur",2002,https://link.springer.com/chapter/10.1007/978-3-642-55498-8_12,No PDF available,,,1,No cite count available,https://doi.org/10.1007/978-3-642-55498-8_12
Modeling and Simulation of ATM Systems and Networks,"M. S. Obaidat,    N. Boudriga",2003,https://link.springer.com/chapter/10.1007/978-1-4419-9218-5_5,No PDF available,,,1,1,https://doi.org/10.1007/978-1-4419-9218-5_5
Abstracts 2016,No author available,2016,https://link.springer.com/article/10.1007/s12529-016-9586-3,https://link.springer.com/content/pdf/10.1007%2Fs12529-016-9586-3.pdf,,,1,3,https://doi.org/10.1007/s12529-016-9586-3
Cross Layer Simulation: Application to Performance Modelling of Networks Composed of MANETs and Satellites,"Riadh Dhaou,    Vincent Gauthier,    M. Issoufou Tiado…",2011,https://link.springer.com/chapter/10.1007/978-3-642-02742-0_21,No PDF available,,,1,2,https://doi.org/10.1007/978-3-642-02742-0_21
EHSR in Focus,Torben Jespen,2016,https://link.springer.com/chapter/10.1007/978-3-319-31361-0_4,https://link.springer.com/content/pdf/10.1007%2F978-3-319-31361-0_4.pdf,,,1,No cite count available,https://doi.org/10.1007/978-3-319-31361-0_4
"21st International Congress of the European Association for Endoscopic Surgery (EAES), Vienna, Austria, 19–22 June 2013",No author available,2014,https://link.springer.com/article/10.1007/s00464-014-3484-z,https://link.springer.com/content/pdf/10.1007%2Fs00464-014-3484-z.pdf,,,1,No cite count available,https://doi.org/10.1007/s00464-014-3484-z
The PERSONA Service Platform for AAL Spaces,"Mohammad-Reza Tazari,    Francesco Furfari…",2010,https://link.springer.com/chapter/10.1007/978-0-387-93808-0_43,No PDF available,,,1,16,https://doi.org/10.1007/978-0-387-93808-0_43
VANET Architectures and Protocol Stacks: A Survey,"Sajjad Akbar Mohammad,    Asim Rasheed,    Amir Qayyum",2011,https://link.springer.com/chapter/10.1007/978-3-642-19786-4_9,No PDF available,,,1,20,https://doi.org/10.1007/978-3-642-19786-4_9
A route maintaining algorithm using neighbor table for mobile sinks,"Chun-Su Park,    Kwang-Wook Lee,    You-Sun Kim,    Sung-Jea Ko",2009,https://link.springer.com/article/10.1007/s11276-007-0068-z,https://link.springer.com/content/pdf/10.1007%2Fs11276-007-0068-z.pdf,,,1,7,https://doi.org/10.1007/s11276-007-0068-z
‘A place without a place’: Boat Travel,Fiona Wilkie,2015,https://link.springer.com/chapter/10.1057/9781137476890_5,No PDF available,,,1,No cite count available,https://doi.org/10.1057/9781137476890_5
Abstract,No author available,2006,https://link.springer.com/article/10.1007/s10336-006-0093-1,https://link.springer.com/content/pdf/10.1007%2Fs10336-006-0093-1.pdf,,,1,No cite count available,https://doi.org/10.1007/s10336-006-0093-1
Opportunistic media access control and routing for delay-tolerant mobile ad hoc networks,Liang Dong,2012,https://link.springer.com/article/10.1007/s11276-012-0444-1,https://link.springer.com/content/pdf/10.1007%2Fs11276-012-0444-1.pdf,,,1,6,https://doi.org/10.1007/s11276-012-0444-1
Limbo: A tuple space based platform for adaptive mobile applications,"N. Davies,    S. P. Wade,    A. Friday…",1997,https://link.springer.com/chapter/10.1007/978-0-387-35188-9_22,No PDF available,,,1,No cite count available,https://doi.org/10.1007/978-0-387-35188-9_22
Collaborative joins in a pervasive computing environment,"Filip Perich,    Anupam Joshi,    Yelena Yesha,    Tim Finin",2005,https://link.springer.com/article/10.1007/s00778-004-0127-3,https://link.springer.com/content/pdf/10.1007%2Fs00778-004-0127-3.pdf,,,1,5,https://doi.org/10.1007/s00778-004-0127-3
Investigation of Prion Diseases,"J. W. Ironside,    D. Seilhean,    M. W. Head,    J.-J. Hauw",2001,https://link.springer.com/chapter/10.1007/978-3-642-59554-7_6,No PDF available,,,1,1,https://doi.org/10.1007/978-3-642-59554-7_6
Cache Invalidation Mechanisms,No author available,2000,https://link.springer.com/chapter/10.1007/0-306-47026-8_6,No PDF available,,,1,No cite count available,https://doi.org/10.1007/0-306-47026-8_6
Security Technologies to Guarantee Safe Business Processes in Smart Organizations,István Mezgár,2005,https://link.springer.com/chapter/10.1007/978-1-4020-7829-3_9,No PDF available,,,1,No cite count available,https://doi.org/10.1007/978-1-4020-7829-3_9
Experience of Enhancing the Space Sensing of Networked Robots Using Atlas Service-Oriented Architecture,"Sumi Helal,    Shinyoung Lim,    Raja Bose,    Hen-I Yang,    Hyun Kim…",2008,https://link.springer.com/chapter/10.1007/978-3-540-70585-7_1,No PDF available,,,1,1,https://doi.org/10.1007/978-3-540-70585-7_1
An adaptive data distribution system for mobile environments,"Sascha Kümmel,    Alexander Schill,    Karsten Schumann,    Thomas Ziegert",1996,https://link.springer.com/chapter/10.1007/978-0-387-34980-0_18,https://link.springer.com/content/pdf/10.1007%2F978-0-387-34980-0_18.pdf,,,1,No cite count available,https://doi.org/10.1007/978-0-387-34980-0_18
Saving Energy on WiFi with Required IPsec,"Youngsang Shin,    Steven Myers…",2010,https://link.springer.com/chapter/10.1007/978-3-642-16161-2_9,No PDF available,,,1,No cite count available,https://doi.org/10.1007/978-3-642-16161-2_9
MARP: A Multi-Agent Routing Protocol for Mobile Wireless Ad Hoc Networks,"Romit Roy Choudhury,    Krishna Paul…",2004,https://link.springer.com/article/10.1023/B%3AAGNT.0000009410.57024.9a,https://link.springer.com/content/pdf/10.1023%2FB%3AAGNT.0000009410.57024.9a.pdf,,,1,16,https://doi.org/10.1023/B:AGNT.0000009410.57024.9a
NIBLUM: Non-Invasive Bluetooth Mouse for Wheelchair Users,"Roberto Casas,    Marcos Quilez,    Borja Romero…",2006,https://link.springer.com/chapter/10.1007/11788713_147,No PDF available,,,1,2,https://doi.org/10.1007/11788713_147
The Internet of Things: How WSNs Fit Into The Picture,Dr. Aggeliki Pragiati,2014,https://link.springer.com/chapter/10.1007/978-3-319-00663-5_8,No PDF available,,,1,2,https://doi.org/10.1007/978-3-319-00663-5_8
"Capabilities for Voice, Work and Education: Critical Analysis of Programmes for Disadvantaged Young People in Europe","Lavinia Bilfulco,    Valerie Egdell,    Ronald McQuaid…",2015,https://link.springer.com/chapter/10.1007/978-3-319-11436-1_11,No PDF available,,,1,No cite count available,https://doi.org/10.1007/978-3-319-11436-1_11
Security in Mobile Wireless Sensor Networks: Attacks and Defenses,"Amrita Ghosal,    Subir Halder",2015,https://link.springer.com/chapter/10.1007/978-3-319-18299-5_9,https://link.springer.com/content/pdf/10.1007%2F978-3-319-18299-5_9.pdf,,,1,No cite count available,https://doi.org/10.1007/978-3-319-18299-5_9
Abstracts of Posters,No author available,2005,https://link.springer.com/article/10.1381/0960892054621152,https://link.springer.com/content/pdf/10.1381%2F0960892054621152.pdf,,,1,No cite count available,https://doi.org/10.1381/0960892054621152
Preventing Individual Limitations/Problems,"Waldo C. Klein,    Martin Bloom",1997,https://link.springer.com/chapter/10.1007/978-1-4615-5931-3_4,No PDF available,,,1,No cite count available,https://doi.org/10.1007/978-1-4615-5931-3_4
Integrating mobile agents into the mobile middleware,"Ernö Kovacs,    Klaus Röhrle,    Matthias Reich",1998,https://link.springer.com/chapter/10.1007/BFb0057653,No PDF available,,,1,5,https://doi.org/10.1007/BFb0057653
The Totality of Space,Olga Pantelidou,2009,https://link.springer.com/chapter/10.1007/978-0-387-76485-6_11,No PDF available,,,1,No cite count available,https://doi.org/10.1007/978-0-387-76485-6_11
Mobile Agents for Wireless Computing: The Convergence of Wireless Computational Models with Mobile-Agent Technologies,"Constantinos Spyrou,    George Samaras,    Evaggelia Pitoura…",2004,https://link.springer.com/article/10.1023/B%3AMONE.0000034705.10830.b7,https://link.springer.com/content/pdf/10.1023%2FB%3AMONE.0000034705.10830.b7.pdf,,,1,28,https://doi.org/10.1023/B:MONE.0000034705.10830.b7
Mobile Open Systems Technology for the Utilities Industries,"Nigel Davies,    Gordon Blair,    Adrian Friday…",1996,https://link.springer.com/chapter/10.1007/978-1-4471-1496-3_11,No PDF available,,,1,2,https://doi.org/10.1007/978-1-4471-1496-3_11
Monitoring Spatial Change over Time,Matt Duckham,2013,https://link.springer.com/chapter/10.1007/978-3-642-30853-6_6,No PDF available,,,1,No cite count available,https://doi.org/10.1007/978-3-642-30853-6_6
Routing Issues in Opportunistic Networks,"Marco Conti,    Jon Crowcroft,    Silvia Giordano…",2009,https://link.springer.com/chapter/10.1007/978-3-540-89707-1_6,No PDF available,,,1,14,https://doi.org/10.1007/978-3-540-89707-1_6
Russian Models in the Bmstu Mechanisms Collection,No author available,2008,https://link.springer.com/chapter/10.1007/978-1-4020-8776-9_3,No PDF available,,,1,No cite count available,https://doi.org/10.1007/978-1-4020-8776-9_3
Design and Implementation of Pessimistic Commit Protocols in Mobile Environments,"Salman Abdul Moiz,    Lakshmi Rajamani…",2010,https://link.springer.com/chapter/10.1007/978-3-642-14478-3_61,No PDF available,,,1,1,https://doi.org/10.1007/978-3-642-14478-3_61
Routing in Wireless Sensor Networks,"Hannes Frey,    Stefan Rührup,    Ivan Stojmenović",2009,https://link.springer.com/chapter/10.1007/978-1-84882-218-4_4,No PDF available,,,1,12,https://doi.org/10.1007/978-1-84882-218-4_4
Tuple Space Middleware for Wireless Networks,"Paolo Costa,    Luca Mottola,    Amy L. Murphy…",2009,https://link.springer.com/chapter/10.1007/978-3-540-89707-1_11,No PDF available,,,1,2,https://doi.org/10.1007/978-3-540-89707-1_11
Introduction,"Evaggelia Pitoura,    George Samaras",1998,https://link.springer.com/chapter/10.1007/978-1-4615-5527-8_1,No PDF available,,,1,No cite count available,https://doi.org/10.1007/978-1-4615-5527-8_1
Multimedia service utilizing hierarchical fog computing for vehicular networks,"Jeevan Kharel,    Soo Young Shin",2018,https://link.springer.com/article/10.1007/s11042-018-6530-3,https://link.springer.com/content/pdf/10.1007%2Fs11042-018-6530-3.pdf,,,1,No cite count available,https://doi.org/10.1007/s11042-018-6530-3
"Vehicular Ad Hoc Networks
, Enhanced GPSR and Beacon-Assist Geographic Forwarding in","Ping Wang,    Dr. Fuqiang Liu,    Wenjie Shu…",2013,https://link.springer.com/referenceworkentry/10.1007/978-1-4614-5844-9_479,No PDF available,,,1,No cite count available,https://doi.org/10.1007/978-1-4614-5844-9
"Vehicular Ad Hoc Networks
, Enhanced GPSR and Beacon-Assist Geographic Forwarding in","Ping Wang,    Dr. Fuqiang Liu,    Wenjie Shu…",2012,https://link.springer.com/referenceworkentry/10.1007/978-1-4419-0851-3_479,No PDF available,,,1,No cite count available,https://doi.org/10.1007/978-1-4419-0851-3
Service Analytics,"Jorge Cardoso,    Julia Hoxha,    Hansjörg Fromm",2015,https://link.springer.com/chapter/10.1007/978-3-319-23195-2_6,https://link.springer.com/content/pdf/10.1007%2F978-3-319-23195-2_6.pdf,,,1,No cite count available,https://doi.org/10.1007/978-3-319-23195-2_6
Motion for Manipulation Tasks,"James Kuffner,    Jing Xiao",2016,https://link.springer.com/chapter/10.1007/978-3-319-32552-1_36,https://link.springer.com/content/pdf/10.1007%2F978-3-319-32552-1_36.pdf,,,1,1,https://doi.org/10.1007/978-3-319-32552-1_36
A Pattern Oriented Lightweight Middleware for Smartcards,"J. -M. Douin,    J. -M. Gilliot",2004,https://link.springer.com/chapter/10.1007/1-4020-8147-2_14,https://link.springer.com/content/pdf/10.1007%2F1-4020-8147-2_14.pdf,,,1,No cite count available,https://doi.org/10.1007/1-4020-8147-2_14
"Money Relations, Ideology, and the Formation of a Cosmopolitan Elite at the Frontier of Transnational Capitalism: An Ethnographic Study of African Finance Professionals in Johannesburg",France Bourgouin,2013,https://link.springer.com/chapter/10.1057/9781137290557_11,No PDF available,,,1,No cite count available,https://doi.org/10.1057/9781137290557_11
Satcom Access in the Evolved Packet Core,"Mirko Cano,    Toon Norp,    Mariya Popova",2012,https://link.springer.com/chapter/10.1007/978-3-642-30607-5_10,No PDF available,,,1,1,https://doi.org/10.1007/978-3-642-30607-5_10
Light-Weight Currency Management Mechanisms in Mobile and Weakly-Connected Environments,"Uğur Çetintemel,    Peter J. Keleher",2002,https://link.springer.com/article/10.1023/A%3A1013377523199,https://link.springer.com/content/pdf/10.1023%2FA%3A1013377523199.pdf,,,1,3,https://doi.org/10.1023/A:1013377523199
Opportunistic Overlays: Efficient Content Delivery in Mobile Ad Hoc Networks,"Yuan Chen,    Karsten Schwan",2005,https://link.springer.com/chapter/10.1007/11587552_18,https://link.springer.com/content/pdf/10.1007%2F11587552_18.pdf,,,1,10,https://doi.org/10.1007/11587552_18
Accommodating Transient Connectivity in Ad Hoc and Mobile Settings,"Radu Handorean,    Christopher Gill,    Gruia-Catalin Roman",2004,https://link.springer.com/chapter/10.1007/978-3-540-24646-6_22,No PDF available,,,1,16,https://doi.org/10.1007/978-3-540-24646-6_22
DTN Based Dominating Set Routing for MANET in Heterogeneous Wireless Networking,"Hany Samuel,    Weihua Zhuang,    Bruno Preiss",2009,https://link.springer.com/article/10.1007/s11036-008-0131-8,https://link.springer.com/content/pdf/10.1007%2Fs11036-008-0131-8.pdf,,,1,19,https://doi.org/10.1007/s11036-008-0131-8
Software Framework for Managing Heterogeneity in Mobile Collaborative Systems,"Carlos D. Correa,    Ivan Marsic",2004,https://link.springer.com/article/10.1007/s10606-004-5065-5,https://link.springer.com/content/pdf/10.1007%2Fs10606-004-5065-5.pdf,,,1,2,https://doi.org/10.1007/s10606-004-5065-5
Enhanced Algorithm of TCP Performance on Handover in Wireless Internet Networks,"Dong Chun Lee,    Hong-Jin Kim,    Jae Young Koh",2004,https://link.springer.com/chapter/10.1007/978-3-540-30141-7_99,https://link.springer.com/content/pdf/10.1007%2F978-3-540-30141-7_99.pdf,,,1,No cite count available,https://doi.org/10.1007/978-3-540-30141-7_99
Quality of service support in a mobile environment: an approach based on tuple spaces,"G. S. Blair,    N. Davies,    A. Friday,    S. P. Wade",1997,https://link.springer.com/chapter/10.1007/978-0-387-35170-4_3,https://link.springer.com/content/pdf/10.1007%2F978-0-387-35170-4_3.pdf,,,1,3,https://doi.org/10.1007/978-0-387-35170-4_3
Information Agents for Mobile and Embedded Devices,"Tim Finin,    Anupam Joshi,    Lalana Kagal,    Olga Ratsimore…",2001,https://link.springer.com/chapter/10.1007/3-540-44799-7_30,No PDF available,,,1,6,https://doi.org/10.1007/3-540-44799-7_30
A Reliable Path Selection and Packet Forwarding Routing Protocol for Vehicular Ad hoc Networks,"Irshad Ahmed Abbasi,    Adnan Shahid Khan…",2018,https://link.springer.com/article/10.1186/s13638-018-1233-z,https://link.springer.com/content/pdf/10.1186%2Fs13638-018-1233-z.pdf,,,1,No cite count available,https://doi.org/10.1186/s13638-018-1233-z
Exploiting Regular Hot-Spots for Drive-thru Internet,"Jörg Ott,    Dirk Kutscher",2005,https://link.springer.com/chapter/10.1007/3-540-27301-8_18,https://link.springer.com/content/pdf/10.1007%2F3-540-27301-8_18.pdf,,,1,1,https://doi.org/10.1007/3-540-27301-8_18
Routing for disruption tolerant networks: taxonomy and design,"Thrasyvoulos Spyropoulos,    Rao Naveed Bin Rais,    Thierry Turletti…",2010,https://link.springer.com/article/10.1007/s11276-010-0276-9,https://link.springer.com/content/pdf/10.1007%2Fs11276-010-0276-9.pdf,,,1,162,https://doi.org/10.1007/s11276-010-0276-9
Novel concept of a modular hip implant could contribute to less implant failure in THA: a hypothesis,"Ronny Grunert,    Stefan Schleifenbaum,    Robert Möbius…",2018,https://link.springer.com/article/10.1186/s13037-017-0148-7,https://link.springer.com/content/pdf/10.1186%2Fs13037-017-0148-7.pdf,,,1,No cite count available,https://doi.org/10.1186/s13037-017-0148-7
Securitization and Development as Modes of Peripheralization in North-Eastern Pakistan,Antia Bouzas,2013,https://link.springer.com/chapter/10.1007/978-3-531-19018-1_4,No PDF available,,,1,No cite count available,https://doi.org/10.1007/978-3-531-19018-1_4
Cellular Architecture,"Patrick Traynor,    Patrick McDaniel…",2008,https://link.springer.com/chapter/10.1007/978-0-387-72442-3_3,No PDF available,,,1,No cite count available,https://doi.org/10.1007/978-0-387-72442-3_3
A Seamless Vertical Handover Approach,"Rastin Pries,    Dirk Staehle,    Phuoc Tran-Gia…",2008,https://link.springer.com/chapter/10.1007/978-3-540-89183-3_14,No PDF available,,,1,2,https://doi.org/10.1007/978-3-540-89183-3_14
An Evaluation of Routing Protocols for Vehicular Ad-Hoc Network Considering the Video Stream,"Imane Zaimi,    Zineb Squalli Houssaini,    Abdelali Boushaba…",2018,https://link.springer.com/article/10.1007/s11277-017-4903-y,https://link.springer.com/content/pdf/10.1007%2Fs11277-017-4903-y.pdf,,,1,2,https://doi.org/10.1007/s11277-017-4903-y
PatchPeer: A scalable video-on-demand streaming system in hybrid wireless mobile peer-to-peer networks,"Tai T. Do,    Kien A. Hua,    Ning Jiang,    Fuyu Liu",2009,https://link.springer.com/article/10.1007/s12083-008-0027-1,https://link.springer.com/content/pdf/10.1007%2Fs12083-008-0027-1.pdf,,,1,15,https://doi.org/10.1007/s12083-008-0027-1
Agent-based multimedia presentation and adaptation service,"Mohamed Ahmed,    Hamid Harroud,    Roger Impey…",2007,https://link.springer.com/article/10.1007/s11042-007-0113-z,https://link.springer.com/content/pdf/10.1007%2Fs11042-007-0113-z.pdf,,,1,No cite count available,https://doi.org/10.1007/s11042-007-0113-z
Mastering quality of service in GPRS/UMTS an overview,Salaheddine Maïza,2005,https://link.springer.com/article/10.1007/BF03219830,https://link.springer.com/content/pdf/10.1007%2FBF03219830.pdf,,,1,No cite count available,https://doi.org/10.1007/BF03219830
A Peer Ubiquitous Multi-agent Framework for Providing Nomadic Users with Adapted Information,"Angela Carrillo Ramos,    Jérôme Gensel…",2006,https://link.springer.com/chapter/10.1007/11925941_13,No PDF available,,,1,No cite count available,https://doi.org/10.1007/11925941_13
A Mobile Agent Framework for Digital Nomads,André P. Meyer,2003,https://link.springer.com/chapter/10.1007/978-1-4419-9200-0_7,No PDF available,,,1,No cite count available,https://doi.org/10.1007/978-1-4419-9200-0_7
Special Topics,Prof. Dr.-Ing. habil. Helmut Kipphan,2001,https://link.springer.com/chapter/10.1007/978-3-540-29900-4_13,No PDF available,,,1,No cite count available,https://doi.org/10.1007/978-3-540-29900-4_13
Considerations for Coordinating and Interfacing Fire Protection and Life Safety Systems,"David Jacoby,    David LeBlanc,    Jeffrey Tubbs…",2016,https://link.springer.com/chapter/10.1007/978-1-4939-2565-0_49,https://link.springer.com/content/pdf/10.1007%2F978-1-4939-2565-0_49.pdf,,,1,1,https://doi.org/10.1007/978-1-4939-2565-0_49
Architectural options for vehicle to grid communication,"F. Kupzog,    H. J. Bacher,    M. Glatz…",2011,https://link.springer.com/article/10.1007/s00502-011-0796-8,https://link.springer.com/content/pdf/10.1007%2Fs00502-011-0796-8.pdf,,,1,6,https://doi.org/10.1007/s00502-011-0796-8
"38th Annual Meeting of the International Society for Pediatric Neurosurgery, Jeju, South Korea, October 31 to November 4, 2010",No author available,2010,https://link.springer.com/article/10.1007/s00381-010-1224-9,https://link.springer.com/content/pdf/10.1007%2Fs00381-010-1224-9.pdf,,,1,No cite count available,https://doi.org/10.1007/s00381-010-1224-9
Mobile-to-Grid Middleware: Bridging the Gap Between Mobile and Grid Environments,"Hassan Jameel,    Umar Kalim,    Ali Sajjad…",2005,https://link.springer.com/chapter/10.1007/11508380_95,https://link.springer.com/content/pdf/10.1007%2F11508380_95.pdf,,,1,3,https://doi.org/10.1007/11508380_95
Selected abstracts,"P. P. Corkery,    B. F. Leek,    B. Caulfield,    M. Garrett…",2000,https://link.springer.com/article/10.1007/BF03173532,https://link.springer.com/content/pdf/10.1007%2FBF03173532.pdf,,,1,No cite count available,https://doi.org/10.1007/BF03173532
Fault Tolerance of Embryonic Algorithms in Mobile Networks,"David Lowe,    Amir Mujkanovic…",2010,https://link.springer.com/chapter/10.1007/978-3-642-15323-5_5,No PDF available,,,1,No cite count available,https://doi.org/10.1007/978-3-642-15323-5_5
D,André Heck,2004,https://link.springer.com/chapter/10.1007/978-0-306-48603-6_4,No PDF available,,,1,No cite count available,https://doi.org/10.1007/978-0-306-48603-6_4
"Material Experiences, 1933–45",Chloe Paver,2018,https://link.springer.com/chapter/10.1007/978-3-319-77084-0_3,No PDF available,,,1,No cite count available,https://doi.org/10.1007/978-3-319-77084-0_3
Towards Distributed Workflow Enactment with Itineraries and Mobile Agent Management,"Seng Wai Loke,    Arkady Zaslavsky",2001,https://link.springer.com/chapter/10.1007/3-540-45370-9_17,No PDF available,,,1,5,https://doi.org/10.1007/3-540-45370-9_17
Stigmergic Service Composition and Adaptation in Mobile Environments,"Andrei Palade,    Christian Cabrera,    Gary White,    Siobhán Clarke",2018,https://link.springer.com/chapter/10.1007/978-3-030-03596-9_45,https://link.springer.com/content/pdf/10.1007%2F978-3-030-03596-9_45.pdf,,,1,No cite count available,https://doi.org/10.1007/978-3-030-03596-9_45
Special issue editorial: Mobile computing applications,Dorota M. Huizinga,1997,https://link.springer.com/article/10.1007/BF01299646,https://link.springer.com/content/pdf/10.1007%2FBF01299646.pdf,,,1,No cite count available,https://doi.org/10.1007/BF01299646
Low Latency Vertical Handover Using MIH L2-Trigger Algorithm in Mobile IP Networks,"Jin-Man Kim,    Jong-Wook Jang",2007,https://link.springer.com/chapter/10.1007/978-3-540-74742-0_63,No PDF available,,,1,3,https://doi.org/10.1007/978-3-540-74742-0_63
Performance analysis of cache consistency strategies for multi-hop wireless networks,"Wenzhong Li,    Edward Chan,    Daoxu Chen,    Sanglu Lu",2012,https://link.springer.com/article/10.1007/s11227-012-0791-9,https://link.springer.com/content/pdf/10.1007%2Fs11227-012-0791-9.pdf,,,1,No cite count available,https://doi.org/10.1007/s11227-012-0791-9
ESICM LIVES 2016: part one,"L. Bos,    L. Schouten,    L. van Vught,    M. Wiewel…",2016,https://link.springer.com/article/10.1186/s40635-016-0098-x,https://link.springer.com/content/pdf/10.1186%2Fs40635-016-0098-x.pdf,,,1,3,https://doi.org/10.1186/s40635-016-0098-x
Fault Tolerance Based on Neural Networks for the Intelligent Distributed Framework,"Michael Angelo G. Salvo,    Jaewan Lee,    Jung-sik Lee",2009,https://link.springer.com/chapter/10.1007/978-3-642-03156-4_9,No PDF available,,,1,No cite count available,https://doi.org/10.1007/978-3-642-03156-4_9
An approach for an adaptive visualization in a mobile environment,"Luc Neumann,    Alberto B. Raposo",1997,https://link.springer.com/chapter/10.1007/BFb0000359,No PDF available,,,1,No cite count available,https://doi.org/10.1007/BFb0000359
Cirse 2013,No author available,2013,https://link.springer.com/article/10.1007/s00270-013-0701-4,https://link.springer.com/content/pdf/10.1007%2Fs00270-013-0701-4.pdf,,,1,No cite count available,https://doi.org/10.1007/s00270-013-0701-4
Many Aspects of Reliabilities in a Distributed Mobile Messaging Middleware over JMS,Eiko Yoneki,2003,https://link.springer.com/chapter/10.1007/978-3-540-39962-9_91,No PDF available,,,1,No cite count available,https://doi.org/10.1007/978-3-540-39962-9_91
Return to Empirical Social Reality,G. Reza Azarian,2005,https://link.springer.com/chapter/10.1057/9780230596719_2,No PDF available,,,1,No cite count available,https://doi.org/10.1057/9780230596719_2
Service Discovery in Agent-Based Pervasive Computing Environments,"Olga Ratsimor,    Dipanjan Chakraborty,    Anupam Joshi…",2004,https://link.springer.com/article/10.1023/B%3AMONE.0000042506.96219.cc,https://link.springer.com/content/pdf/10.1023%2FB%3AMONE.0000042506.96219.cc.pdf,,,1,19,https://doi.org/10.1023/B:MONE.0000042506.96219.cc
Places to stay on the move: Software architectures for mobile user interfaces,"Alan Dix,    Devina Ramduny,    Tom Rodden,    Nigel Davies",2000,https://link.springer.com/article/10.1007/BF01324124,https://link.springer.com/content/pdf/10.1007%2FBF01324124.pdf,,,1,No cite count available,https://doi.org/10.1007/BF01324124
An Agent-Based Connection Management Protocol for Ad Hoc Wireless Networks,"Romit Roy Choudhury,    Krishna Paul…",2002,https://link.springer.com/article/10.1023/A%3A1021164222319,https://link.springer.com/content/pdf/10.1023%2FA%3A1021164222319.pdf,,,1,2,https://doi.org/10.1023/A:1021164222319
Survey on Monitoring and Quality Controlling of the Mobile Biosignal Delivery,"Pravin A. Pawar,    Damodar R. Edla…",2017,https://link.springer.com/article/10.1007/s12539-017-0263-2,https://link.springer.com/content/pdf/10.1007%2Fs12539-017-0263-2.pdf,,,1,No cite count available,https://doi.org/10.1007/s12539-017-0263-2
Using Coordination Middleware for Location-Aware Computing: A Lime Case Study,"Amy L. Murphy,    Gian Pietro Picco",2004,https://link.springer.com/chapter/10.1007/978-3-540-24634-3_20,No PDF available,,,1,4,https://doi.org/10.1007/978-3-540-24634-3_20
How to consider engineered nanomaterials in major accident regulations?,"Bernd Nowack,    Nicole C Mueller,    Harald F Krug,    Peter Wick",2014,https://link.springer.com/article/10.1186/2190-4715-26-2,https://link.springer.com/content/pdf/10.1186%2F2190-4715-26-2.pdf,,,1,20,https://doi.org/10.1186/2190-4715-26-2
